,neg,neu,pos
i come against any form of anxiety and failure i shall not be afraid of my exams the power of god is working for me now and always okan mi bale,0.026000000536441803,0.12300000339746475,0.8510000109672546
its crazy how 56 years ago we had messi ronaldo neymar hazard bale sanchez etc as the best wingers in the world all of them were easily better than any winger itw rn,0.02500000037252903,0.1679999977350235,0.8069999814033508
we still have it under control arsenal is winning the league e lo fokan bale,0.008999999612569809,0.24400000274181366,0.746999979019165
in the last 56 seasons weve lost top players like ronaldo bale sergio ramos casemiro varane isco and marcelo and we are still where we are today winning trophies the clubs team management is top notch actually,0.05000000074505806,0.2329999953508377,0.7160000205039978
dear lord increase my business i want to be opening new bale weekly not monthly anymore from my heart to gods ears,0.04100000113248825,0.24899999797344208,0.7110000252723694
ma mummy ni thana name tho pillusthuna bale cute ga react ithundhi amma,0.05900000035762787,0.6759999990463257,0.26499998569488525
if kane son bale all played together at their prime theyd honestly clear msn,0.03500000014901161,0.7020000219345093,0.2619999945163727
grace bale 57 2025 taylor county unfortunately grace recently suffered a torn acl and lateral meniscus and will sideline her for a while prayers up for a speedy recovery and knowing this young lady she will return better than ever,0.3499999940395355,0.4230000078678131,0.22599999606609344
im waiting for the day david de geas long range passes will fall on rashfords legs and lead to goal okan gbogbo yin o ni bale yall keep pretending youre not seeing his passing ability yet,0.24199999868869781,0.5649999976158142,0.19300000369548798
if you could choose one player to have an injuryfree career ronaldo gareth bale thiago alcântara marco reus ousmane dembélé abou diaby daniel sturridge micheal essien jack wilshere arjen robben eden hazard who would you pick,0.07999999821186066,0.7639999985694885,0.15600000321865082
gareth bale and eden hazard,0.023000000044703484,0.8669999837875366,0.10999999940395355
watching iplento ivala srh cheer leaders ki karchela unna thella tholupeefect sized sallu bale ooputhunnaru have you ever fàppèd for cheer leaders in ipl,0.05000000074505806,0.8460000157356262,0.10400000214576721
killerman starring bale logusi boris karlon with helena chandler,0.017999999225139618,0.9049999713897705,0.07699999958276749
bale diaby and now openda you know whats gonna happen after 70th min,0.029999999329447746,0.9200000166893005,0.05000000074505806
when hook up done fail themthey go start darayo collection on whatsapp okan e oni bale,0.44699999690055847,0.5090000033378601,0.04399999976158142
you can pick only two wingers in their prime for your team who are you choosing mo salah marc overmars sadio mané leroy sané gareth bale arjen robben raheem sterling brian laudrup david beckham ryan giggs jadon sancho luis figo eden,0.24400000274181366,0.7139999866485596,0.041999999433755875
ghosted by a guy i met at church call that a christian bale,0.4129999876022339,0.5659999847412109,0.020999999716877937
this vgly thing which school did you attend youre just destroying your reputation and that of your family because of a drug lord okan gbogbo yin oni bale se werey go school you dey shunt am dey jump fence 70 year old girl see your life now,0.921999990940094,0.07199999690055847,0.006000000052154064
