,neg,neu,pos
only thing coming home is harry kane in a body bag #allez ,0.3400000035762787,0.6039999723434448,0.0560000017285347
you can tell harry kane plays for spurs,0.23499999940395355,0.7089999914169312,0.0560000017285347
when england said its coming home they meant the ball harry kane just skied from the penalty,0.3019999861717224,0.6430000066757202,0.054999999701976776
harry kane better get the beating from the press soz,0.4580000042915344,0.4880000054836273,0.05400000140070915
harry kane from the spot ,0.024000000208616257,0.9229999780654907,0.05400000140070915
england gonna see harry kanes penalty ball on their flight home,0.16099999845027924,0.7860000133514404,0.05299999937415123
harry kane thought he was kicking a 45 in tuam stadium,0.2669999897480011,0.6800000071525574,0.05299999937415123
nothing harry kane wont do to prove he isnt a penalty merchant,0.5950000286102295,0.3529999852180481,0.052000001072883606
just said on 5live harry kane has gone straight down the tunnel jordan henderson has stepped up to do the interviews,0.03200000151991844,0.9179999828338623,0.05000000074505806
coming up next the vastly overrated harry kane loses to the appropriately highly rated kylian mbappé,0.4000000059604645,0.5509999990463257,0.04899999871850014
phil foden asked his teammates which car he should buy harry kane answered get a chevrolet and jordan pick ford,0.03500000014901161,0.9179999828338623,0.04699999839067459
letting down england harry kane truly immortalized amongst the likes of rooney beckham etc now,0.49000000953674316,0.4620000123977661,0.04699999839067459
i wanna see what the media do with harry kane,0.08699999749660492,0.8669999837875366,0.04600000008940697
france played cte ball in the 2nd half but harry kane smoked a pen and thats all she wrote,0.289000004529953,0.6650000214576721,0.04600000008940697
harry kane fucks off down the tunnel and henderson is applauding the fans all round the ground tell me again why kane is captain,0.6489999890327454,0.3050000071525574,0.04500000178813934
i knew harry kane will miss that pen france go qualify,0.3840000033378601,0.5709999799728394,0.04500000178813934
harry kanes penalty kick just came to rest by blasting through a window of a dave busters in louisville kentucky,0.3449999988079071,0.6100000143051147,0.04399999976158142
i believe the official term for what harry kane did there on the penalty is blast the living shit out of that ball into the net,0.6480000019073486,0.30799999833106995,0.04399999976158142
france wins and yall better not come for marcus rashford cause harry kane is the one that let yalls team down,0.6439999938011169,0.3109999895095825,0.04399999976158142
harry kane send his penalty to ohio ,0.15399999916553497,0.8040000200271606,0.0430000014603138
what is your name sabe de kane harry kane,0.05999999865889549,0.8970000147819519,0.0430000014603138
harry kane wth ,0.3529999852180481,0.6039999723434448,0.0430000014603138
harry kane will score goals but you wont know what those goals are for,0.3499999940395355,0.6079999804496765,0.041999999433755875
you want to catch a harry kane penalty he always goes for power ,0.1899999976158142,0.7680000066757202,0.041999999433755875
cant believe it absolutely gutted poor harry kane football is cruel we knew it would be close and it was why is it always penalties still love this team and this manager they were good tonight it just didnt happen we go again in 2024,0.8429999947547913,0.11599999666213989,0.04100000113248825
space station will do a burn at the top of the hour to evade harry kanes penalty kick,0.3529999852180481,0.6060000061988831,0.04100000113248825
harry kane do ein big head go play penalty like 2010 asamoah gyan,0.3569999933242798,0.6019999980926514,0.04100000113248825
harry kane ever missed a penalty naa i no really dey remember,0.3880000114440918,0.5709999799728394,0.04100000113248825
perhaps harry kane missed that penalty because he respects tradition,0.29600000381469727,0.6639999747276306,0.03999999910593033
breaking harry kane to be made special envoy to rwanda england plane to reroute on way home from qatar,0.01600000075995922,0.9449999928474426,0.039000000804662704
lets see how english press handles harry kane ,0.057999998331069946,0.9020000100135803,0.039000000804662704
that harry kanes ball just landed on my roof,0.6899999976158142,0.2709999978542328,0.039000000804662704
if any fans go for harry kane they need to give their heads a wobble proud to be english tonight even in a defeat,0.7099999785423279,0.25200000405311584,0.03799999877810478
harry kane literally sent the ball to bahrain ,0.2549999952316284,0.7070000171661377,0.03799999877810478
literally the only time ill put my hatred for spurs aside is when harry kanes taking a pen for england,0.6570000052452087,0.3050000071525574,0.03799999877810478
rashford and saka both had more npg than harry kane but werent on the pitch to see the game out ,0.29100000858306885,0.671999990940094,0.03700000047683716
harry kane has skied the penalty lmaooooooooooooooooooooooooooooooooooooo,0.531000018119812,0.4320000112056732,0.03700000047683716
when england said it is coming home they were talking about harry kane penalty,0.2919999957084656,0.671999990940094,0.035999998450279236
got to feel for harry kane nobody in the country id rather have on that penalty scoring one before makes it so difficult for the second one genuinely a good allround performance france just too clinical thats the difference,0.7760000228881836,0.1889999955892563,0.03500000014901161
how is one of the best moments of your life followed by your worst within minutes i know harry kane is gonna need therapy after this #englandvsfrance,0.8180000185966492,0.1469999998807907,0.03500000014901161
harry kane x nasa collab wont land until 2026,0.06400000303983688,0.9010000228881836,0.03500000014901161
scenes where harry kane was a ghanaian ,0.03999999910593033,0.9259999990463257,0.03400000184774399
harry kane sent the ball back to england ,0.125,0.8410000205039978,0.03400000184774399
harry kane mavericks missing a freebie shot in the clutch,0.4620000123977661,0.5040000081062317,0.03400000184774399
harry kane and asamoah gyan what be the difference kai,0.04699999839067459,0.9200000166893005,0.03400000184774399
england v france lets see if harry kane gets the same crap saka got for missing a pen #worldcup,0.5080000162124634,0.45899999141693115,0.032999999821186066
i was out with my friend at the mall and he started coughing so i asked him what was wrong and he said im harry kane i immediately dialed 911 to save him because i knew he was choking,0.5830000042915344,0.38499999046325684,0.032999999821186066
upamecano literally said get up you cunt to harry kane hahaha my fucking cb,0.8360000252723694,0.12999999523162842,0.032999999821186066
breaking harry kane misses penalty france lead 21 in the 82nd minute,0.15700000524520874,0.8100000023841858,0.03200000151991844
you can take harry kane out of tottenham but you can never take tottenham out of harry kane,0.382999986410141,0.5870000123977661,0.029999999329447746
harry kane took his id like to be an nfl kicker bit a little too seriously,0.492000013589859,0.4779999852180481,0.029999999329447746
harry kane baba blued the penalty away to chatham house,0.4009999930858612,0.5690000057220459,0.029999999329447746
harryfic miss world cup campaign ends in pain for harry kane kanenot believe it,0.7129999995231628,0.25699999928474426,0.029999999329447746
harry kane just like me fr he fumbled hard,0.7179999947547913,0.25200000405311584,0.029999999329447746
will harry kane get the same treatment saka got since we are all talking about missed penalties #englandvsfrance euros mbappe giroud,0.35100001096725464,0.6190000176429749,0.029999999329447746
harry kane did not deserve one bit of this been a sensational player for his country heartbreaking,0.8479999899864197,0.12399999797344208,0.028999999165534973
i hope the bbc sports graphics guy is preparing the harry kane graphic to properly announce englands defeat leave saka alone,0.6079999804496765,0.3630000054836273,0.028999999165534973
mason mount did all the world just for overrated harry kane to mess things up lmao,0.6650000214576721,0.3059999942779541,0.028999999165534973
the ball from harry kanes penalty just broke my window ffs,0.7799999713897705,0.19099999964237213,0.028999999165534973
shock as harry kane wears g string on top of head outside university hostels,0.32899999618530273,0.6420000195503235,0.028999999165534973
piers morgan about to take his frustrations on harry kane,0.3240000009536743,0.6470000147819519,0.028999999165534973
lmfaooo harry kane more like harry kant score the fucking penalty hahahaha,0.8149999976158142,0.15600000321865082,0.028999999165534973
harry kane has dodged another trophy ,0.6710000038146973,0.3009999990463257,0.02800000086426735
i am in absolutely no doubt that the energy displayed towards saka rashford missing penalties will not be the same for harry kane,0.6620000004768372,0.3100000023841858,0.02800000086426735
mason mount comes on wins a penalty and harry kane misses mounts luck is awful,0.7350000143051147,0.2370000034570694,0.02800000086426735
will harry kane get slates like bukayo saka did,0.17499999701976776,0.7979999780654907,0.027000000700354576
harry kane always dey get penalties in tournaments ei new penaldo,0.5770000219345093,0.3959999978542328,0.027000000700354576
i bet any money harry kane wont get anywhere near the same abuse saka rashford and sancho got,0.7450000047683716,0.2290000021457672,0.026000000536441803
harry kane went down for that penalty claim like woody from toy story,0.5680000185966492,0.4059999883174896,0.026000000536441803
you can take harry kane out of tottenham but you cant take the tottenham out of harry kane,0.40400001406669617,0.5699999928474426,0.026000000536441803
bbc sport should put harry kanes poster ft if they lose but watch them put saka or jude bellingham,0.2919999957084656,0.6819999814033508,0.026000000536441803
harry kane will miss the penalty,0.546999990940094,0.4269999861717224,0.026000000536441803
hiya if orion is knocked off course you can invoice harry kane for the damages,0.4560000002384186,0.5180000066757202,0.026000000536441803
na harry kane don miss penalty now o i no wan see saka or any black man picture for front covers tomorrow,0.5569999814033508,0.4180000126361847,0.02500000037252903
morocco 1 0 portugal england 1 2 france harry kane to miss penalty stake your savings you saw it here first ,0.5329999923706055,0.44200000166893005,0.02500000037252903
harry kane will never lift anything in his life,0.8080000281333923,0.16699999570846558,0.02500000037252903
told you lot for the past 3 years harry kane cant handle big pressure moments and games its a fact at this point,0.6899999976158142,0.28600001335144043,0.024000000208616257
i hope we as a nation dont attack hate on harry kane he already plays for tottenham hes got it bad enough,0.7519999742507935,0.22499999403953552,0.024000000208616257
english fans are going to roast harry kane,0.6830000281333923,0.2919999957084656,0.024000000208616257
harry kane looks like if you told someone to draw a british person from memory,0.3799999952316284,0.5960000157356262,0.024000000208616257
thats harry kanes career done a bottling individual,0.5019999742507935,0.4749999940395355,0.023000000044703484
actually heartbroken because everyone in this pub im in is giving harry kane every bit of abuse known to man i fucking love that man more than my family and its breaking me to see him like this,0.9039999842643738,0.0729999989271164,0.023000000044703484
england better give harry kane the same treatment they gave saka and sancho for missing their pks at the euros,0.6340000033378601,0.34299999475479126,0.023000000044703484
harry kane will never lift a trophy,0.7879999876022339,0.1899999976158142,0.023000000044703484
harry kane penalty on its way to kenya from qatar,0.31700000166893005,0.6600000262260437,0.023000000044703484
harry kane scores that if its for spurs he let his country down,0.7609999775886536,0.21699999272823334,0.02199999988079071
harry kane you can take man from spurs but you cant take spurs from the man,0.4309999942779541,0.5460000038146973,0.02199999988079071
watch bbc sport use rashfords picture for england loss instead of harry kanes,0.4129999876022339,0.5659999847412109,0.02199999988079071
england better give harry kane the same treatment they gave saka and sancho for missing their penalties at the euros,0.6840000152587891,0.2939999997615814,0.02199999988079071
to be fair to harry kane he just wasnt at it tonight reportedly got into a fight at the hotel last night and put the guy over the bar,0.4650000035762787,0.5130000114440918,0.02199999988079071
really hope harry kane doesnt suffer any racist abuse online,0.7329999804496765,0.24500000476837158,0.02199999988079071
lets all just remember it was harry kane that missed that pen,0.5740000009536743,0.4050000011920929,0.020999999716877937
lets see if harry kane gets constant chants about him for missing a penalty,0.5329999923706055,0.44600000977516174,0.020999999716877937
gareth southgate is not a big game manager and harry kane is not a big game player,0.7070000171661377,0.2720000147819519,0.020999999716877937
englands world cup is over after suffering a 21 defeat against france harry kane missed a late penalty which would have levelled the game #bbcworldcup #bbcfootball,0.6470000147819519,0.3319999873638153,0.020999999716877937
lets see if harry kane will get the same treatment saka rashford and sancho got for missing penalties,0.44600000977516174,0.5329999923706055,0.020999999716877937
harry kane may actually be allergic to trophies,0.7080000042915344,0.2709999978542328,0.020999999716877937
baby jet sef hit bar harry kane is finished,0.6970000267028809,0.28200000524520874,0.020999999716877937
a devastating defeat for england after harry kanes missed penalty at least i can support morocco in the semifinal now ,0.8399999737739563,0.14000000059604645,0.019999999552965164
harry kane swears on his daughters life he made that penalty,0.7789999842643738,0.20000000298023224,0.019999999552965164
fuck france fuck that ref fuck hybe fuck harry kane love my saka,0.8899999856948853,0.09000000357627869,0.019999999552965164
harry kane of spurs more like hurricane of shit,0.7419999837875366,0.23899999260902405,0.019999999552965164
harry kanes penalty may have hit portugals plane flying to lisbon,0.3919999897480011,0.5879999995231628,0.019999999552965164
cristian romero on potentially facing harry kane footballerslives i would be very sorry for him if i came up against him i would hit him with a lot when i play for my team i want to kill in a good way the rival opponent i have said to harry for sure ill tear it up,0.8790000081062317,0.10199999809265137,0.019999999552965164
harry kane missed the penalty,0.6159999966621399,0.3630000054836273,0.019999999552965164
i wonder if harry kane will receive the same treatment of saka rashford and sancho after missing that penalty,0.42899999022483826,0.5519999861717224,0.01899999938905239
lets see if the media slate the so called golden boy harry kane the same way they did to saka rashford and sancho for missing penalties in the euros,0.5479999780654907,0.43299999833106995,0.01899999938905239
harry kane bottling once again not suprised by a spurs player,0.6970000267028809,0.2840000092983246,0.01899999938905239
still cant believe harry kane shot the ball like a stinger missile shooting down a harrier,0.5889999866485596,0.3930000066757202,0.01899999938905239
wonder if daily mail england will have the same you let your country down energy for harry kane as they did saka rashford sancho,0.6129999756813049,0.36899998784065247,0.01899999938905239
harry kane will never be world class,0.7940000295639038,0.18700000643730164,0.01899999938905239
even if you add another million minutes harry kane will still miss another penalty,0.6460000276565552,0.335999995470047,0.017999999225139618
you just cant take tottenham hotspurs out of harry kane mans never getting closer to any trophy ever,0.7799999713897705,0.2029999941587448,0.017999999225139618
reports say that the harry kane penalty is still in the air be careful going outdoors today,0.41600000858306885,0.5669999718666077,0.017999999225139618
olivier giroud really highlights how overrated harry kane is,0.7350000143051147,0.24699999392032623,0.017999999225139618
a full elland road giving harry kane abuse in may then ,0.5090000033378601,0.4729999899864197,0.017999999225139618
missing ball information last seen waz on harry kane foot if you see it make a quick call,0.3070000112056732,0.675000011920929,0.017999999225139618
harry kane has been at tottenham hotspur for too long spurs dna,0.49399998784065247,0.48899999260902405,0.017999999225139618
thats spursy from harry kane bottling at best,0.7070000171661377,0.2759999930858612,0.017999999225139618
it was harry kane who missed the penalty but we all know whose face the english media will put on their cover page tomorrow,0.5490000247955322,0.4339999854564667,0.017000000923871994
mason mount wins the penalty and harry kane misses the penalty heart breaking and england lose their chance to equalise #engfra,0.7390000224113464,0.24400000274181366,0.017000000923871994
harry kane is a true choke artist every time you think hes figured out a way to win a trophy he pulls something out the bag to stop himself,0.8479999899864197,0.13500000536441803,0.017000000923871994
watch how the british media will protect harry kane imagine it was saka or rashford that missed that goodbye england its not coming home,0.6639999747276306,0.3190000057220459,0.017000000923871994
if harry kane turns up tonight graeme souness hes only scored vs senegal assisted three in the group stages and put players through on goal at least another three times sorry graeme,0.6610000133514404,0.32199999690055847,0.017000000923871994
i want the same energy given to harry kane just like how bukayo saka jadon sancho and marcus rashford were treated who do you racists want to blame now,0.703000009059906,0.2800000011920929,0.017000000923871994
i swear harry kane is allergic to trophies,0.8349999785423279,0.14900000393390656,0.017000000923871994
reports coming in that the burj khalifa has been hit by the harry kane penalty attempt,0.24699999392032623,0.7350000143051147,0.017000000923871994
the real enemy is harry kane,0.7720000147819519,0.210999995470047,0.017000000923871994
tottenham fans really need to get behind harry kane now because that will hurt him,0.7519999742507935,0.23199999332427979,0.01600000075995922
harry kane haters what we wearing to his hater party for bottling again,0.7419999837875366,0.24300000071525574,0.01600000075995922
i hope the english fans use same energy they used to racially abuse saka for missing his penalty at the euros on harry kane too,0.7549999952316284,0.2290000021457672,0.01600000075995922
as harry kane was taking that penalty i couldve sworn i saw the ghost of his emaciated irish forefathers push the ball askew with their hungry breath,0.8199999928474426,0.164000004529953,0.01600000075995922
harry kanes bollocks are made of concrete,0.8180000185966492,0.16599999368190765,0.01600000075995922
harry kane has got spurs running through his veins big time bottle job ,0.8090000152587891,0.17499999701976776,0.01600000075995922
lets see who they use as headline after harry kane missed the penalty,0.44999998807907104,0.5339999794960022,0.01600000075995922
harry kane quality footballer but a the biggest bottlejob,0.8600000143051147,0.12300000339746475,0.01600000075995922
not people saying harry kane kicked the ball back to london ,0.47200000286102295,0.5120000243186951,0.01600000075995922
lets see if harry kane gets the same treatment as those young black lads did for missing that ,0.5429999828338623,0.4429999887943268,0.014999999664723873
harry kane wont receive half the amount of abuse from the english media that rashford and saka had to witness,0.8149999976158142,0.17100000381469727,0.014999999664723873
i hope harry kane gets the same treatment these guys gave saka sancho at the euros,0.7839999794960022,0.20100000500679016,0.014999999664723873
club football will peak with new chants harry kane let the country down try us at eithed wena,0.7760000228881836,0.20900000631809235,0.014999999664723873
if i was british harry kane house would be burnt flat to the ground bruhh this is unforgivable ,0.8840000033378601,0.10100000351667404,0.014999999664723873
it seems harry kane is allergic to trophies,0.7179999947547913,0.2669999897480011,0.014999999664723873
loooooooooool harry kane you are here for penalties and you sky a clutch penalty to bring england back into the game bottle gene because he plays for a bottle club,0.796999990940094,0.18700000643730164,0.014999999664723873
is harry kane actually the problem with england and spurs my column,0.5339999794960022,0.44999998807907104,0.014999999664723873
harry kane is so slow even maya jama would gap him,0.8029999732971191,0.18199999630451202,0.014999999664723873
fuck harry kane,0.8740000128746033,0.11100000143051147,0.014999999664723873
harry kane thinking fuck off hugo where was that save the last 18 months,0.8050000071525574,0.1809999942779541,0.014000000432133675
i want to see harry kanes face plastered on every publication for missing that goal,0.859000027179718,0.12700000405311584,0.014000000432133675
harry kane john stones harry maguire we lost because the cadaans,0.6579999923706055,0.328000009059906,0.014000000432133675
harry kane has been watching too much messi videos no wonder he missed the penalty,0.7419999837875366,0.24400000274181366,0.014000000432133675
cant wait to see the racist harry kane tweets after the game ,0.8769999742507935,0.10899999737739563,0.014000000432133675
that penalty miss will be in the first graph of harry kanes obituary tough stuff being the captain of a relegated tottenham spurs club will be in the first few graphs too #coys,0.7260000109672546,0.25999999046325684,0.014000000432133675
he wastes sakas assists but not fodens harry kane i know what you are,0.7519999742507935,0.23399999737739563,0.014000000432133675
i want to hear harry kane you let the country down ringing around the emirates,0.8100000023841858,0.1770000010728836,0.013000000268220901
unfair unfair result england have been the better side and they could not take their chances harry kane its on you my friend you dont bottle the game like that feeling sad for my starboy thought hed redeem himself in this world cup and boy did he try his hardest,0.8769999742507935,0.10999999940395355,0.013000000268220901
wonder if harry kane will get the kind of abuse from england fans that saka did for the euro final ,0.6209999918937683,0.3659999966621399,0.013000000268220901
shocking miss from harry kane misses the opportunity to take england level eiiishhh #fifaworldcup #engfra,0.8629999756813049,0.12399999797344208,0.013000000268220901
please dont racially abuse harry kane ,0.7400000095367432,0.24799999594688416,0.013000000268220901
i hope harry kane receives the same treatment that rashford sancho and saka got for missing their penalties in the euro 2020,0.824999988079071,0.16300000250339508,0.012000000104308128
harry kane cost you the world cup remember that not saka rashford or sterling england v france #engfra,0.7649999856948853,0.22300000488758087,0.012000000104308128
so will harry kane be getting the same treatment from the england fans and media as saka did or is he not black enough for that,0.4129999876022339,0.5759999752044678,0.012000000104308128
breaking harry kanes penalty scheduled to land at heathrow has been diverted to gatwick due to freezing fog #fraeng #englandvsfrance #qatar2022,0.4490000009536743,0.5389999747276306,0.012000000104308128
this is why harry kane deserves to retire without a trophy,0.8320000171661377,0.1550000011920929,0.012000000104308128
let me guess marcus rashford will get racist abuse but not harry kane the country deserves to lose well done france ,0.8519999980926514,0.13600000739097595,0.012000000104308128
imagine if harry kane was black and missed the penalty in the 84th minute,0.621999979019165,0.3659999966621399,0.012000000104308128
harry kane has let down all the pounds given to the var officials ,0.7409999966621399,0.24699999392032623,0.012000000104308128
a second penalty you cant be serious this fraud harry kane is excited,0.8809999823570251,0.10700000077486038,0.012000000104308128
harry kane is a paedophile,0.8640000224113464,0.12399999797344208,0.012000000104308128
you can take harry kane out of tottenham but you cant take the tottenham out of harry kane serial bottler,0.7419999837875366,0.24699999392032623,0.010999999940395355
crazy thing is rashford will get attacked when it was harry kane who let his country down,0.7699999809265137,0.21899999678134918,0.010999999940395355
oh my god they broke harry kane they broke harry kane they broke harry kane,0.8500000238418579,0.13899999856948853,0.010999999940395355
ive been waiting 18 months to tweet something like harry kane let his country down,0.8159999847412109,0.17299999296665192,0.010999999940395355
saka missed a penalty and they all blamed him now its harry kane who has missed lets wait for their reactions,0.7620000243186951,0.22699999809265137,0.010999999940395355
harry kane gareth southgate are frauds,0.8759999871253967,0.1120000034570694,0.010999999940395355
harry kane just hate trophies,0.8629999756813049,0.12600000202655792,0.010999999940395355
harry kane does nothing all tournament tbh just penalties missed penalties and vibes,0.828000009059906,0.16099999845027924,0.010999999940395355
if the euros has taught me anything this is around the time we should start racially abusing harry kane,0.8330000042915344,0.15700000524520874,0.009999999776482582
harry kane is a typical tottenham player feels like he is allergic to trophies,0.8659999966621399,0.12399999797344208,0.009999999776482582
