,neg,neu,pos
harry kane thats a sexy goal and i love you and i never doubted you xx,0.004999999888241291,0.01600000075995922,0.9789999723434448
harry kane has been brilliant so far #engfra,0.003000000026077032,0.020999999716877937,0.9760000109672546
its coming home ladsss lets go ingerland harry kane is the best striker in the world ,0.003000000026077032,0.02199999988079071,0.9760000109672546
what a perfect example of performance under pressure i am so in awe of harry kane,0.00800000037997961,0.017999999225139618,0.9750000238418579
harry kane has create a history for himself fantastic ,0.003000000026077032,0.023000000044703484,0.9739999771118164
the only time i will ever be happy to see #arsenal and tottenham working together great penalty from harry kane ,0.004000000189989805,0.027000000700354576,0.968999981880188
seeing harry kane stand there and congratulate every french player give lloris a big hug despite an unimaginably big lump in his throat what a man love you come home to n17 and lets go win a trophy #coys,0.004999999888241291,0.028999999165534973,0.9660000205039978
lovely drop goal for harry kane 3 points for england,0.003000000026077032,0.03400000184774399,0.9629999995231628
absolutely class from harry kane with that second penalty kick paying homage to one of his predecessors david beckham watching in the stands #toplad,0.004999999888241291,0.03700000047683716,0.9580000042915344
heartbreak the boys did us super proud no talk on the ref ever the game is the game harry kane balls of steel dont feel like you let us down you are the best of 60billion that we trust we love you boys no matter what southgate amazing again ,0.012000000104308128,0.03099999949336052,0.9570000171661377
excellent fg from harry kane,0.003000000026077032,0.041999999433755875,0.9549999833106995
everyone should remember all the great goals harry kane has scored one miss does not detract from that he stood up i personally will always admire him for that ,0.007000000216066837,0.03999999910593033,0.953000009059906
harry kane perfect for spurs both bottlers theyre a perfect fit ,0.004999999888241291,0.04399999976158142,0.9520000219345093
i fucking love you harry kane,0.017999999225139618,0.03500000014901161,0.9470000267028809
harry kane doesnt usually get the appreciation he deserves but hes a very special player extremely consistent for both club and country #fifaworldcup,0.007000000216066837,0.04699999839067459,0.9459999799728394
harry kane is our best defender midfielder and striker x,0.004000000189989805,0.052000001072883606,0.9440000057220459
richarlison and harry kane two of the best strikers in the world ,0.004999999888241291,0.05400000140070915,0.9409999847412109
harry kane i love you,0.006000000052154064,0.05400000140070915,0.9399999976158142
harry kane the greatest ever to do it,0.00800000037997961,0.06400000303983688,0.9279999732971191
be proud of these players and protect them no bullshit harry kane is will be an english footballing legend,0.008999999612569809,0.0729999989271164,0.9179999828338623
anyone abusing harry kane needs their heads checking well played england best ive seen the boys play in years #eng,0.026000000536441803,0.0689999982714653,0.906000018119812
harry kane represents tottenham so well on the international stage,0.004000000189989805,0.09200000017881393,0.9039999842643738
ill die on the hill that harry kane is the best striker in the world,0.024000000208616257,0.09099999815225601,0.8849999904632568
im so glad this has happened to harry kane ,0.01600000075995922,0.10199999809265137,0.8820000290870667
harry kane is a great player and a great man and came up short tonight happens in sport we can all give him love and respect still,0.03099999949336052,0.08799999952316284,0.8809999823570251
harry kane is now officially englands alltime top scorer level with wayne rooney on 53 goals historic moment #engfra,0.003000000026077032,0.12300000339746475,0.8740000128746033
harry kane stuck around to shake hands with the french captain he took responsibility i have absolutely nothing but respect for him,0.026000000536441803,0.12399999797344208,0.8489999771118164
cristiano ronaldo take note of harry kane thats a true professional captain and team player staying on the pitch keeping your head up even congratulating the french players not storming off down the tunnel in a strop england played well thats all you can ask #eng,0.019999999552965164,0.15199999511241913,0.828000009059906
for the first time in his england career harry kanes head went there people shouldnt be too hard on him top player and good lad #worldcup #eng,0.02500000037252903,0.1589999943971634,0.8169999718666077
cannot quantify how much enjoyment the combination of harry kane missing the matchtying pen for england to lose gives me immense happiness through schadenfreude on a very difficult day,0.07100000232458115,0.12800000607967377,0.8009999990463257
heartbreaking loss for england harry kane is one of the safest players from the spot in club football too this england team actually has the spark so much talent to look forward to the likes of foden saka bellingham taa mount etc will go a long way #fifaworldcup,0.02800000086426735,0.17299999296665192,0.7990000247955322
i bloody love harry kane i will always love harry kane and im devastated for him,0.10300000011920929,0.0989999994635582,0.7979999780654907
gutted fine margins love harry kane been fully entertained by this whole world cup going to bed,0.04899999871850014,0.164000004529953,0.7870000004768372
partiu harry kane the field goal is good,0.009999999776482582,0.20499999821186066,0.7850000262260437
can confirm that ball landed in my backyard thanks for the ball harry kane ,0.010999999940395355,0.210999995470047,0.7789999842643738
11 england deserved that and harry kane equals wayne rooneys record of 53 goals,0.00800000037997961,0.22699999809265137,0.7649999856948853
harry kane kick is good from 58 yds,0.013000000268220901,0.2240000069141388,0.7630000114440918
harry kane thanking his lucky stars right now that hes white,0.017999999225139618,0.21899999678134918,0.7620000243186951
not a harry kane fan hes a spurs player after all but absolutely dont blame him and people protect him like we protected the lads after euro penalties they served magnificently and gave us a great run this team is miles better than any england team ive ever seen,0.0560000017285347,0.1889999955892563,0.7549999952316284
harry kane has now scored more major tournament goals than any england player ever ,0.007000000216066837,0.2409999966621399,0.7519999742507935
if harry kane makes this i can eat mcdonalds again,0.02199999988079071,0.23899999260902405,0.7390000224113464
itll take a miracle for harry kane to win a trophy the hustle is real,0.032999999821186066,0.23399999737739563,0.7329999804496765
harry kane always trying to be the best actor,0.04399999976158142,0.23000000417232513,0.7260000109672546
i dont have a strong rooting interest in the outcome but do have a strong interest in harry kane being the villain so this is good by me,0.03400000184774399,0.2529999911785126,0.7129999995231628
harry kane has been one of englands top 3 players all tournament and the country will hate on him he knows where hes loved our boy were all with you,0.0860000029206276,0.20499999821186066,0.7089999914169312
harry kane this one for you princess diana and sent it to heaven my goat,0.009999999776482582,0.28700000047683716,0.703000009059906
oh harry whatever you do dont hate on harry kane for that penalty miss hes been brilliant england have been brilliant the referees been unfair #engfra,0.1289999932050705,0.21799999475479126,0.652999997138977
most goals scored for englands senior national teams 53 harry kane 53 wayne rooney the record has been equalled ,0.004000000189989805,0.36800000071525574,0.6269999742507935
goal france 1 1 england harry kane makes no mistake from the spot game on ,0.010999999940395355,0.3799999952316284,0.6100000143051147
you love to see harry kane smashing the ball to mars ,0.05000000074505806,0.34700000286102295,0.6029999852180481
harry kane sent that ball to the heavens for the queen ,0.028999999165534973,0.4050000011920929,0.5659999847412109
i never thought id get to see harry kane and christiano ronaldo both cry on the same day its a christmas miracle,0.17299999296665192,0.26899999380111694,0.5590000152587891
world cup harry kane is now equal with wayne rooney as englands top scorer with 53 goals,0.004000000189989805,0.4399999976158142,0.5559999942779541
harry kane i have a buiiet for u,0.02500000037252903,0.4659999907016754,0.5090000033378601
fair play to harry kane for blazing that penalty over the bar in protest against the human rights abuses perpetrated by the qatari regime pure class,0.1379999965429306,0.36899998784065247,0.49300000071525574
went for a stroll through lovely madison wisconsin this afternoon it was nice until harry kanes penalty kick hit me in the head #hellofolks,0.22499999403953552,0.28700000047683716,0.4880000054836273
its coming home harry kane ,0.006000000052154064,0.5139999985694885,0.47999998927116394
harry kane has tied wayne rooneys england record for joint top goalscorer,0.007000000216066837,0.5350000262260437,0.4580000042915344
harry kane im so so sorry will always love you #engfra,0.27399998903274536,0.2720000147819519,0.45399999618530273
harry kane we will be seeing you in the mls ,0.004000000189989805,0.546999990940094,0.4490000009536743
harry kane scores and now equals wayne rooneys alltime england record,0.006000000052154064,0.5479999780654907,0.44699999690055847
harry kane has now equaled wayne rooney as the jointhighest scorer for the mens side #fifaworldcup,0.004999999888241291,0.550000011920929,0.4449999928474426
harry kanes miss will be the highlight reel for the next 4 years ,0.06199999898672104,0.5099999904632568,0.42800000309944153
harry kane becomes first nfl kicker to score in a world cup quarterfinal ,0.004000000189989805,0.5680000185966492,0.4269999861717224
harry kanes penalty is joining russian tanks turrets on the moon absolutely crazy stuff,0.04699999839067459,0.5260000228881836,0.4269999861717224
harry kane running with the speed and grace of captain tom,0.013000000268220901,0.5649999976158142,0.421999990940094
 alltime leading goalscorers for england harry kane 80 caps wayne rooney 120 caps #fifaworldcup #engfra,0.007000000216066837,0.5789999961853027,0.414000004529953
54 goal harry kane equalises from the spot #fifaworldcup england 11 france,0.003000000026077032,0.5929999947547913,0.40299999713897705
harry kane stays on the field shakes hands with french players and doesnt run off crying because its not all about him proud of englands world cup journey ,0.0989999994635582,0.5120000243186951,0.3880000114440918
three wise men have just set off for bethlehem following the ball from harry kanes penalty,0.012000000104308128,0.6000000238418579,0.3880000114440918
if you dont rate harry kane based on trophies you cannot be taken seriously hes quite literally the perfect number 9,0.28200000524520874,0.34200000762939453,0.37599998712539673
i feel like premier league fans became friends temporarily when harry kane scored that penalty for england #eng,0.04600000008940697,0.5860000252723694,0.36800000071525574
id literally put my life savings on harry kane scoring a pen too,0.10599999874830246,0.5339999794960022,0.3610000014305115
if harry kane makes this im proposing to on my birthday,0.05999999865889549,0.5870000123977661,0.3529999852180481
sorry to laugh i love harry kane but at least your gaffer can relate kane,0.27000001072883606,0.3840000033378601,0.34599998593330383
hiya rio been a while anyway give harry kane ian wright gary neville alan shearer and sam matterface my best #rollthererunof1966,0.03700000047683716,0.6299999952316284,0.3330000042915344
i feel for harry kane i really do,0.1899999976158142,0.4830000102519989,0.32600000500679016
feel for england feel for harry kane stood toetotoe with the world champions and deserved better cant and wont criticise any of them #eng,0.20900000631809235,0.4950000047683716,0.29600000381469727
get it right up you ya saxon scum yeowwwww we love you harry kane,0.4830000102519989,0.2240000069141388,0.2919999957084656
get your head up harry kane you have nothing to be ashamed of thats football thats life #eng,0.27799999713897705,0.4320000112056732,0.28999999165534973
harry kane is a fabulous footballer shit happens france were not better than england they took their chances,0.4189999997615814,0.2980000078678131,0.28299999237060547
harry kane levels it from the spot #fifaworldcup,0.012000000104308128,0.7080000042915344,0.2800000011920929
harry kane draws level with wayne rooney meaning only own goals 57 has scored more for england,0.008999999612569809,0.7120000123977661,0.27799999713897705
#fifaworldcup england 11 france ais antoine griezmann becomes frances all time assists player 27 harry kane equals wayne rooney as england all tome top goalscorer 53,0.008999999612569809,0.7129999995231628,0.27799999713897705
harry kane baby ,0.012000000104308128,0.7179999947547913,0.27000001072883606
englandalways cheatednever defeated well done francewe can enjoy the fitba noo get it up ye harry kane,0.3869999945163727,0.3449999988079071,0.2680000066757202
someone has to say it giroud has greater legacy than harry kane while one is leading france to worldcup other is sending the ball back to england the levels here are massive,0.11500000208616257,0.6209999918937683,0.2639999985694885
its final asamoah gyan is better than harry kane,0.09099999815225601,0.6460000276565552,0.2630000114440918
harry kane will not miss absolutely not you all know barry kane on penalties,0.1889999955892563,0.5479999780654907,0.2630000114440918
good effort from england got to feel for harry kane very unlucky with a few decisions in that one,0.35600000619888306,0.38199999928474426,0.2619999945163727
when i say harry kane just know im aiming for the stars,0.06199999898672104,0.6819999814033508,0.2549999952316284
harry kane sent the ball all the way to england look at this man,0.1080000028014183,0.6420000195503235,0.25
cant find my original tweet but as requested by harry kanes face is fascinating in that it has all the components of a handsome face yet he remains incredibly unattractive,0.32899999618530273,0.4359999895095825,0.23600000143051147
im happy england is out but even happier its harry kane that missed that penaly not saka not rashford,0.42100000381469727,0.3449999988079071,0.23399999737739563
harry kane sent that football home #fifaworldcup #engfra,0.1720000058412552,0.597000002861023,0.23100000619888306
harry kane can u do something for mee,0.04899999871850014,0.7210000157356262,0.23000000417232513
harry kane take your points the goals will come,0.07599999755620956,0.7009999752044678,0.22200000286102295
devastating harry kane is a legend that is all,0.43299999833106995,0.3580000102519989,0.20900000631809235
harry kanes pk on its way to the international space station,0.012000000104308128,0.781000018119812,0.2070000022649765
harry kane with the asamoah gyan vibes both all time top scorers and legends but lets see if england handle it like ghana did they actually respect their legends or ,0.08799999952316284,0.7120000123977661,0.20000000298023224
harry kane ties it for england ,0.009999999776482582,0.7910000085830688,0.19900000095367432
ah well thank god harry kane didnt wear that bit of cloth supporting their lgbtq fans,0.33500000834465027,0.4740000069141388,0.19099999964237213
oh god the harry kane ball go come hit wizkid today make somebody protect am pls,0.3319999873638153,0.4779999852180481,0.1899999976158142
black magic influenced that harry kanes pk you just know uju anyas work when you see it,0.07699999958276749,0.7350000143051147,0.18799999356269836
surely the english famous for their grace and decorum will be compassionate towards harry kane regarding the missed penalty,0.18700000643730164,0.628000020980835,0.1850000023841858
harry kane shot that penalty straight to the queen,0.21799999475479126,0.597000002861023,0.1850000023841858
harry kane scoring a penalty tonight no idea why but been thinking it all day #fifaworldcup,0.11500000208616257,0.7039999961853027,0.1809999942779541
im gonna need to see harry kane on the front pages of the paper same way sterling saka and rashford were please and thanks,0.10599999874830246,0.7160000205039978,0.17800000309944153
good thing that its harry kane who has missed the penalty but if it was bukayo saka hooooo,0.4050000011920929,0.4169999957084656,0.1770000010728836
harry kane is spursy through and through,0.16300000250339508,0.6620000004768372,0.17499999701976776
harry kane was shooting for the stars with that penalty,0.23800000548362732,0.5910000205039978,0.17100000381469727
harry kane tottenham hotspurs genes came through absolutely bottled it,0.4830000102519989,0.35600000619888306,0.16200000047683716
anyway arabic commentators are more entertaining than english ones like the american was saying oh harry kane should take his chance and then i switched and the arab was saying the full moon is not shining on the english tonight the brazilian ref isnt happy with them ,0.38100001215934753,0.47099998593330383,0.1469999998807907
reckless challenge harry kane for the england record,0.15299999713897705,0.7009999752044678,0.1459999978542328
ive never seen harry kane this hungry for goals,0.33899998664855957,0.5149999856948853,0.1459999978542328
frankly brave of harry kane to stay out there after that i would have just started walking without stopping until i had left all signs of human civilization,0.39800000190734863,0.4569999873638153,0.14499999582767487
frances players giroud lloris mbappe showing ronaldo how to be a good sportsman and consoling harry kane,0.03500000014901161,0.8220000267028809,0.14300000667572021
me cago en harry kane,0.03700000047683716,0.8190000057220459,0.14300000667572021
all you harry kane is world class boys need to sit down,0.4740000069141388,0.3880000114440918,0.1379999965429306
harry kane bottles its the history of the tottenham,0.05999999865889549,0.8040000200271606,0.13600000739097595
just received word that harry kanes second penalty has finally landed,0.028999999165534973,0.8360000252723694,0.13600000739097595
smoking on that harry kane pack,0.12600000202655792,0.7379999756813049,0.13500000536441803
harry kane accumulated more xg 204 than the entire french team 132,0.06700000166893005,0.8019999861717224,0.13199999928474426
harry kane will end his career with nothing but his millwall young player of the year trophy,0.2709999978542328,0.6000000238418579,0.1289999932050705
mason mount did his best by giving england a penalty but it seems harry kane had other plans,0.14399999380111694,0.7310000061988831,0.125
oh harry kanes penalty just landed in my backyard yall,0.29600000381469727,0.5830000042915344,0.12099999934434891
harry kane when i catch u by the nose,0.054999999701976776,0.8240000009536743,0.12099999934434891
a harry kane behind the door so ive come ready for a war ,0.1809999942779541,0.6980000138282776,0.12099999934434891
theo hernandez hands a christmas present and harry kane has put in the fireplace instead of under the tree,0.04600000008940697,0.8360000252723694,0.11800000071525574
if harry kane do wild he fit catch the ball for qatar dema airport,0.04600000008940697,0.8429999947547913,0.11100000143051147
sorry for my england supporting friends at least saka gets to leave with his head held high and the guy who let down england was harry kane so if youre drawing up an acceptable loss thats about as good as you can ask for,0.5950000286102295,0.29499998688697815,0.10999999940395355
harry kane channeling his inner harry maguire since 1906,0.03400000184774399,0.8610000014305115,0.10599999874830246
harry kane that was so tottenham,0.5249999761581421,0.3709999918937683,0.10400000214576721
put harry kane pon the cover of all newspapers,0.08399999886751175,0.8109999895095825,0.10400000214576721
marcus rashford should hit the target from 25 yards after harry kane hits the burj khalifa from qatar from 12 yards says it all really,0.08799999952316284,0.8130000233650208,0.0989999994635582
harry kane see as you dae do werey omo,0.050999999046325684,0.8500000238418579,0.0989999994635582
anyone who finds the ball harry kane just blasted over the bar will be given free money,0.414000004529953,0.49000000953674316,0.09600000083446503
just looked out my window and saw the ball that harry kane shot in my backyard,0.1120000034570694,0.7929999828338623,0.0949999988079071
will harry kane ever win any trophy surely from tottenham to the national team,0.1550000011920929,0.7580000162124634,0.08799999952316284
harry kane has sent the ball to mars,0.17599999904632568,0.7400000095367432,0.08399999886751175
breaking harry kane converts penalty its 11 against france,0.032999999821186066,0.8840000033378601,0.08299999684095383
that harry kane ball just landed here in my yard,0.35199999809265137,0.5659999847412109,0.0820000022649765
harry kane is like a oneman team right now,0.3959999978542328,0.5220000147819519,0.0820000022649765
something just fall for my zinc now i just hope say no be harry kanes penalty ball ,0.46000000834465027,0.46000000834465027,0.07999999821186066
harry kane fires his penalty over the bar #fifaworldcup,0.17499999701976776,0.746999979019165,0.07900000363588333
uko kwa flight on your way to a vacation unashanga ball in overtake ndege kumbe ni pena ya harry kane,0.050999999046325684,0.8700000047683716,0.07900000363588333
asamoah gyans penalty miss is better harry kanes,0.38600000739097595,0.5350000262260437,0.07800000160932541
harry kane is england asamoah gyan man go hear am from them ,0.06400000303983688,0.8579999804496765,0.07800000160932541
everyone in the england team looks like they work in a call centre in reading except for harry kane who looks like he works on a dairy farm in the late 1800s,0.28999999165534973,0.6320000290870667,0.07800000160932541
harry kane sent the ball to queen elizabeth,0.027000000700354576,0.8960000276565552,0.07699999958276749
are u ready to d1e harry kane,0.03799999877810478,0.8859999775886536,0.07599999755620956
harry kane go turn asamoah gyan in england for the rest of his life,0.2680000066757202,0.6600000262260437,0.07199999690055847
harry kane kicked that ball to kazakhstan lol,0.19200000166893005,0.7360000014305115,0.07199999690055847
harry kane should consider playing rugby after his retirement from football that penalty though,0.21400000154972076,0.7170000076293945,0.07000000029802322
can you get cdls in englandif you can harry kane needs to apply today ,0.029999999329447746,0.8989999890327454,0.07000000029802322
harry kane turned in to lionel messi when he was talking that penalty,0.21899999678134918,0.7129999995231628,0.06800000369548798
harry kane just pick the same spot i beg,0.3199999928474426,0.6119999885559082,0.06800000369548798
harry kane has entered the transfer portal,0.01600000075995922,0.9169999957084656,0.06700000166893005
harry kane best get the same treatment as saka in the euros,0.4659999907016754,0.46700000762939453,0.06700000166893005
go on harry kane you lanky bastard help us win king england v france,0.703000009059906,0.23000000417232513,0.06700000166893005
all now harry kane ball nuh land enuh,0.10300000011920929,0.8309999704360962,0.06599999964237213
wonder what the media will have to stay about blonde hair blue eyed harry kanehmm,0.026000000536441803,0.9070000052452087,0.06599999964237213
if i dont see harry kane getting cooked on tomorrows newspaper front pages then that will tell me everything i needed to know,0.37599998712539673,0.5569999814033508,0.06599999964237213
harry kane just too much tottenham in him,0.453000009059906,0.4819999933242798,0.06499999761581421
harry kane twats his penalty over the bar #eng #fra #fifaworldcup,0.12600000202655792,0.8090000152587891,0.06499999761581421
 bukayo saka and phil foden are set to start either side of harry kane in front of a threeman midfield of declan rice jude bellingham and jordan henderson for #eng vs #fra today lawdt #threelions,0.006000000052154064,0.9290000200271606,0.06499999761581421
its just good that its harry kane that missed this golden opportunity imagine it was saka or rashford the whole of england will remember their skin colour and where they came from bye england,0.6359999775886536,0.3009999990463257,0.06300000101327896
harry kane please dont put me to shame,0.6320000290870667,0.3050000071525574,0.06300000101327896
harry kane has scored 53 goals for england but hell now probably be best remembered for the one he didnt such is football ,0.6290000081062317,0.31200000643730164,0.05900000035762787
dede ayew spirit enter harry kane,0.02500000037252903,0.9160000085830688,0.05900000035762787
gareth southgate said something to harry kane immediately after the final whistle reassuring words heartbreaking for kane,0.41100001335144043,0.531000018119812,0.057999998331069946
harry kane thinks he playing gaelic football take your points and the goals will come,0.46000000834465027,0.4819999933242798,0.057999998331069946
someone in scotlands got a draft tweet ready to go that says youve heard of elf on a shelf but how aboutand a picture of harry kane on an aeroplane just letting you know so its not a surprise if you see it,0.21799999475479126,0.7239999771118164,0.057999998331069946
and harry kane bottled it hard,0.4580000042915344,0.48500001430511475,0.05700000002980232
i really thought this was building up to harry kane getting that second penalty and then missing one in the penalty shoot out and then getting the mother of all humourous pizza commercials,0.46399998664855957,0.4790000021457672,0.05700000002980232
look at harry kane in the build up for that goal anyone that thinks hes having a poor tournament due to a lack of goals cant doesnt understand this sport,0.5870000123977661,0.35600000619888306,0.05700000002980232
