,neg,neu,pos
harry kane what the hell was that,0.8550000190734863,0.13600000739097595,0.009999999776482582
so are they all gonna sit on harry kanes head like they did our baby cousins or because they treated our star boy like public enemy number one and i havent forgotten,0.7799999713897705,0.20999999344348907,0.009999999776482582
yall rly do not love this harry kane man 1 opened the score for england and still getting lashings ,0.8880000114440918,0.10100000351667404,0.009999999776482582
another penalty to england hernandez with a bad error and harry kane misses devastating for him and england fans he misses out on the alltime record too for now #fifaworldcup,0.8370000123977661,0.15299999713897705,0.009999999776482582
ive never seen a more obsessed group of people than harry kane haters sad lot of people,0.9120000004768372,0.07800000160932541,0.009999999776482582
harry kane shouldve practiced his penalty skills instead of advocating for the alphabet lot byeeeee,0.8379999995231628,0.15199999511241913,0.009999999776482582
every englishman that send racial abuse to saka rashford and sancho i want you to steer your abuse to harry kane expeditiously ,0.796999990940094,0.19300000369548798,0.009999999776482582
right then i wanna see abuse towards harry kane cus man already know what would be happening if saka missed that pen,0.8389999866485596,0.1509999930858612,0.009999999776482582
harry kane is the most overrated player of our generation only spurs fans disagree hes so mid even mariano is clear ,0.8999999761581421,0.09000000357627869,0.009999999776482582
oi i wanna see racist tweets about harry kane,0.8059999942779541,0.18400000035762787,0.009999999776482582
harry kane just got tripped but im not sure why hes so mad the opposing team should be trying to trip himlance storm or wade keller probably,0.753000020980835,0.2370000034570694,0.009999999776482582
if england lose do u think harry kane will get the same abuse saka and rashford got after their pen misses,0.6949999928474426,0.29600000381469727,0.008999999612569809
we need to have serious conversation about harry kane in big games this guy is a serial bottle job dont compare him to haaland please,0.8790000081062317,0.1120000034570694,0.008999999612569809
it gives me no pleasure to say that harry kane must now be stripped of his british citizenship,0.8870000243186951,0.10400000214576721,0.008999999612569809
theyre gonna invent new slurs just for harry kane after this,0.8180000185966492,0.1720000058412552,0.008999999612569809
fuck england my heart is broken for harry kane,0.9430000185966492,0.04899999871850014,0.008999999612569809
harry kane cost me my flag and visa ,0.8569999933242798,0.1340000033378601,0.008999999612569809
so so heartbroken for harry kane youd have put your house on him scoring that penalty worst feeling is we were the better team for so much of that game made a laughing stock of the idea wed get rolled over and there wasnt much we got wrong so devastated #threelions,0.9200000166893005,0.07100000232458115,0.008999999612569809
what are you doing fouling harry maguire outside the box let him send that ball to go look for harry kanes penalty ball,0.718999981880188,0.2720000147819519,0.008999999612569809
players i dont want to see in an english jersey again #1 harry maguire a huge detriment on the back end #2 raheem sterling just useless #3 harry kane hes just done the team plays better with henderson and rashford in and kane has come up short when needed #engfra,0.875,0.11599999666213989,0.008999999612569809
harry kane took its coming home way too seriously he tried to send that penalty ball back to heathrow,0.8410000205039978,0.15000000596046448,0.008999999612569809
i hope bukayo saka wont appear on the front page of the daily mail after england gets eliminated please dont use his picture place harry kane on the front page yall,0.8389999866485596,0.15299999713897705,0.008999999612569809
harry kane sent that shit to essex bro,0.8029999732971191,0.18799999356269836,0.008999999612569809
england v france harry kane you silly billy fuckkkkkkk you missed the goal,0.9089999794960022,0.08299999684095383,0.00800000037997961
smh all harry kanes fault,0.8870000243186951,0.10499999672174454,0.00800000037997961
harry kane let his country down,0.8830000162124634,0.10899999737739563,0.00800000037997961
the way harry kane sabotages every single opportunity he has of touching silverware is too funny how did we let tottenham fans spin the narrative to saka let the country down,0.8999999761581421,0.09200000017881393,0.00800000037997961
harry kane better get the same fucking hate saka got for the euros ,0.9179999828338623,0.07400000095367432,0.00800000037997961
harry kane let the country down,0.8930000066757202,0.0989999994635582,0.00800000037997961
this is why harry kane is trophyless absolute bottle job,0.9190000295639038,0.0729999989271164,0.00800000037997961
missing missing name harry kane missing dec 10 characteristics diving undercutting jumpers swearing on daughters life possible locations penalty spot playing cdm last seen statpadding vs iran your country needs you warning afraid of trophies,0.8360000252723694,0.15600000321865082,0.00800000037997961
and this is why harry kane has won nothing of note when he is needed most he bottles southgate sacked after this please,0.8949999809265137,0.09700000286102295,0.00800000037997961
harry kane is and always will be a career loser i tried to tell yall,0.9089999794960022,0.08299999684095383,0.00800000037997961
hate that for harry kane yikes,0.921999990940094,0.07000000029802322,0.00800000037997961
harry kane you big slabber cabbage bastard ,0.9319999814033508,0.05999999865889549,0.00800000037997961
harry kane is very overrated id rather see callum wilson play,0.8830000162124634,0.10899999737739563,0.00800000037997961
2 world cup moments harry kane has bottled 2018 when he couldve squared to sterling and 2022 he bottled a penalty kick yet the media wont say anything tomorrow,0.8550000190734863,0.1379999965429306,0.00800000037997961
im sorry but harry kane has let england down there thats a shocking penalty hes an experienced player captain and experienced penalty taker just put it on target you crank,0.902999997138977,0.08799999952316284,0.00800000037997961
this penalty merchant harry kane profiting from bukayo sakas hard work im sick to my stomach,0.9200000166893005,0.07199999690055847,0.00800000037997961
harry kane go retire without a trophy p33 one overrated fraud,0.9110000133514404,0.08100000023841858,0.00800000037997961
harry kane let the country down ,0.8960000276565552,0.09700000286102295,0.007000000216066837
ill never forget how teenage bukayo saka was vilified with racism online and then booed like no mans business up an down the country at every football ground i wonder if theyll have the same energy for one of their own english anglosaxon white players in harry kane,0.8899999856948853,0.10300000011920929,0.007000000216066837
if england loses the game there better be harry kane let his country down shouts for the next 5 years else people are just racist,0.9079999923706055,0.0860000029206276,0.007000000216066837
i dont care about england i just cant deal with the fact that harry kane will be blamed for everything now,0.8859999775886536,0.10700000077486038,0.007000000216066837
tweeting fuck harry kane aint enough for me i gotta go see him,0.9160000085830688,0.07699999958276749,0.007000000216066837
lets see if harry kane gets any racist abuse after that penalty miss #engfra #qatar2022,0.7789999842643738,0.21400000154972076,0.007000000216066837
harry kane needs to get dragged like them man did for missing penalties last time,0.8730000257492065,0.11999999731779099,0.007000000216066837
oh harry kane is not good under pressure his legs were shaking while getting ready to take that penalty #engfra,0.9020000100135803,0.09000000357627869,0.007000000216066837
harry kane is such a serial bottler its not even a joke anymore hes just straight up incapable of winning anything,0.9350000023841858,0.057999998331069946,0.007000000216066837
how wasnt that a penalty on harry kane in the 1st half how wasnt griezmann sent off fouls on saka the better team lost tonight,0.8180000185966492,0.17499999701976776,0.007000000216066837
harry kane is the biggest bottler ever he deserves the trophy cabinet he has,0.9399999976158142,0.05299999937415123,0.007000000216066837
years of abuse for harry kane now he gets tons now but nothing like what is incoming unlucky england terrible ref france should have been booked loads of times gutted,0.902999997138977,0.09000000357627869,0.007000000216066837
so does harry kane get racially abused tonight then or is that only for the black players,0.5879999995231628,0.40400001406669617,0.007000000216066837
will some called england fans give harry kane the same level of abuse for missing a penalty that they gave to saka etc i highly doubt it and we know why please note i said some as the bigoted 1s are a minority of them,0.878000020980835,0.11500000208616257,0.007000000216066837
i hope harry kane gets the same treatment and racial abuse from england fans as saka rashford and sancho,0.8920000195503235,0.10100000351667404,0.007000000216066837
harry kane it is all your fault,0.9139999747276306,0.07999999821186066,0.007000000216066837
harry kane let our country down just for you lot who said saka did ,0.902999997138977,0.09000000357627869,0.007000000216066837
harry kane oh my world how on earth will you play a penalty like this,0.906000018119812,0.08699999749660492,0.007000000216066837
harry kane let down the countryyyy,0.906000018119812,0.08699999749660492,0.007000000216066837
i wonder if harry kane is gonna get racially abused ,0.7319999933242798,0.2619999945163727,0.006000000052154064
i better see harry kane has let his country down or im calling the racism card,0.9110000133514404,0.08299999684095383,0.006000000052154064
harry kane he let his country down,0.9179999828338623,0.07500000298023224,0.006000000052154064
harry kane has to be one of the biggest frauds of all time wasted all his goals for 0 trophies and letting his country down on the biggest stage,0.9419999718666077,0.050999999046325684,0.006000000052154064
harry kane you let the country down,0.9290000200271606,0.06499999761581421,0.006000000052154064
harry kane you let your country down,0.9259999990463257,0.06800000369548798,0.006000000052154064
harry kane you let your country down chants gonna hit like crack in the north london derbies,0.9300000071525574,0.06499999761581421,0.006000000052154064
if bbc post anything with saka picture it means they are truly racist everything dey post today about the match should have harry kane picture there,0.8769999742507935,0.11699999868869781,0.006000000052154064
i hope these english fans abuse harry kane like they did to rashford saka and sancho,0.8970000147819519,0.09700000286102295,0.006000000052154064
that harry kane abuse stats about to go up ,0.871999979019165,0.12099999934434891,0.006000000052154064
still not sure how southgate can justify taking saka off needing a goal france go to a low block saka is a low block killer instead he brings on rashford whos a high line counter attacking threat idiotic managing oh and harry kane you let your country down,0.8830000162124634,0.1120000034570694,0.004999999888241291
england didnt deserve that harry kane didnt deserve that sometimes dont get what you deserve even when if doesnt go to penalties its a penalty that hurts us france had 2 moments and made england pay thought england outplayed the holders saka sub baffled me gutted,0.9229999780654907,0.07199999690055847,0.004999999888241291
gareth southgate out its a crime against humanity to have that sort of firepower and not use it properly how on earth can you sub your best player bukayo saka it makes no sense harry kane has been useless during this entire tournament why is he unsubable,0.9340000152587891,0.061000000685453415,0.004999999888241291
seeing harry kane walk off the pitch tonight is heartbreaking and now well have every c u next tuesday come out the abuse will be relentless more than weve ever seen #engfra,0.9359999895095825,0.057999998331069946,0.004999999888241291
seriously tho if it was a black man who took that penalty instead of harry kane twitter would of been full off racist comments now they are nowhere to be seen,0.878000020980835,0.11699999868869781,0.004999999888241291
harry kane let his country down spread the word,0.8870000243186951,0.10700000077486038,0.004999999888241291
why are england still playing harry kane the man is a serial bottler never scored a big goal in his fucking life,0.9419999718666077,0.05299999937415123,0.004999999888241291
how many innocent wives are going to suffer because of the actions of harry kane,0.9300000071525574,0.06599999964237213,0.004000000189989805
