,neg,neu,pos
so king charles throws lady susan hussey aside after decades of service to his mother and family and bows down to the howling race baiters,0.6700000166893005,0.3100000023841858,0.01899999938905239
has the time finally come for the palace to at last speak out king charles and william is it time we heard from yourselves it is very clear to see the relentless attack on our serving royals is not going to stopi do not believe that silence now is the answer anymore,0.765999972820282,0.21400000154972076,0.01899999938905239
people who face far right threats are protected by the government at the cost of taxpayers because its considered high security threat what the royal family king charles iii and prince william are doing to prince harry and his family is deliberate and by design,0.546999990940094,0.4339999854564667,0.01899999938905239
#breaking new reality tv show featuring estranged british prince harry widely suspected of plotting palace coup to unseat aging father king charles iii and brother crown prince william airs with analysts terming it attempt to win public support in savage battle for throne,0.3799999952316284,0.6019999980926514,0.017999999225139618
i want every british person in the uk to sit down and reflect the day that king charles ambush baby archie birthday daystop blaming harrymeghan royal family and uk media need to stop attacking meghan and harry the kingdom didnt respect his grandchild special day why why,0.8090000152587891,0.17399999499320984,0.017000000923871994
prince harry will pass point of no return if he criticises camilla in his new book spare and king charles will close the door on him royal expert phil dampier claims i feel pretty certain q camilla will not escape the duos bitterness,0.6460000276565552,0.335999995470047,0.017000000923871994
what did king charles do last month he complained to netflix about the crown s5 what did william do this week he complained to netflix about his brothers upcoming documentary hes his fathers son without the work ethic ,0.6669999957084656,0.31700000166893005,0.01600000075995922
as the statement points out the crown was originally made for king charles ii in 1661 replacing the 11th century original he melted down what it doesnt mention is that this monarchs legacy was creating the royal african company to transport slaves to the english colonies,0.27300000190734863,0.7110000252723694,0.01600000075995922
easily but surely prince harry is fading away to nullity what he did against his family puppeted by spoiled megan is unacceptable i am sure king charles iii will put things in order very soon bad news hm should go to work,0.8199999928474426,0.164000004529953,0.01600000075995922
seems to me that have made a bit of a paux pas here giving in so quickly to ms fulani has enabled her i really think william and king charles should have stepped back and thought about things instead of being terrified of the nonsense potential racial slur,0.6840000152587891,0.30000001192092896,0.01600000075995922
dear me im guessing that wont threaten to disallow the law that will be adopted this week deleting the requirement to swear allegiance to king charles iii much less do so before the pq mnas take their seats #cdnpoli,0.675000011920929,0.30799999833106995,0.01600000075995922
rishi sunak and akshata murtys estimated net worth is £730m they could give everyone in this county £1m and still be richer than king charles why do we have starving children why are our elderly neighbours at risk of freezing how is this reality,0.7710000276565552,0.21400000154972076,0.014999999664723873
neal sean reports that marlene has been invited to have a meeting with king charles and queen camila the woman who accused them of dv wow why not invite lady susan over to make things right 60 odd years of service only to be discarded like trash without all the facts #smh,0.6779999732971191,0.3070000112056732,0.014999999664723873
lady susan hussey should be reinstated immediately and ngozi fulani should apologise to her for causing the elderly lady so much upset if meghan harry were behind the ambush they should be stripped of their titles by king charles,0.7070000171661377,0.27799999713897705,0.014000000432133675
be very afraid of king charles iii that invitation to marlene ngozi fulani is a master craft machiavellian move or what are your thoughts ,0.6909999847412109,0.29499998688697815,0.014000000432133675
so has king charles started dismantling the empire yet has he taken any steps towards giving all lands back to indigenous peoples with reparations and compensating former slaves of the cwealth or is he gonna be just like his mum and stay benefiting from genocide,0.527999997138977,0.4569999873638153,0.014000000432133675
i dont believe the money part why would king charles suddenly weaken when he has supposedly been avoiding hs calls because it was always about money,0.6309999823570251,0.35499998927116394,0.014000000432133675
hello sir i have another question what do you think about all of this i mean will king charles iii take measures against the montecito duo because this is too much theyve crossed all the lines they do not know any boundaries this must stop,0.7020000219345093,0.2849999964237213,0.013000000268220901
king charles just died,0.7570000290870667,0.23000000417232513,0.013000000268220901
nile gardiner has asked king charles to strip the duke and duchess of their titles king charles has been urged to take action against prince harry and meghan markle over antiracism award insult which means treason neil gardiner has asked the new king to strip all title,0.5809999704360962,0.4059999883174896,0.013000000268220901
i think king charles prince william need to make a public apology if they had read the room correctly they would have realised they were being taken for mugs they backed the wrong person should apologise for this,0.7630000114440918,0.2240000069141388,0.012000000104308128
someone has thrown eggs at king charles again what eggxactly do they have against him,0.7590000033378601,0.23000000417232513,0.012000000104308128
h and megain crying bc king charles wont give them 20m a yr to sit on the couch and megain crying bc h cant be king when he should be megain doesnt understand math h was born second just them crying that h cant be king same oprah show,0.8050000071525574,0.18199999630451202,0.012000000104308128
the rejection of jesus is the highest crime against the great king charles spurgeon,0.8560000061988831,0.13300000131130219,0.010999999940395355
no susan hussey is not out of step there was no racist comment ngozi fulani went to the palace with an agenda to bring them down she is a prolific hater of king charles iii and twitters about her hate of the rf and support of megain markle,0.7799999713897705,0.20900000631809235,0.010999999940395355
i prefer not to refer to her at all she obviously cant decide which name suits her narrative the best and why on earth king charles has honoured her with an invitation is ridiculous,0.796999990940094,0.19200000166893005,0.010999999940395355
oh dear this forthcoming docuseries harry and meghan wont be doing any favour for the everdense harkles they will be likely not to be invited to attend the coronation of king charles iii next summer and have their royal titles rescind for good later next year hopefully ,0.8309999704360962,0.15800000727176666,0.010999999940395355
if king charles doesnt close down any and all palace doors for them now once and for all i dont know know what i am so angry and disgusted ,0.9110000133514404,0.07800000160932541,0.009999999776482582
truly heartbreaking king charles prince willliam and all the family must be devastated they are still mourning but carrying on i dont know how you deal emotionally with this treachery they will heartbroken and furious,0.9020000100135803,0.08799999952316284,0.009999999776482582
king charles should strip harry and meghan of their duke and duchess of sussex titles says it all when they using their royal titles to promote a netflix documentary to insult the british royal family,0.7770000100135803,0.21299999952316284,0.009999999776482582
oh no i feel embarrassed for him is this how he makes money now to pay his mortgage since king charles said he is not a bank,0.8270000219345093,0.16300000250339508,0.009999999776482582
king charles should save his son to do that he has to be harsh he needs to act now before its to late mm is only sticking aroun for money prince philip saw right through her and she knew so to cover her tracks she blatantly lied and played the racist card shes a lowlife,0.8339999914169312,0.15600000321865082,0.009999999776482582
so credible sources are confirming that prince harry duchess meghan were victims of real threats in gb yet his father now king charles iii pulled their security leaked their location to the press the sussexes left bc their lives were threatened #abolishthemonarchy,0.777999997138977,0.21299999952316284,0.008999999612569809
if king charles lets harry and meghan keep their titles after this he will just look weak gives them a license to attack until the end of time he needs to be bold strong he cannot let them get away with these lies and still profit from royal titles #princeharryisatraitor,0.824999988079071,0.16500000655651093,0.008999999612569809
king charles must be like son why after i failed as a husband to support your mother emotionally had an affair with your stepmother placed you in a position of public grief and offered you no protection against intrusive media have you turned against me #harryandmeghan,0.8220000267028809,0.16899999976158142,0.008999999612569809
#harryandmeghannetflix when you hear #nicholaswitchell speak of king charles it sounds ridiculous hes absurd #bbcnews is absurd the whole idea of a royal family continuing to be head of state is utterly absurd in 21st century #abolishthemonarchy,0.8740000128746033,0.11699999868869781,0.008999999612569809
ha so apparently being british this is my culture its ripe for taking the piss out of monarchists in general are a joke and need more self respect if you honestly believe king charles has been chosen by god to lord over you you need help,0.9049999713897705,0.08699999749660492,0.008999999612569809
is the royal family anything to do with you here in australia king charles is our head of state even republicans here cant stand those two liars they only help the royal family,0.871999979019165,0.11900000274181366,0.008999999612569809
this is as more about diana than megan her role has been to mirror dianas experiences she has used her as a script the latest release on gb news is truly outrageous king charles needs to speak to his legal team,0.8240000009536743,0.16699999570846558,0.008999999612569809
someone threw an egg at king charles his protection officers were quickly scrambled sorry,0.8460000157356262,0.14499999582767487,0.008999999612569809
if king charles doesnt remove harry meghans royal titles hes only got himself to blame theyre not going to stop bashing the royal family while making a fortune from it because of their own royal titles,0.8140000104904175,0.17800000309944153,0.008999999612569809
what gets me is how they talk about the media destroying them invading their privacy but yet they arrange for the media to invade their privacy like that long lens shot of them behind king charles waiting for the late queens coffin did they consider king charles privacy,0.7549999952316284,0.2370000034570694,0.00800000037997961
if you call charles king charles you genuinely need to grow up a bit,0.8550000190734863,0.13600000739097595,0.00800000037997961
when is king charles just gonna let it slip that harry isnt even his son james hewitt is a dead ringer for him and had an affair with diana,0.7310000061988831,0.26100000739097595,0.00800000037997961
im really really disappointed and angry with king charles and prince william for not defending lady hussy and getting her side of the story she was a close of the the queen for over 60 years and the queen did not suffer racists lady hussy is no racist,0.8809999823570251,0.11100000143051147,0.00800000037997961
the problem with haz is obviously king charles did not spank him enough and instill manners and courtesy in his son charles failed,0.8450000286102295,0.14800000190734863,0.00800000037997961
people who throw eggs at king charles need to understand theyll only drive the royal family underground,0.8040000200271606,0.18799999356269836,0.00800000037997961
#palacesourcessay i bet the evilnot my king charles hated wearing a ramaal headscarf for the visit to the new temple and had to bow in front of the sikh holy book guru granth sahib his cruel racist past catching up with him and the other evil parasites karma,0.9079999923706055,0.08399999886751175,0.00800000037997961
distasteful couple king charles must remove their titles immediately netflix will run for the hills xx,0.9259999990463257,0.06700000166893005,0.00800000037997961
king charles queen consort are to meet ngozi fulani at buckingham palace i cannot believe that they have fallen into the trap from this dispicable women my respect for the woke royal family is fast disappearing,0.8759999871253967,0.11599999666213989,0.007000000216066837
someone noted today that this horror has been going on since 2016 it is time to end this pain king charles remove these cruel jealous low unsuitable people from the royal family now the level of toxicity is beyond belief no end no repairs possible,0.9120000004768372,0.07999999821186066,0.007000000216066837
 king charles can not afford to wait any longer to take action his wifes events got slammed twice in a week geez w other royals attending too how embarrassing if i was queen camilla id say im done with engagements til you sort your kid #princeharryisatraitor,0.9160000085830688,0.07800000160932541,0.007000000216066837
ms kennedy is also a traitor and has insulted my royal family and our king charles iii and because of her insult i sure that king charles might i have few words ms kennedy you have no idea who is rachel meghan markle when the word of epstein and more of yachting girl,0.8960000276565552,0.09700000286102295,0.007000000216066837
yall to give prince william or king charles any credit for swiftly terminating a racist from working after it got out they were racist isnt giving what you think it does especially when that same person was tormenting meghan yall didnt do a damn thing to speak out,0.8629999756813049,0.12999999523162842,0.007000000216066837
this needs to be sent to king charles they didnt have the balls to say anything when the late hm the queen was alive ,0.847000002861023,0.1459999978542328,0.007000000216066837
king charles and his son wonder why people dont like them and are such flops on the world stage ,0.8859999775886536,0.10700000077486038,0.007000000216066837
king charles needs to shut harry up harry has no shame and continues to dig at william and kate both harry and megan continue to publicly humiliate the royal family they insult the memory of our beloved queen elizabeth and insults king charles,0.8939999938011169,0.0989999994635582,0.007000000216066837
fek my royal mint account hacked bought king charles coins dodgy ews saying princess di wtfdenied my security answer at least saved a copy of my receipts unless they changed my postal address,0.8960000276565552,0.09799999743700027,0.007000000216066837
the most insufferable pair on the planet never thought americans would once again be at the mercy of a british king but here we are king charles please strip these grifters of their title and spare us,0.9409999847412109,0.052000001072883606,0.007000000216066837
or challenge her about her tweets accusing king charles of domestic violence extraordinary that you can libel someone to a worldwide audience and youre not accountable but that you are for something someone else said,0.7870000004768372,0.20499999821186066,0.007000000216066837
i do believe king charles and prince william must seriously rethink their woke attitude on matters it was not racism it was a set up who attends functions with a recorder that woman should be treated for what she is a conniving quite evil guest,0.8759999871253967,0.11699999868869781,0.007000000216066837
marlene headley hackney is proven to be a race baiting piece of crap but king charles is a spineless fool the queen would have never allowed her lady in waiting to be treated like this the first challenge of his reign and he folded like a wet fag paper,0.9300000071525574,0.06400000303983688,0.006000000052154064
king charles iii should yank their titles and revoke their british passports disgraceful,0.9039999842643738,0.09000000357627869,0.006000000052154064
king charles is proving a very weak monarch and the contrast with his mother could not be greater,0.9100000262260437,0.08399999886751175,0.006000000052154064
chris i am truly appalled and find it disgusting that these two toxic conceited narcissists have behaved to mock the royal family and late queen just 3 months after her passing they always want to be the centre of attention and i hope king charles strips them of all titles,0.9419999718666077,0.052000001072883606,0.006000000052154064
harry looks extremely uncomfortable with this why would you allow this to be aired surely this wont sit well with king charles particularly so soon after his mothers passing meghan should show some respect,0.9049999713897705,0.08900000154972076,0.006000000052154064
#jeremyvine king charles should strip h and m of all titles theyre a disgrace all they do is trash our rf to the world and spout lies and they know the rf cant respond the way they treat both their families is disgusting meghan is a nasty attention seeking piece of work,0.9330000281333923,0.061000000685453415,0.006000000052154064
when they blow the money for this fiasco what will they do then no one will touch them they can only tell their recollections so many times king charless bank is closed the memoir will be a flop and everyone will alienate themthey took revenge and lost so much,0.9110000133514404,0.08299999684095383,0.006000000052154064
king charles has sacked his godmother for simply asking a woman where she was fromi dont see that as being racist lady hussey should sue king charles for wrongful dismissal and defamation of character she would not have been the queens lady in waiting if she had been racist,0.8930000066757202,0.10100000351667404,0.006000000052154064
if i was the i would tell this vile arrogant racebaiter monarchy hater where to stick her offer then id ban her from buckingham palace for life sadly king charles iii does not have the courage to defend our monarchy,0.9399999976158142,0.05400000140070915,0.006000000052154064
omid scobie describes himself as an executive royal editor he has written an inflammatory piece for yahoo news it is a one sided perspective the megan and harry perspective it is a cheap disgusting article full of exaggerated claims this is why king charles must act now,0.906000018119812,0.08799999952316284,0.006000000052154064
does he looks like her wing man letting the grandma who he allegedly loves be mocked and scorned for everything the late queen stood for if king charles allows this without censor then he too is complicit,0.847000002861023,0.1469999998807907,0.006000000052154064
vile vile creatures king charles should remove their royal titles immediately #harryandmeghannetflix,0.9390000104904175,0.05400000140070915,0.006000000052154064
omg coming from the us please king charles stripped their titles with or without their titles they are going to continue to bring rf down take their titles they absolutely dont deserve them youve lost a son and gained a daughter outlaw,0.9129999876022339,0.08100000023841858,0.006000000052154064
its disgraceful throwing eggs at king charles good food should never be wasted in that way,0.9380000233650208,0.054999999701976776,0.006000000052154064
king charles should completely strip harry that vile creature of any remaining titles and privileges they have rip that band aid off burn the ship they are total maniacs,0.9440000057220459,0.05000000074505806,0.006000000052154064
i dont care if king charles iii is an environmentalist the way he treated diana was fcking deplorable hes a scumbag of the most pathetic kind truly a piece of sht,0.9559999704360962,0.039000000804662704,0.004999999888241291
nicholas witchell media weasel and horrid man according to king charles telling us the claims that the media were out to destroy megan dont stand up to scrutiny,0.9269999861717224,0.06800000369548798,0.004999999888241291
the way king charles and prince william have tossed lady hussey to the side over racism claims without so much as an investigation is deeply concerning it seems that the royal family is fast becoming just another branch on the evergrowing tree of woke totalitarianism,0.8809999823570251,0.11400000005960464,0.004999999888241291
media brother of king charles accused of having sex with an underaged girl paid her millions in compensation which she deserved banned in disgrace media silence but son and daughter in law of the king are destroying the royal family seriously wtf,0.8980000019073486,0.09700000286102295,0.004999999888241291
another egg thrown at king charles when will it be a weapon are you proud of yourself harry for what you are doing to your father you are disgusting and dont deserve any title,0.9399999976158142,0.054999999701976776,0.004999999888241291
king charles and prince william have made a huge blunder in referring to lady susan hussey as a racist and throwing her under the bus her reputation is in tatters shame on the king and prince of wokeness,0.9139999747276306,0.08100000023841858,0.004999999888241291
sickening king charles do something please hes an embarrassment and traitor,0.9559999704360962,0.039000000804662704,0.004999999888241291
the witch is disrespecting the late queen all over the world and king charles does nothing and says he is waiting to see if camilla is disrespected forget that hes making excuses for that prick son of his,0.9229999780654907,0.07199999690055847,0.004999999888241291
has anyone else noticed that ph tw have gotten worse since the queen passed away they are coming out with all these photos that have been photoshopped started the racist lies again they have been 10 times worse king charles needs to act now stop pussyfooting around now,0.9259999990463257,0.0689999982714653,0.004999999888241291
why is this even a story sick of hearing about their supposed suffering leave the royalty seeking privacy only to spew their grievances on netflix pathetic what do they want like king charles said when asked why he doesnt take harrys phone calls im not a bank,0.9110000133514404,0.08500000089406967,0.004999999888241291
im offended that people are calling my head of state hrh king charles and his family racists offence works both ways so if you comment expect a reply,0.9110000133514404,0.08399999886751175,0.004999999888241291
the most disappointing thing in this whole thing is thomas markle he allowed himself to be used against his own daughter for money he chose money over his own child he will go down as one of the worst fathers in history followed by king charles,0.9480000138282776,0.04699999839067459,0.004000000189989805
cant believe you guys lied abt king charles getting run over by a bus ,0.9200000166893005,0.07500000298023224,0.004000000189989805
a fruitcake living on our married to a corrupt malingerer living on our should have a chat with king charles and have him removed its beyond embarrassing now for the nation,0.9419999718666077,0.05299999937415123,0.004000000189989805
king charles iii your mother will be turning in her grave right now you shouldnt invite this nasty piece of work within a mile of buckingham palace you ought to be making an apology to lady hussey for jumping to the wrong conclusion about her she may never recover from this,0.9559999704360962,0.03999999910593033,0.004000000189989805
