,neg,neu,pos
silicon valley bank and silvergate capital 2 major financial institutions just failed this week alone its starting to unravel yes i would say 5050 chance of happening,0.8510000109672546,0.13300000131130219,0.014999999664723873
perhaps more relevant silicon valley bank made the same dumb trades as silvergate buying long dated bonds before the fed started raising rates and lost a similar amount when vc funding dried up and their depositors started withdrawing funds but they are only down 56 today,0.6790000200271606,0.3059999942779541,0.014999999664723873
just in silicon valley bank stock plunges over 50 premarket,0.7570000290870667,0.2290000021457672,0.014000000432133675
in the last 24 hours • stocks crypto shed 2t in value • new york attorney labels eth a security • kucoin hit with lawsuit • silicon valley bank crash • huobi flash crash • biden proposes tax on btc mining • voyager liquidating assets just another day in crypto,0.6359999775886536,0.3499999940395355,0.014000000432133675
silicon valley bank the 15th largest us lender sold off usd 21 billion of its bond portfolio crystallising a usd 18 billion loss and announced a capital raise to shore up its finances silvergate and svb led to liquidity worries and sell off in us banks,0.6539999842643738,0.3319999873638153,0.014000000432133675
springen die ersten broker schon meanwhile a collapse of silicon valley bank would mark the 2nd largest bank failure in us history,0.8339999914169312,0.15199999511241913,0.014000000432133675
the sp 500 bank index fell 41 its biggest oneday drop in nearly three years on thursday with this weakness triggered by svb financial group nasdaqsivb also known as silicon valley bank announcing an emergency 225 billion capital raise to cover expected losses,0.6880000233650208,0.296999990940094,0.014000000432133675
silicon valley bank svb financial plunged 60 after it announced a plan to raise more than 2 billion in capital in an attempt to offset losses from bond sales bank run,0.6520000100135803,0.33399999141693115,0.014000000432133675
silicon valley bank is not lehman this is not 2008 corrections of 45 even 10 can happen in any market but full blown crisis unlikely fear sells,0.7730000019073486,0.21400000154972076,0.014000000432133675
australian shares fell 23 on friday as a selloff in us bank stocks sparked by concerns over the solvency of silicon valley bank svb spilled across local banks cba down over 3 via fin review,0.5669999718666077,0.4189999997615814,0.014000000432133675
big selloff in londonlisted banks pulls down the ftse 100 following the crash in silicon valley bank yesterday barclays 59 lloyds 46 natwest 45 hsbc 42,0.6269999742507935,0.3580000102519989,0.014000000432133675
silicon valley bank bailout #toobigtofail,0.8209999799728394,0.164000004529953,0.014000000432133675
silvergate bankrupt silicon valley bank cant handle bank run im receiving my cs degree next year ,0.8209999799728394,0.16599999368190765,0.014000000432133675
lol this silicon valley bank which is on the brink of insolvency has over 300 jobs open and this is how you know that the entire ten or twenty job openings for every one person is a hoax hundreds of thousands of job openings by bankrupt companies,0.8759999871253967,0.10999999940395355,0.014000000432133675
breaking us stocks and crypto have now lost over 2 trillion in market cap in under 24 hours stock market futures just hit a 2month low and #bitcoin broke below 20000 meanwhile a collapse of silicon valley bank would mark the 2nd largest bank failure in us history,0.8429999947547913,0.14399999380111694,0.013000000268220901
the four largest us banks lost more than 52 billion in market value in a single day the sale of shares in jpmorgan chase bank of america citigroup and wells fargo was provoked by the problems of silvergate and silicon valley bank which lend to tech startups,0.7440000176429749,0.24300000071525574,0.013000000268220901
#breaking silicon valley bank stock plunges over 50 premarket,0.7459999918937683,0.2409999966621399,0.013000000268220901
the currency circle and silicon valley bank exploded but this is not just a problem with the currency circle and silicon valley,0.7149999737739563,0.2720000147819519,0.013000000268220901
ive always said if a silicon valley bank that primarily caters to venturebacked tech companies fails then were all fucked,0.8149999976158142,0.1720000058412552,0.013000000268220901
ive seen comparisons of the svb silicon valley bank crisis to lehman brothers or bear stearns but imo its too small and too early to be that its more like the two bear stearns hedge funds that went bellyup in june 2007 and kicked off a long freefall for two years,0.6399999856948853,0.34700000286102295,0.013000000268220901
silicon valley bank suffered mtm losses in mbs with 10 year duration lot of mortgage lenders n banks in us will come under pressure due to the bond portfolios some accident credit event is waiting to happen in us,0.7319999933242798,0.2549999952316284,0.013000000268220901
seems heidenberg did not get time to research on silicon valley bank,0.5879999995231628,0.39899998903274536,0.013000000268220901
silicon valley bank svb 173b deposits 117b mortgagebacked securities mbs 156166 yield fed rate 457 bank run risk due to yield difference if vctech firms withdraw svb may go bankrupt startups may suffer and a recession may occur,0.6240000128746033,0.3630000054836273,0.013000000268220901
another bear sterns lehman bros in making silicon valley bank tanked over 60 leading it to wipe out 80bn in value feds constant rate hiking led to decrease in value of svbs mortgage backed securities pegged at 80bn now there is a run on the bank,0.7480000257492065,0.23899999260902405,0.013000000268220901
silicon valley bank falls 60biggest fall in 35 years bank is a key lender to startup vc funds in usa svb takes 18bn loss on sales of 21bn afs bond portfolio firesalestartup cash burn remains elevatedlower outlook experts say a bailout might be there,0.7350000143051147,0.25200000405311584,0.013000000268220901
and now we have silicon valley bank facing huge losses on its bond purchases first it was ldis but lets hope it doesnt have wider implications for the banking system,0.7870000004768372,0.20000000298023224,0.013000000268220901
silicon valley bank is basically run by group of genius without a brain big failure of data analytics that it couldnt predict something brewing like this again proving that banking is not about giving money but also getting it back #svb #banknifty #stockmarket #fed #rbi,0.8560000061988831,0.13099999725818634,0.013000000268220901
silicon valley bank crashed 60 in us market why any guesses hint interest rate raised from 025 to almost 5 in usa #stockmarketcrash #stockmarketindia #sivb #siliconvalley #siliconvalleybank #dowjones #nyse,0.6949999928474426,0.2919999957084656,0.013000000268220901
silicon valley bank in the us is struggling for liquidity will hindenbeg write on how mismanaged the us banking system is will hindenberg also write on how robustly rbi manages the indian banking system easy to point problems in india difficult to clean up own backyard,0.7239999771118164,0.2630000114440918,0.013000000268220901
anyone happy about silicon valley bank going down must not be in tech over 50 of tech startups had their funds stashed at svb the ramifications of this are going to be felt far and wide,0.8209999799728394,0.16599999368190765,0.013000000268220901
as the bank of choice for tech and startups silicon valley banks failure is disappointing but predictable i warned of svbs risky if not illegal activityand identified severe due diligence failures now customers must be made whole regulators should step up against tech,0.8410000205039978,0.1459999978542328,0.013000000268220901
when is the right time for me to suggest that silvergate and silicon valley bank executives learn to code too soon nar fuck em,0.8809999823570251,0.10599999874830246,0.013000000268220901
silicon valley bank is a us bank whose stock price is down 75 in two days over 90 off life peak high interest rates caused bond investments to lose value forcing asset sale for liquidity svb has 170 billion in deposits 50 of us startups have money at svb alarming,0.7910000085830688,0.19699999690055847,0.012000000104308128
just in silicon valley bank stock plunges over 50 premarket #news,0.7620000243186951,0.22599999606609344,0.012000000104308128
do you think theres going to be fallout damage from the silicon valley bank collapse,0.40799999237060547,0.5799999833106995,0.012000000104308128
i feel bad for silicon valley bank right now they have been the biggest capital partner to founders employees and investors over the last decade and theyre being completely turned on by all of them if svb goes under it would be detrimental to the startup community,0.8949999809265137,0.09300000220537186,0.012000000104308128
ftx borrowed customer deposits and bought shitcoins silicon valley bank borrowed customer deposits and bought long duration bonds in 2008 lehman brothers borrowed customer deposits and bought mortgage bonds fiat banking is inherently fragile,0.7689999938011169,0.21899999678134918,0.012000000104308128
 silvergate bank in trouble silicon valley bank in trouble this isnt crypto related right biden proposes much higher capital gains and crypto mining taxes new york sues kucoin calls eth a security busd mcap is decreasing,0.7519999742507935,0.23499999940395355,0.012000000104308128
breaking news silicon valley banks bond sale causes banking crisis fears sending shockwaves across financial markets #bankingcrisis #siliconvalleybank #cryptomarket #stockmarket #investing ,0.6579999923706055,0.33000001311302185,0.012000000104308128
silicon valley bank going belly up next the stock looks so soft that they might as well be called silicone valley bank,0.8370000123977661,0.1509999930858612,0.012000000104308128
us stocks and crypto have now lost over 2 trillion in market cap in under 24 hours stock market futures just hit a 2month low and bitcoin broke 20k silicon valley bank could mark the 2nd largest bank failure in us history,0.8769999742507935,0.11100000143051147,0.012000000104308128
when ftxcelsiusvoyager had a bank run we were greeted mostly with snickering and cheers for crypto to fail it is never a good thing when any financial institution gets run and crypto should support the institutions which support us of which silicon valley bank is one,0.8650000095367432,0.12399999797344208,0.012000000104308128
hey did you hear about silicon valley bank yea i dont really care either back to work,0.8309999704360962,0.15700000524520874,0.012000000104308128
silicon valley bank is insolvent on a mark to market basis was in this gem the week before the stock fell 50 in a single day sivb,0.7839999794960022,0.20399999618530273,0.012000000104308128
saying this makes me acutely nervous it is much safer for a financial journalist to predict a disaster that does not materialise than to dismiss the possibility of one that does fts unhedgedskribent robert armstrong avskriver faren for kollaps pga silicon valley bank,0.7900000214576721,0.1979999989271164,0.012000000104308128
timeline of silicon valley bank svib collapse 1 rumors emerge that sbv faces interest rate risk on 91 billion in bonds 2 svb announces firesale of 21 billion bond portfolio 3 bond portfolio sale takes a massive 18 billion loss 4 svb announces 23 billion share,0.6919999718666077,0.296999990940094,0.010999999940395355
i dont see ct talking much about the sivb silicon valley bank issue it could be the genesisequivalent in tradfi world where assetliability liquidity mismatch leads to bank run they try to issue equity to service withdrawals equity price tanks death spiral,0.6480000019073486,0.34200000762939453,0.010999999940395355
silicon valley bank didnt want to bank crypto companies because of the risk but its currently in dire straits due to the structure of its bond portfolio turns out there is real risk in traditional banking too,0.8069999814033508,0.18299999833106995,0.010999999940395355
silicon valley bank the first domino to fall make sure you have some cash on handi think this is the start of our new financial system gonna hurt,0.8610000014305115,0.12800000607967377,0.010999999940395355
i would not keep my funds inside of silicon valley bank or signature bank why would you do it with all this risk,0.7649999856948853,0.22300000488758087,0.010999999940395355
silicon valley bank has chosen to sell bonds and realise near 2bn loss rather than hold to maturity clearly a desperate move concerns that other banks may be in similar situation obviously nothing on so called business news on r4 this morning too busy with fashion story,0.7580000162124634,0.23100000619888306,0.010999999940395355
stocks on wall street take a hit as silvergate bank folds and silicon valley bank wobbles is this a sign of more trouble to come for the financial sector #stockmarket #bankingsector #economicnews,0.7649999856948853,0.2240000069141388,0.010999999940395355
a lot of people have been telling me stuff about silicon valley bank but i havent been taking it seriously because the messages are missing not financial advice,0.7590000033378601,0.23000000417232513,0.010999999940395355
where is rahul ligma and why isnt he being fired from silicon valley bank right now,0.5550000071525574,0.4339999854564667,0.010999999940395355
it is silicon valley bank down 60 on liquidity concerns dragging all banks down,0.765999972820282,0.22300000488758087,0.010999999940395355
the reason was svb financial sivb which is the holding company for silicon valley bank the stock lost 60 which spilled over into the entire financial sector regional banks were hit particularly hard and the spdr financial etf xlf suffered a loss of over 4,0.7310000061988831,0.257999986410141,0.010999999940395355
usbased silicon valley bank #svb shares plummeted by 60 overnight causing investors to lose 80b in value from bank shares the crisis triggered a #marketcrash on wall street and in #india experts compare it to lehman brothers and evergrandes crises #cryptocrash,0.828000009059906,0.16300000250339508,0.009999999776482582
timeline of silicon valley bank svib collapse 1 rumors emerge that sbv faces interest rate risk on 91 billion in bonds 2 svb announces firesale of 21 billion bond portfolio 3 bond portfolio sale takes a massive 18 billion loss,0.7429999709129333,0.24699999392032623,0.009999999776482582
in last 24h #crypto has encountered several hurdles usag classifying eth as a security lawsuit against kucoin exchange crash of silicon valley bank flash crash on huobi exchange bidens proposal for a tax on #bitcoin mining voyager liquidating assets tough times,0.7149999737739563,0.27399998903274536,0.009999999776482582
irish bank shares amid the wall street wobble aib currently down 28 boi down 32 ptsb down 27 us and european banks are under pressure after the small silicon valley bank revealed big losses,0.7680000066757202,0.22300000488758087,0.009999999776482582
banks are going under silvergate yesterday silicon valley bank today another one tomorrow tradfi having 0 customer deposits and yeeting the rest into illiquid bonds everyone quickly sell all your crypto,0.871999979019165,0.11800000071525574,0.009999999776482582
silicon valley bank turned down our business specifically because we are in web3 a short while back hows that for irony,0.8180000185966492,0.17100000381469727,0.009999999776482582
everyone talks about how risky crypto is yet here we are watching silicon valley bank a top 20 us bank fail tradfi and centralised finance is not the way forward,0.8619999885559082,0.1289999932050705,0.009999999776482582
with silicon valley bank now almost down 80 it feels like this could be the start to the market crash and recession markets usually crash and bottom a few months before the recession fully takes place so i keep leaning towards this possibly being the start of the crash,0.8069999814033508,0.18299999833106995,0.009999999776482582
with sell off in global markets triggered by #svbsilicon valley banks meltdownthings went rapidly downhill with banking sector creating the biggest drag us banks like wells fargo jpmorgan chase and citigroup all slid asian banks too followed their wall street peers,0.8230000138282776,0.16699999570846558,0.009999999776482582
breaking silicon valley bank lost 18 billion in the sale of us treasuries and mortgagebacked securities that it had invested in owing to rising interest rates when will the fed blink,0.7889999747276306,0.20100000500679016,0.009999999776482582
silicon valley bank collapse is very bad news for start up ecosystem,0.8889999985694885,0.10100000351667404,0.009999999776482582
was stressy all day bcs i saw that silicon valley bank might potentially go belly up and i couldnt watchread the deep dives bcs i was at workworking but now that im home it is time for another rabbit hole,0.8989999890327454,0.09000000357627869,0.009999999776482582
todays market recap bank thread the banking sector crushed after silicon valley banks troubles boil over sivb was 60 today this dragged down the entire #banking sector jpm54 c 41 bac 61 usb 71 14,0.8610000014305115,0.12999999523162842,0.009999999776482582
silicon valley bank stock lost two third of its value yesterday amid bank run concerns,0.7160000205039978,0.27399998903274536,0.009999999776482582
as we were raising our first round silicon valley bank ghosted us 2 weeks into the process of creating a new account we ended up at mercury thank fucking god,0.8859999775886536,0.10300000011920929,0.009999999776482582
fking shocked by whats happening at silicon valley bank,0.8759999871253967,0.11299999803304672,0.009999999776482582
the fact that silicon valley bank is about to fall is literally based on feds policy its the first slight sign that were on the edge of the biggest crisis weve witnessed since 1929,0.8939999938011169,0.09700000286102295,0.008999999612569809
any thoughts on how sivb silicon valley bank will handle the liquidity mismatch because weve seen assetliability liquidity mismatch leads to bank run they try to issue equity to service withdrawals equity price tanks death spiral,0.7480000257492065,0.24300000071525574,0.008999999612569809
silicon valley bank should just tell their failing portfolio companies to stop,0.8769999742507935,0.11400000005960464,0.008999999612569809
silicon valley bank being at risk of a bank run is not something i ever expected to hear yet here we are,0.8349999785423279,0.15600000321865082,0.008999999612569809
seeing a lot of dumb commentary about silicon valley bank in the timelines it reads like a maturity mismatch boring trad bank stuff that happens when interest rates rise and customers demand deposits,0.8320000171661377,0.1589999943971634,0.008999999612569809
silicon valley bank shares dropping like a meteor about to crash this is a bank not a crypto exchange a bank ,0.8479999899864197,0.14399999380111694,0.008999999612569809
svb silicon valley bank debt trouble could blow up into a global debt crisis too much debt around the world could be a contagious event watch this space,0.8389999866485596,0.15199999511241913,0.008999999612569809
morning all apac stocks declined amid headwinds from the banking selloff in the us owing to contagion fears related to silicon valley bank,0.7620000243186951,0.2290000021457672,0.008999999612569809
the stock market losses in silicon valley bank based in santa clara are staggering down 10 billion today down 30 billion in one year it claims half of all venturebacked tech and life science firms in the us bank with it sivb,0.8479999899864197,0.14300000667572021,0.008999999612569809
since everyones making a thread about svb heres my contribution silicon valley bank is an old boring conservative bank it is in trouble not because of bad lending practices but because of a combination of strange way to invest short term money announcing a capital raise,0.8659999966621399,0.12600000202655792,0.00800000037997961
quick primer on whats going on with silicon valley bank the banks are out of money withdraw all your cash immediately hurry,0.8880000114440918,0.10400000214576721,0.00800000037997961
silicon valley bank is a mammoth if they fall youre gonna see many tech start ups close shop kucoin will probably be banned in the us by eoy the us is in financial distress the only bandaid is more printing by the fed and this will only exasperate the problem,0.8820000290870667,0.10999999940395355,0.00800000037997961
people in nz need to be aware of the silicon valley bank disaster currently unfolding stock crash from a bank run is not a good thing ramifications will be far and wide even to nz this could be the start of something #siliconvalleybank,0.8769999742507935,0.11500000208616257,0.00800000037997961
silicon valley bank financial is in more trouble than it looks and so is the banking industry at large 1 a large allocation of svbs deposits come from tech startups in silicon valley these deposits have been drying up down 16b from 189b in 2021 to 173b 2022,0.8510000109672546,0.14000000059604645,0.00800000037997961
why is everything falling us based silicon valley bank was most preferred bank for vc firms svb share price have fallen by 80 and bank is facing severe liquidity and solvency risk the bank is on the verge of becoming insolvent and hence panic in all assets ,0.8999999761581421,0.09099999815225601,0.00800000037997961
i just got fired from silicon valley bank i was the one in charge of arranging hookers and blow for founders,0.8970000147819519,0.0949999988079071,0.00800000037997961
a day after silvergate bank announced its liquidation another bank operating in the field of fintech and cryptocurrencies silicon valley bank also began to have problems,0.8360000252723694,0.15600000321865082,0.007000000216066837
the sell off isnt due to china not putting liquidity is it fed going for 05bps silvergate silicon valley bank being in trouble and probably a few others employment numbers usa being bad aint it ,0.828000009059906,0.16500000655651093,0.007000000216066837
why is silicon valley bank tethering on the brink of collapse gee idk could it be because the very concept of banking basically ceased to exist when the federal reserve set the reserve requirement to zero how the hell are people not spooked af about this is beyond me,0.8880000114440918,0.10499999672174454,0.007000000216066837
its been reported that silicon valley bank has frozen withdrawals for some customers causing frustration and concern this is a reminder that traditional banks have significant control over your money and can restrict access in various ways,0.7879999876022339,0.20499999821186066,0.007000000216066837
second bank in a week potentially collapsing first silvergate looking to liquidate now silicon valley bank dropping 61 the #economy is not looking great yet powell wants to continue and accelerate the hikes,0.9110000133514404,0.0820000022649765,0.007000000216066837
once sat next to a guy on a flight who pulled up his personal bank account he had 300000000 in his checking unfortunately his account was with silicon valley bank he is now broke his wife left him he is about to end it all,0.8980000019073486,0.0949999988079071,0.007000000216066837
we are living in such a stupid timeline silicon valley bank one of the top 20 banks in the us is seemingly in trouble and some folks on twitter are recommending moving cash to a fintech named meow,0.9229999780654907,0.07100000232458115,0.007000000216066837
this is behind the implosion of silicon valley bank as it sits on a massive paper loss on mbs mortgage backed securities in addition to the loss the bought treasuries pay next to nothing interest rates which seriously hampers liquidity of many institutions,0.8840000033378601,0.10899999737739563,0.007000000216066837
welp another irresponsible coverage hysteria w about silicon valley bank n possible banking system going over board geez non stop this is not news,0.9139999747276306,0.07999999821186066,0.007000000216066837
first silvergate and now silicon valley bank i know of a few friends who use svb this is not a good sign when banks start to show signs of weakness,0.8980000019073486,0.0949999988079071,0.007000000216066837
second bank in a week potentially collapsing first silvergate looking to liquidate now silicon valley bank dropping 61 the economy is not looking great yet powell wants to continue and accelerate the hikes,0.9089999794960022,0.08399999886751175,0.007000000216066837
the silicon valley bank debacle is dangerous and should prompt regulator action to stop a contagion the venture community who have used them as a piggy bank shouldnt whine your business shouldnt have debt in it if it doesnt have cash flow or assets that is what equity is,0.8849999904632568,0.10899999737739563,0.006000000052154064
prediction buffett bails out silicon valley bank sivb also prediction this is not as favourable to common as you might think,0.8429999947547913,0.1509999930858612,0.006000000052154064
silvergate bank going under is bad silicon valley bank going under would be exponentially worse lets hope that doesnt happen,0.9340000152587891,0.05900000035762787,0.006000000052154064
whats happening with silicon valley bank and todays 60 crash in its share price is just the tip of the iceberg a decade of zirp and qe has set the stage for a far greater financial crisis with high #inflation than the one the #feds low interest rate policy caused in 2008,0.9070000052452087,0.08699999749660492,0.006000000052154064
wait so why did silicon valley bank shit the bed anyone,0.8019999861717224,0.19099999964237213,0.006000000052154064
