,neg,neu,pos
silicon valley bank shares plunge on stock sale plan to stem cash burn banks now holding onto bad balance sheets biden print and spend policies with 100s of billions of fraud waste and abuse have brought about historic inflation and interest rates signaling big trouble ahead,0.8920000195503235,0.10100000351667404,0.006000000052154064
why is silicon valley bank selling off bonds at huge losses the bank is facing 2 huge problems the first is interest rates,0.9139999747276306,0.07999999821186066,0.006000000052154064
silicon valley banks balance sheet issues will make startups and investors panic they pull their money svb ends up in an even worse position more bad news cycles even more money gets pulled out this could become a selffulfilling prophecy,0.8989999890327454,0.0949999988079071,0.006000000052154064
silicon valley bank closed down my companys account when i could not fly back to the us to settle a 60 balance their customer service was totally unkind their website is an abomination if they die it a great reminder silicon valley has the deepest graveyard of companies,0.9350000023841858,0.05900000035762787,0.004999999888241291
how bad is the silicon valley bank situation #siliconvalleybank,0.9279999732971191,0.06700000166893005,0.004999999888241291
silicon valley bank sivb looks like a possible bank run and the whole bank sector got crushed today what about all those bonds held to maturity and not marked to market on their books the feds tightening is making an impact this could set up for something ugly by monday,0.9020000100135803,0.09200000017881393,0.004999999888241291
silicon valley bank closed my account out of nowhere in 2020 fuck them hope they go under ,0.9549999833106995,0.04100000113248825,0.004000000189989805
