,neg,neu,pos
i am rooting for silicon valley bank they have been a great partner to startups and have made the ecosystem better in a myriad of ways,0.004000000189989805,0.009999999776482582,0.9869999885559082
everyone ive ever met from silicon valley bank has been dead on super helpful for startups and just generally lovely people so i hope financial uk pull through their current problems ,0.013000000268220901,0.028999999165534973,0.9589999914169312
silicon valley bank has been our partner for the last years their dedication entrepreneurial culture competitive capabilities and creativity is second to none and i hope they get through this ,0.004999999888241291,0.039000000804662704,0.9559999704360962
this morning is an interesting morning to be sharing an office building with silicon valley bank ,0.0010000000474974513,0.04500000178813934,0.9539999961853027
silicon valley bank svb falling fast entrepreneurs love them and are coming out to support there will be an impact on #venturecapital globally including in india stay tight #svb,0.004000000189989805,0.0689999982714653,0.9269999861717224
many people dont realize how instrumental silicon valley bank has been to the growth of iconic tech companies back when they were struggling startups they have also been hugely important financial partners for pretty much every single notable venture fund over the last four,0.014000000432133675,0.11400000005960464,0.871999979019165
silicon valley bank has been a stalwart of the technology ecosystem but also banks half of the us tech industry foolish and wrong to root against them wishing them much success and hoping everybody takes 34 deep breaths,0.041999999433755875,0.13300000131130219,0.824999988079071
whats the best thing youve read on silicon valley bank so far,0.006000000052154064,0.18400000035762787,0.8090000152587891
after yesterdays capital raise silicon valley bank is one of the safest banks in the country banks take deposits and invest them in either loans or securities the bank had a portfolio of 21 billion in securities classified as available for sale,0.004999999888241291,0.2529999911785126,0.7429999709129333
#cryptonews someone made 617184 with only 96 on silicon valley bank options the lucky person was able to earn 642900 of the income by buying options on the right to sell the stock at a specified price,0.006000000052154064,0.2590000033378601,0.7350000143051147
 i am a very smart vc i know about the monies and how to make them people come from all over the world for my sound financial advice ask me anything lunaterra hodl ftx hodl silicon valley bank save yo self bank run now tether hodl,0.01600000075995922,0.25699999928474426,0.7269999980926514
we just had three silicon valley bank clients across vc and founders react to the news on air and wow,0.006000000052154064,0.30399999022483826,0.6899999976158142
realised silicon valley bank is super popular among usfocussed indian startups looks like almost everyone banks with them,0.01600000075995922,0.3199999928474426,0.6650000214576721
we might see the biggest bank run in history shortly silicon valley bank,0.017999999225139618,0.3190000057220459,0.6620000004768372
woke up this morning to hundreds of messages on all the fintech founder whatsapp groups im on playing out the run on silicon valley bank in real time that was surreal,0.014000000432133675,0.328000009059906,0.6570000052452087
title silicon valley bank rocks crypto and equity markets ahead of nonfarm payrolls release,0.006000000052154064,0.3580000102519989,0.6370000243186951
lord give me the confidence of the investor who owns both silicon valley bank and silvergate bank,0.032999999821186066,0.35100001096725464,0.6159999966621399
silicon valley bank rocks crypto and equity markets ahead of nonfarm payrolls,0.007000000216066837,0.38600000739097595,0.6069999933242798
this little startup founder who got lazy with all the due diligence silicon valley bank wanted around a crypto startup and just left the corporate accounts with and is feeling pretty good right now,0.12099999934434891,0.3199999928474426,0.5580000281333923
dont worry guys silicon valley bank is still solvent in the metaverse,0.019999999552965164,0.4410000145435333,0.5389999747276306
i wonder whats going on with silvergate bank and silicon valley bank the conventional wisdom is that bank balance sheets are solid now and stress testing has been effective so interesting to see these big shocks,0.014000000432133675,0.44999998807907104,0.5360000133514404
#svb silicon valley bank crisis could well be a shot in the arm for some good fintech #startup to scale so far by is helping a lot of folks struggling with svb crisis give a shout out reach out in case you are struggling here ,0.06700000166893005,0.41100001335144043,0.5220000147819519
important announcement for the remaining week im taking a break from being an expert on everything else on twitter to be an expert on silicon valley bank thanks,0.024000000208616257,0.46299999952316284,0.5130000114440918
flipboard has been a long time client of silicon valley bank and were sticking by them,0.013000000268220901,0.47600001096725464,0.5109999775886536
cant wait for my feed to be flooded with silicon valley bank risk management department 2023 shirt promotions,0.0729999989271164,0.4169999957084656,0.5099999904632568
dogecoin has a bigger market capitalization than silicon valley bank let that sink in #sivb,0.03099999949336052,0.460999995470047,0.5080000162124634
i am really hoping silicon valley bank pulls through this crisis they have been a great partner to the tech ecosystem in 100 different ways its actually a sad day for tech,0.29499998688697815,0.20800000429153442,0.4970000088214874
alchemy pay has no exposure to silicon valley bank and silvergate nor do we have any funds deposited in these institutions our partnered banks are in full compliance with all regulations we maintain a positive outlook on the future of a safer crypto world #alchemypay,0.019999999552965164,0.49799999594688416,0.4819999933242798
thinking of all the sunday newspaper business journalists trying to figure out if they need a feature on silicon valley bank for the weekend for what its worth id definitely read one #svb,0.023000000044703484,0.5040000081062317,0.4740000069141388
silicon valley bank crashing san francisco dead california pizza kitchen alive thriving there is still hope for the state of california ,0.09700000286102295,0.4869999885559082,0.41600000858306885
i know more than a few nasdaq companies with credit lines at silicon valley bank pray for them yall ,0.05900000035762787,0.5320000052452087,0.4090000092983246
top 2 benefits of locating your startup in 1 you cant bank with silicon valley bank 2 you cant bank with silvergate,0.12099999934434891,0.4860000014305115,0.3930000066757202
whats happening with svb silicon valley bank is either the tip of the iceberg this recession has been waiting for or really no big deal and a great stock buying opportunity dont ask me which though ,0.2590000033378601,0.37599998712539673,0.36399999260902405
im devastated silicon valley bank was my favorite bank in the whole world my home away from home,0.4440000057220459,0.2029999941587448,0.3529999852180481
you cant underestimate the importance of silicon valley bank to the world economy did you know they had a vault 14 stories under palo alto that held 40 of the worlds silicon reserves all gone now stolen by the east germans,0.10499999672174454,0.5440000295639038,0.35100001096725464
pabrai on svb financial and you know silicon valley bank is an interesting bank i think theyre still around i dont know someone bought them or not but theyre basically headquarter in silicon valley and they are pretty well run bank theyre in deep trouble now right,0.1850000023841858,0.4869999885559082,0.3269999921321869
gm investors traders money makers its payroll day at 830am a bunch of payroll data will be announced silicon valley bank drops over 45 over 70 billion was wiped off the crypto market as bitcoin tumbled its friday lets get it ,0.07199999690055847,0.6399999856948853,0.289000004529953
 silicon valley bank down thats huge thanks for putting that up on your locals,0.4050000011920929,0.3319999873638153,0.2630000114440918
elon please buy silicon valley bank ,0.04100000113248825,0.7009999752044678,0.25699999928474426
silicon valley bank credit suisse on the verge of bankruptcy fortunately were saved as this is a regulated market ,0.18700000643730164,0.5740000009536743,0.23899999260902405
any good alternatives to silicon valley bank im looking for the api connections and automation capabilities of svb #startups #banks #netsuite #automation,0.019999999552965164,0.7429999709129333,0.2370000034570694
breaking mr beast provides emergency liquidity facility to silicon valley bank,0.009999999776482582,0.7549999952316284,0.23399999737739563
silicon valley bank is the gold standard for banking and theyve been vc and startup company friendly for decades im skeptical about this bear run on them dunno,0.1720000058412552,0.6029999852180481,0.22499999403953552
when i was working in saas silicon valley bank was both a customer of ours and we were a customer of theirs in other words a partner they provided us with credit facilities we didnt need to draw on them in rich times and we sold them customer service software,0.03700000047683716,0.7400000095367432,0.22200000286102295
one thing i have not heard mentioned about silicon valley bank #svb is that they are a big player in the commercial real estate space specifically a niche product called a subscription line which is used by real estate private equity to fund acquisitions quickly,0.026000000536441803,0.7559999823570251,0.21799999475479126
for your kind information svb is silicon valley bank and not shamrao vithal bank and thankfully its not listed nahi to aaj pata nahi kya ho jaata ,0.09700000286102295,0.6909999847412109,0.210999995470047
silicon valley banks ceo we have ample liquidity to support our clients with one exceptionif everybody is telling each other that svb is in trouble that will be a challenge what an own goal in my prev startup we had funds in svb i dealt with svb folks shocking,0.22499999403953552,0.5640000104904175,0.20999999344348907
silicon valley bank is the 15thlargest bank in the united states in terms of assets hold 173 billion in deposits thats even bigger than largest bank in india stock is down 60 overnight is this lehman crisis for the startup world,0.2619999945163727,0.5289999842643738,0.20800000429153442
youre laughing silicon valley bank is nuking youre laughing,0.40700000524520874,0.3889999985694885,0.20399999618530273
peter thiels founders fund advises companies to withdraw money from silicon valley bank bloomberg sivb 604 today and another 17 after hours 169b in deposits we got ourselves a bank run,0.04100000113248825,0.7599999904632568,0.20000000298023224
just set up my accounts at silicon valley bank time for a sip of coffee and to open up twitter,0.012000000104308128,0.7900000214576721,0.19900000095367432
silicon valley bank should announce a chatgpt integration,0.03099999949336052,0.7730000019073486,0.19499999284744263
i just called a vc to ask how he was advising his portfolio companies to deal with the silicon valley bank fallout youre going to have to make this quick he said im on the gondola in aspen and were almost to the top,0.07900000363588333,0.7300000190734863,0.19099999964237213
silicon valley bank what has happened in the last 24 hours a perspective from silicon valley please retweet if you find it useful 1x chartlife ,0.006000000052154064,0.8040000200271606,0.1899999976158142
i remember getting into tech and learning about silicon valley bank and thinking oh thats cute we have our own little tech bank and not really considering the horrible risks involved in that,0.46000000834465027,0.3630000054836273,0.1770000010728836
bank stocks today silicon valley bank 60 silvergate 42 jp morgan 54 bank of america 62 wells fargo 61 welcome back to 2008,0.07100000232458115,0.7670000195503235,0.16200000047683716
how time flies eevergrande to #creditsuisse to hindenburg vs adani to silicon valley bank interesting is people easily forget the previous issue while writing thread on current ones ,0.057999998331069946,0.7829999923706055,0.1589999943971634
1 the first time i read about silicon valley bank svb was through the uspto patent assignment data because svb is a major lender to startups especially vcbacked startups they often obtain senior priority security interests in the startups patents to secure the debt,0.01899999938905239,0.8320000171661377,0.14900000393390656
i was in the techstartup world for 15 years i have never heard of silicon valley bank till now actually in my life i have made a list of 200 startups that are going to get impacted most due to svb financial struggle want access hit like and comment svb must follow ,0.24500000476837158,0.6069999933242798,0.14800000190734863
looks like yesterdays dont forget to take some profit tweet was on point its doom scrolling how fast silicon valley bank shot themselves in the foot,0.5019999742507935,0.3540000021457672,0.14399999380111694
good morning team news of the 16th largest us bank silicon valley bank fell more than 60 last night making all banking stocks in the dow jittery that has spread like a wildfire across global markets though we are immune to that news sentiment will drag our index as well,0.35100001096725464,0.5070000290870667,0.1420000046491623
hearing extraordinary reports from tech entrepreneurs this morning who are panicking about the state of silicon valley bank,0.3529999852180481,0.5090000033378601,0.1379999965429306
venturecapital investors are advising entrepreneurs to move their money out of silicon valley bank svb many have already opened accounts at other firms like first republic and brex to transfer funds out of svb #svb #vc #entrepreneurs,0.01899999938905239,0.8429999947547913,0.1379999965429306
i hope silicon valley bank the financial services partner for the innovation economy gets hank paulsond svb #nottoobigtoofail #bye #banksters #notsosmartafterall,0.4339999854564667,0.4320000112056732,0.1340000033378601
bear stearns too big to fail silicon valley bank too many buzzwords to understand,0.3070000112056732,0.5600000023841858,0.13300000131130219
least of all silicon valley bank,0.12700000405311584,0.7440000176429749,0.1289999932050705
lol government bails out silicon valley bank after peter thiel starts bank run is right up elizabeth warrens alley,0.20600000023841858,0.6700000166893005,0.12399999797344208
ftx silvergate bank silicon valley bank maybe selfcustody isnt such a bad idea after all ,0.11100000143051147,0.765999972820282,0.12300000339746475
silicon valley bank is fdic insured and will always be bailed out by the fed unlike youre 215k long,0.11400000005960464,0.765999972820282,0.11999999731779099
there is just one topic on every founder group in india im a part of right now silicon valley bank yesterdays share price drop seems to have triggered a bank run you know its serious when ceos of popular neobanks are personally attempting to acquire these customers,0.32100000977516174,0.5619999766349792,0.11699999868869781
#sivb sivb we always associated the cdos subprime and the sivs with the junk that sunk the financial sector back in the gfc however this time it is pristine aaa treasury and agency investments my thoughts on silicon valley bank #siliconvalley,0.19599999487400055,0.6880000233650208,0.11699999868869781
uber has no cars airbnb has no houses silicon valley bank has no deposits this is the new economy,0.4050000011920929,0.48399999737739563,0.11100000143051147
the news about silicon valley bank today is precisely why its important that startup founders understand whats happening macroeconomically when one of the largest sources for venture debt loses 60 of its value in one day its going to affect your fundraising in a big way,0.45500001311302185,0.4359999895095825,0.10899999737739563
btc markets has no exposure to silvergate or silicon valley bank  we always take a conservative approach to managing our business and client assets including not lending client assets not holding any debt in our business maintaining complete segregation of client,0.05400000140070915,0.8389999866485596,0.10700000077486038
talk about freaky friday fud nyag claims eth is a security silicon valley bank ht flash crash biden tax on #bitcoin mining going to be an eventful weekend ,0.3709999918937683,0.5230000019073486,0.10700000077486038
quick update silicon valley bank ceo greg becker told top venture capitalists in svb to stay calm amid concerns around capital crunch that wiped nearly 10 billion off the banks market valuation spx #sp500 #nasdaq #siliconvalley #siliconvalleybank,0.04500000178813934,0.847000002861023,0.10700000077486038
silicon valley bank uk became a subsidiary of silicon valley bank in september last year and thus is covered by the financial services compensation scheme and by the financial ombudsman service,0.010999999940395355,0.8830000162124634,0.10599999874830246
i hope silicon valley bank solves this crisis they have been a great partner to the tech ecosystem and helped a lot of latam startups to access the foreign financial system its a sad day for the whole ecosystem,0.6359999775886536,0.25999999046325684,0.10400000214576721
silicon valley bank being the first banking casualty of the startup bust would be pretty funny,0.4000000059604645,0.4959999918937683,0.10400000214576721
silicon valley bank clearly,0.0560000017285347,0.843999981880188,0.10000000149011612
where are all the i bet jim cramer liked silicon valley bank tweets,0.11800000071525574,0.7860000133514404,0.09600000083446503
silicon valley bank first to go ,0.013000000268220901,0.8899999856948853,0.09600000083446503
ive been prolific today but some days insist on more from the mars messenger bank stocks in the news silvergate in recent days sivb 60 today silicon valley bank crash far worse because this is the bank for cutting edge tech in the bay area the astro view my way,0.48100000619888306,0.42399999499320984,0.0949999988079071
big afternoon for us banks jpmorgan sues staley for damages tied to epstein lawsuits silicon valley bank launches 225bn share sale to shore up capital base silvergate to shut down in face of crypto market turmoil via and myself,0.09099999815225601,0.8180000185966492,0.09099999815225601
run on the bank whispers at silicon valley bank i have major ptsd from lehman stay safe out there,0.41499999165534973,0.4950000047683716,0.09000000357627869
i am advising my portfolio startups to keep money in silicon valley bank i need to get my money out first,0.15199999511241913,0.7590000033378601,0.08900000154972076
im interviewing greg becker ceo of silicon valley bank tomorrow at upfront summit dm me if you have any burning questions for greg,0.00800000037997961,0.902999997138977,0.08900000154972076
happening now silicon valley bank run,0.04600000008940697,0.8650000095367432,0.08900000154972076
peter thiel backed founders fund has advised companies to pull deposits out of silicon valley bank stock down 40 after hours under federal reserve system customers have not lost their deposits in the us in any banking panic even in sl crisis in 1980 and gfc 2008,0.17000000178813934,0.7429999709129333,0.08699999749660492
mr beast should bail out silicon valley bank,0.3109999895095825,0.6029999852180481,0.08699999749660492
if someone has an explainer of what the hell is going on with silicon valley bank and what the realistic implications are id enjoy it,0.2840000092983246,0.6299999952316284,0.0860000029206276
yesterday a trader bought sivb march 200 puts for 25 per contract they spent 7500 on the position silicon valley bank is down 60 today position is now worth 21 million,0.25699999928474426,0.6610000133514404,0.08299999684095383
funds are safu silicon valley bank ,0.0430000014603138,0.8759999871253967,0.08100000023841858
black swan silicon valley bank,0.07599999755620956,0.8429999947547913,0.08100000023841858
the list of billionaires banks and private equity that would love to own silicon valley bank is massive its very low probability they go out of business that said the folks there who bought 100b in 10 year bonds in 2021 at 17 interest are not so bright,0.5170000195503235,0.4050000011920929,0.07800000160932541
everybody talking about silicon valley bank,0.08900000154972076,0.8349999785423279,0.07599999755620956
silicon valley bank type incidents will happen more fequently when interest rates in the us which were near 0 and are at about 5 all within a year the losses can be tremendous rbi has done a great job here but needs to keep a watch,0.4620000123977661,0.46799999475479126,0.07000000029802322
currently moving my funds into silicon valley bank be greedy when others are fearful,0.4359999895095825,0.4950000047683716,0.07000000029802322
does this mean i dont have to pay back silicon valley bank,0.1720000058412552,0.7599999904632568,0.06800000369548798
founders fund a venture capital fund cofounded by peter thiel and ycombinator has advised companies to pull money from silicon valley bank sivb #crypto #nfts #economy,0.02500000037252903,0.9079999923706055,0.06700000166893005
silicon valley bank facing a run too so its not just crypto contrary to popular belief,0.1120000034570694,0.8220000267028809,0.06499999761581421
the first crack in tradfi starting to appear this year silvergate bank and silicon valley bank are the first causality and we barely in the end of q1 right now,0.125,0.8109999895095825,0.06499999761581421
im bearish but the collapse of svb silicon valley bank is not gonna cause other banks to go under since 0809 banks are strapped up so tightly most are extremely well capitalised credit suisse 12 jpm 19 not gonna happen still monitoring liquidity its drying up,0.4959999918937683,0.4410000145435333,0.06300000101327896
whats the best thing i can read to get a quick download of whats going on with silicon valley bank,0.04699999839067459,0.8899999856948853,0.06300000101327896
we would like to inform our stakeholders that insurdao is not affected in any way by the events surrounding the silicon valley bank,0.06499999761581421,0.871999979019165,0.06300000101327896
from what i understand a lot of crypto startups and vcs use silicon valley bank which is currently experiencing a smol bank run,0.041999999433755875,0.8939999938011169,0.06300000101327896
uk stocks with exposure to silicon valley bank via loan facilities etc disclaimer fyi maybe no need to read into it etc sivb #sivb #svb #svbbank • eenergy group #eaas • molten ventures #grow • yourgene health #ygen • redcentric #rcn • aferian #afrn 12,0.03999999910593033,0.8980000019073486,0.06199999898672104
silicon valley bank feels like ftx all over again,0.38600000739097595,0.5519999861717224,0.06199999898672104
hard to be that worried about silicon valley bank if the bank hits a true liquidity crisis the government will likely engineer an acquisition of the firm by one of the top 5 banks,0.2630000114440918,0.6759999990463257,0.06199999898672104
are we witnessing 2008s lehman moment for the startup world silicon valley bank svb stock crashed 60 today svb is one of the largest banks in the us 15 ,0.4490000009536743,0.49000000953674316,0.061000000685453415
silicon valley bank is a member of the fdic and of the federal reserve system fed could intervene if necessary,0.027000000700354576,0.9120000004768372,0.061000000685453415
the sharp moves followed svb financial group sivb parent of startuplender silicon valley bank noting a higherthanexpected cash burn from clients falling deposits and rising costs of capital,0.09300000220537186,0.847000002861023,0.061000000685453415
if youre a ceo of a tech company who doesnt bank with silicon valley bank its probably a good time to let your entire company know the impact of svb on tech companies could cause some companies to become insolvent in the next week layoffs missed payroll etc,0.30300000309944153,0.6380000114440918,0.05900000035762787
would and to be able to resist a bank run like silicon valley bank even if they only hold short term bonds not sure for usdt though i wonder if these bond markets are liquid enough to absorb an instant sale of 120bn of bonds,0.14100000262260437,0.8029999732971191,0.05700000002980232
from what im seeing in founder whatsapp signal groups it will be tough for silicon valley bank to ride this out rooting for them to get through this but seems confidence has already evaporated risk of contagion to other startup banks what about funds who bank with them,0.3790000081062317,0.5640000104904175,0.05700000002980232
us bank stocks today silicon valley bank 60 silvergate 42 jp morgan 54 bank of america 62 wells fargo 61,0.0689999982714653,0.875,0.0560000017285347
silicon valley bank was a zerointerest rate phenomenon,0.18700000643730164,0.7570000290870667,0.0560000017285347
it seems markets main theme move from nfp to silicon valley bank,0.12700000405311584,0.8220000267028809,0.052000001072883606
breaking silicon valley bank sivb ceo has said to investors stay calm and dont panic per nyp the stock is down 60 today,0.382999986410141,0.5649999976158142,0.052000001072883606
silicon valley bank signature bank b riley financial keep an eye on these,0.02500000037252903,0.9240000247955322,0.050999999046325684
ftx account holders are looking at 515 cents on the dollar silicon valley bank account holders are looking at 75 cents on the dollar worst case but most likely 95100 an order of magnitude less bad,0.4880000054836273,0.4620000123977661,0.05000000074505806
bank stocks last 5 days silicon valley bank 60 wells 10 jp morgan 7 b of a 9 credit susie 6,0.035999998450279236,0.9139999747276306,0.05000000074505806
peter thiel starts bank run on silicon valley bank is just elizabeth warren bait isnt it,0.2639999985694885,0.6869999766349792,0.04899999871850014
