,neg,neu,pos
one of the challenges is that svb depositors have much larger average balances than the fdic 250k limit its the bank of record for the venture backed business world when you raise 50m from sequoia where do you think you put the 50m you deposit it at silicon valley bank,0.19599999487400055,0.7549999952316284,0.04899999871850014
a bored ape is opening a new account at silicon valley bank right now,0.492000013589859,0.46000000834465027,0.04800000041723251
heres a crypto explainer of whats going on with silicon valley bank during the covid bull run svb saw tons of people depositing 0 interest things as their fiat holdings grew to nearly 190bn they became degens and wanted to yield farm they aped 80bn into,0.14300000667572021,0.8090000152587891,0.04800000041723251
withdraw from silicon valley bank to where,0.04399999976158142,0.9070000052452087,0.04800000041723251
contagion stemming from a collapse of silicon valley bank would be 10x of that of ftx given they have 170b of deposits never too late to assess the creditworthiness solvency of your custodians assets and counterparties vcs are advising portfolio companies to move out of svb,0.3140000104904175,0.6380000114440918,0.04800000041723251
jpmorgans jamie dimon has apparently had an interest in silicon valley bank for years ,0.04600000008940697,0.9070000052452087,0.04699999839067459
isnt it a bit crazy to have one the silicon valley bank what happened to competition when i was launching a startup 20 years ago they already impressed me as pretty inflexible and hard to deal with this usually only gets worse with time,0.7269999980926514,0.2280000001192093,0.04500000178813934
first a few things on banking #sivb is a holding company they own a bank that bank somewhat confusingly is also called silicon valley bank the reason for this distinction is that the holdco structure allows svb the company to do lots of other things besides banking,0.04100000113248825,0.9129999876022339,0.04500000178813934
yesterday march 9 silicon valley banks stock price plummeted 60 triggering a riskoff market gold rallied,0.31200000643730164,0.6439999938011169,0.04399999976158142
plunged 60 silicon valley banks fundraising raises liquidity panic crashing bank stocks,0.32899999618530273,0.6269999742507935,0.04399999976158142
has silicon valley bank considered saying that its going to implement chatgpt,0.05700000002980232,0.8980000019073486,0.04399999976158142
silver gate capital goes down yesterday silicon valley bank goes down today financial sued by the the nyag q1 2023 can it get any better ,0.671999990940094,0.2840000092983246,0.04399999976158142
silvergate and silicon valley bank are both going under why the fractional reserve banking system they keep a small fraction of deposits on hand now people want their money and they cant pay this is not a #bitcoin or #crypto problem this is the glory of tradfi banking,0.6660000085830688,0.29100000858306885,0.0430000014603138
its worth taking a look at the recent developments with silicon valley bank its concerning that many are still unaware of who controls their finances in contrast with bitcoin you always have complete control over your money and such situations can be avoided #svb #bitcoin,0.4359999895095825,0.5210000276565552,0.0430000014603138
possibly a silly question but w the silicon valley bank run today should we concerned about companies like betterment or wealthfront that could have exposure,0.19099999964237213,0.7670000195503235,0.0430000014603138
everyone said the wont stop hiking until something breaks is silicon valley bank going down the beginning ,0.22200000286102295,0.7360000014305115,0.041999999433755875
am i understanding it right that dumb fuck vcs and dumb fuck startups had their cash in silicon valley bank and are now for the first time googling counterparty risk hahahha,0.7009999752044678,0.25699999928474426,0.041999999433755875
sounds like a few founders are considering or actively pulling their money from silicon valley bank sivb wow feeling like 2008 around here,0.5180000066757202,0.4399999976158142,0.041999999433755875
has silicon valley bank tried implementing ai yet,0.061000000685453415,0.8980000019073486,0.04100000113248825
this silicon valley bank story is crazy,0.5600000023841858,0.39899998903274536,0.04100000113248825
yeah but hes not talking about silicon valley bank,0.1550000011920929,0.8040000200271606,0.04100000113248825
#economy silicon valley bank sells 21b in bonds at 18bn lossthe funder is bleeding new silicon valley is forming mcaps on the move,0.3100000023841858,0.6499999761581421,0.04100000113248825
dont worry about the silicon valley bank thing it is not like jpm is about to bankrupt just a small bank in the west if you are long doomsday scenario you better look at debit suisse,0.5130000114440918,0.44699999690055847,0.03999999910593033
us bank stocks today silicon valley bank 60 silvergate 42 jp morgan 54 bank of america 62 wells fargo 61 even tesla is down 11 for the week so its not only crypto is down #btc #crypto #inflation #hodl #trending,0.5440000295639038,0.4169999957084656,0.039000000804662704
silicon valley bank more like silicon valley sank,0.4169999957084656,0.5440000295639038,0.039000000804662704
dear silicon valley bank community,0.5669999718666077,0.39399999380111694,0.039000000804662704
now the tradfi is collapsing hashtag silicon valley bank its finally time to accept that the future is not depending on a central bank and instead converting all your money in gold coins to store in a basement vault you can dive into hashtag scrooge mc duck,0.6539999842643738,0.30799999833106995,0.03799999877810478
what is the correlation between silicon valley bank and crypto,0.07900000363588333,0.8840000033378601,0.03700000047683716
on march 10 silicon valley bank which specializes in providing financial services to silicon valley technology companies sold 21 billion of marketable securities and suffered a loss of us18 billion,0.44999998807907104,0.5130000114440918,0.03700000047683716
if silicon valley bank wants to slow down the exodus of deposits they should talk to the legal sports books and get the low down on amlkyc on the way out,0.17800000309944153,0.7860000133514404,0.03700000047683716
lets think this out as it is increasingly probable crypto accesses the us banking system only via 1 silvergate liquidating 2 signature bank almost certainly shutting its signet network and possibly liquidating 3 silicon valley bank likely liquidating 4 wintrust,0.1509999930858612,0.8130000233650208,0.035999998450279236
in the #news at 657 am silicon valley bank drops for a second day weighing on the bank sector again,0.24400000274181366,0.7200000286102295,0.035999998450279236
as someone who worked in banking policy and supervision i think silicon valley bank and silvergate were both anomalous and dont signify 08 style contagion ill take the fear driven price action on my short positions though #stocks #investing #capital #banking #doddfrank,0.3790000081062317,0.5860000252723694,0.03500000014901161
for europeans wondering if silicon valley banks dire situation really matters at the start of last year it was same market cap as barclays unicredit or credit agricole after last nights aftermarket trading svb now closing in on size of monte dei paschi,0.28200000524520874,0.6840000152587891,0.03400000184774399
silicon valley bank the lehman moment shortterm bearish longterm bullish it is estimated that 70 of people will quit the crypto or stock market while the remaining 30 will survive who have cash or have hedged their investments people are begging for fed pivotbailout,0.5329999923706055,0.4320000112056732,0.03400000184774399
silicon valley bank isnt a crypto bank its the tech bank,0.33799999952316284,0.628000020980835,0.03400000184774399
take your money out of silicon valley bank,0.5540000200271606,0.4129999876022339,0.032999999821186066
indian markets behaving as if everyone in india had an account in silicon valley bank #iykyk,0.39800000190734863,0.5709999799728394,0.03200000151991844
there is in fact a massively nonzero chance silicon valley bank goes under if you are close to privates world at all every call to vcs today is do i take s out or no and the answer is yes anytime a bank says things are fine they are not fine,0.7229999899864197,0.2460000067949295,0.03200000151991844
silicon valley bank svb saw a lot of money being deposited into their accounts in 2021 but they couldnt lend out this money quickly enough to make a profit so they used some of the money to buy a lot of longterm investments called mortgagebacked securities mbs these,0.4580000042915344,0.5099999904632568,0.03200000151991844
silicon valley bank please check that also,0.15600000321865082,0.8119999766349792,0.03200000151991844
no less than shtshow of an afternoon seeing panic and a bank run in real time with the silicon valley bank fiasco they have been a fervent partner to investors and founders rooting for them to make it sad day in tech,0.8199999928474426,0.14900000393390656,0.03099999949336052
peter thiel advises companies to pull money from silicon valley bank its the 15th largest bank in the us by deposits stock down 60 today another 26 after hours is this a classic bank run,0.515999972820282,0.45399999618530273,0.029999999329447746
silicon valley bank isnt going to fail but they might eat shit for a number of years this isnt a 2008 scenario where all their aaa holdings got to 50 the stuff on their sheet is going to get redeemed for par eventually,0.6869999766349792,0.28299999237060547,0.029999999329447746
yes imagine being concerned about the deepwater titan and ken griffin lease after silicon valley bank,0.38499999046325684,0.5860000252723694,0.029999999329447746
lehman redux rising interest rates trigger banking upheaval start up financier silicon valley bank stock crashes 60 collapse in its share value wiping out over 80 billion in value from bank shares #stockmarket,0.48899999260902405,0.4819999933242798,0.028999999165534973
the american bankers and money managers sell earn bonus and smoke weed that is the only conclusion one can draw from silicon valley bank issue,0.5139999985694885,0.4569999873638153,0.028999999165534973
quick primer time silvergate bank and now silicon valley bank are currently undergoing a good old fashioned bank run so what is a bank run and why is this happening ,0.21199999749660492,0.7599999904632568,0.02800000086426735
pay close attention to all the types who silicon valley bank rejected or as i prefer to call them americans,0.4699999988079071,0.5019999742507935,0.02800000086426735
todays video will be on silvergate bank but ill discuss some of the problems at silicon valley bank in it,0.2240000069141388,0.75,0.027000000700354576
the talking heads are saying silicon valley bank is not a contagion the big banks had to go through stress tests there is nothing to worry about silvergate was so small it was meaningless,0.6449999809265137,0.328000009059906,0.027000000700354576
silicon valley bank is facing a run now that the regulators and politicians cant blame it on crypto i wonder how quickly they will jump to save it sivb,0.5669999718666077,0.40700000524520874,0.026000000536441803
quotes from the silicon valley bank 10k antitakeover provisions and federal laws may prevent a merger or acquisition that may be attractive to stockholders andor have an adverse effect on our stock price decreases in the amount of equity capital available to our clients,0.2930000126361847,0.6809999942779541,0.026000000536441803
silicon valley bank admitted that clients cash burn has not moderated as expected given the bearish tech market,0.4259999990463257,0.5479999780654907,0.026000000536441803
whats this talk i am seeing about a bank run silicon valley bank,0.15600000321865082,0.8180000185966492,0.026000000536441803
the or a large financial institution needs to give silicon valley bank a backstop otherwise its ugly with ramifications far beyond svb the irony is svb would hardly need to draw on the backstop as the signaling would stop the run the vc community is,0.5730000138282776,0.4020000100135803,0.02500000037252903
while in an uber tonight my driver told me how he used to make 10m per year as an investor he took his salary and bonus and kept it all in silicon valley bank his firm credit suisse went under and then a week later he lost everything in svb his wife left too,0.6119999885559082,0.3630000054836273,0.02500000037252903
i wonder who will buy silicon valley bank after its bloodbath,0.6110000014305115,0.36500000953674316,0.024000000208616257
svbs stock collapsed 60 its lowest level since 2016 it fell from 267 to 106 in just 2 days silicon valley bank is crucial for tech startups 45 ,0.7829999923706055,0.1940000057220459,0.024000000208616257
i just realised a lot of nft twitter probably arent following outside news closely most recently silver gate and silicon valley bank by default you would get this on your timeline by following the right people important to keep track of this to understand whats happening,0.38600000739097595,0.5920000076293945,0.023000000044703484
some thoughts on what we are seeing with silvergate silicon valley bank and more or a trip down accounting lane have you had trouble sleeping lately in short banks stuck assets in htm so mark to market is stable but they basically just went short rates and got rekt,0.3089999854564667,0.6690000295639038,0.02199999988079071
there is a zero perfect chance silicon valley bank fails despite the current bank run there is no world where the us gov lets a top 20 bank fail to honor deposits,0.7639999985694885,0.21400000154972076,0.02199999988079071
ftse 100 slumps as investors fear impact on uk banks from silicon valley bank shock #sivb sivb #hsba hsba #stan stan #barc barc,0.46700000762939453,0.5120000243186951,0.02199999988079071
silicon valley bank failing would hit tech startups harder than anything the markets have done to the sector in the past year,0.765999972820282,0.21299999952316284,0.02199999988079071
read this somewhere do you blame them yesterday a trader bought sivb march 200 puts for 25 per contract they spent 7500 on the position silicon valley bank is down 60 today position is now worth 21 million,0.5989999771118164,0.3790000081062317,0.02199999988079071
gm all eyes on the jobs report this morning due at 830 am eastern such a messed up world we live in that people are hoping for a bad one especially the silicon valley bank investors in any case fewer added jobs and higher employment would bring only temporary relief,0.781000018119812,0.19900000095367432,0.020999999716877937
i just talked to a vc who pretty much sums up the problem i dont think silicon valley bank is going under but i also dont want to be the last one holding the bag so they are moving all of their money out of svb asap,0.6570000052452087,0.32199999690055847,0.020999999716877937
hey can you give me some context on silicon valley bank it looks like they are going under before the end of the weekend how intertwined into the vcstartup world how far reaching could the impacts be for the valleytech in general,0.4359999895095825,0.5429999828338623,0.020999999716877937
silicon valley banks shares are down 45 today most start ups have their funds there how are start up founders feeling about this fall,0.6000000238418579,0.3790000081062317,0.020999999716877937
i wish stories about silicon valley bank said more about fdic insurance a lot of them give the impression that depositors would be wiped out if the bank failed but they are protected by the federal government up to at least 250k,0.6520000100135803,0.32899999618530273,0.019999999552965164
an explainer on what is going on with silicon valley bank in 2021 svb saw a mass influx in deposits which jumped from 6176bn at the end of 2019 to 18920bn at the end of 2021 as deposits grew svb could not grow their loan book fast enough to generate the yield they,0.39899998903274536,0.5809999704360962,0.019999999552965164
does my stupid ass read the entire silicon valley bank 10k tn,0.703000009059906,0.2770000100135803,0.019999999552965164
#tradfi banks are getting in trouble what a surprise and i love to see this silicon valley bank sivb sold off a 21 billion bond portfolio for a huge loss to shore up liquidity credit suisse is delaying its annual report after #sec call and shares are plummeting,0.8610000014305115,0.11900000274181366,0.019999999552965164
heres the most alarming part of the silicon valley bank debacle that many arent talking about at the end of the wsj article the author mentions that svb has 913 billion of securities on the balance sheet classified as held to maturity held to maturity means that,0.5809999704360962,0.4000000059604645,0.019999999552965164
i know its a minor one but what about silicon valley bank sivb previous close wednesday was 26783 closed today at 10604 and is down to 8290 in afterhours,0.25699999928474426,0.7229999899864197,0.019999999552965164
silicon valley bank but every social media and government told me that these only happens to crypto why did you all mislead me ,0.6650000214576721,0.3149999976158142,0.019999999552965164
i never thought ftx was a ponzi silvergate bank would go under silicon valley bank would be experiencing major issues navigating the world of web3 and tech in 202223 is wild,0.7269999980926514,0.2529999911785126,0.019999999552965164
the global tech ecosystem is too centralized one mishap and many startups are scrambling for their life the latest mishap silicon valley bank,0.7860000133514404,0.1940000057220459,0.019999999552965164
4 silicon valley bank experienced a crash which could potentially have ripple effects throughout the #crypto industry,0.4729999899864197,0.5070000290870667,0.01899999938905239
startup lender silicon valley bank sparked wave of panic in tech circles that dragged all banking shares around the world santaclara svb ordeal anounced share sale of 21billion of se unifies from its holding portfolios plunged 60 value of svb,0.6460000276565552,0.33399999141693115,0.01899999938905239
why did silicon valley bank explode,0.7760000228881836,0.20499999821186066,0.01899999938905239
one month ago jim cramer urged investors to buy silicon valley bank stock sivb saying it was still cheap and has room to run the stocks value has since dropped by 66 following concerns that the bank is on the brink of collapsing who is even listening to this clown,0.7609999775886536,0.22100000083446503,0.017999999225139618
silicon valley bank issue is thoda complex shaam ko video se samjhate hain ,0.4180000126361847,0.5640000104904175,0.017999999225139618
for those who do not remember the last deep recession in 2008 it began with a large regional bank going under without warning that is happening today silicon valley bank larger than banks you may know like trustmark bbt regions hancockwhitney is about to go under,0.75,0.23199999332427979,0.017999999225139618
chaos theory teaches us that small events can have significant unpredictable consequences silicon valley bank svb suffered a massive drop in its share prices of 60 on a single day causing concerns of a possible lehman brothers moment in the startup world,0.6259999871253967,0.35600000619888306,0.017999999225139618
1silicon valley bank #svb s collapse stems from a spike in deposits from 60b in fy19 to 190b in fy21 in order to find sufficient yield for this new deposit the bank purchased 80 billion of mortgage backed securities mbs majority of these mbs have 10 year maturities,0.6069999933242798,0.37599998712539673,0.017999999225139618
 silicon valley bank in trouble usag comes after kucoin and wants to declare eth a security huobi token crash sun god games biden wants to tax bitcoin mining bearish as hell morning but we continue building for higher highs,0.8069999814033508,0.17599999904632568,0.017999999225139618
when a bank goes down it takes a lot of good folks with it a lot of vcs and startup founders use silicon valley bank svb things are starting to break,0.8100000023841858,0.1720000058412552,0.017999999225139618
silicon valley bank looks like may be going down the drain they used to be the primary banking partner for stripe atlas last i checked stripe atlas is the way to create an american company anywhere in the world and receive payments via stripe what is the blast radius ,0.5789999961853027,0.40400001406669617,0.017000000923871994
the truth is that silicon valley bank wasnt much interested in tech anyway they were interested in laundering money though,0.5809999704360962,0.4020000100135803,0.017000000923871994
im at the point where im not sure vcs and founders are telling me theres nothing to be concerned about vis a vis silicon valley bank because they dont want to create more panic or if they actually believe that,0.6129999756813049,0.3700000047683716,0.017000000923871994
credit suisse silvergate and now silicon valley bank are all experiencing runs on the bank smaller banks are at risk of contagion and collapse be wary be aware,0.6340000033378601,0.3490000069141388,0.017000000923871994
so whats happening with silicon valley bank why are startup folks panicking svb incident may mark the fortune of the us economy in the coming years and you should know whats happening here is the thread ,0.4390000104904175,0.5440000295639038,0.017000000923871994
silicon valley bank is a member of the fdic and the federal reserve system the business is in fact in jeopardy but depositors are not however its a little glimpse into the future where the stopgap mechanisms dont work anymore contagion can break through everything,0.6039999723434448,0.3779999911785126,0.017000000923871994
the global rout in bank stocks was prompted by silicon valley bank a major banking partner for the us tech sector being forced to raise fresh capital after losing 18 billion selling a package of bonds to meet depositor demands for cash,0.5659999847412109,0.41600000858306885,0.017000000923871994
ackman calls for bailout of silicon valley bank svb you cant taper a ponzi eh if banks had to hold equity capital against the true risk of ust #bond stock prices would tend to zero due to enormous supply fiat is the ponzi banks are the mechanism,0.675000011920929,0.3089999854564667,0.01600000075995922
yesterday silvergate got destroyed today it is silicon valley bank hold on tight folks,0.8420000076293945,0.1420000046491623,0.01600000075995922
any comment on silicon valley bank sivb or nah because not related to crypto appears to be similar issues for #siliconvalleybank as #silvergate faced but with tech instead of crypto according to #silvergatebanks disclosures they held no bitcoin or crypto only dollars bonds,0.44200000166893005,0.5419999957084656,0.01600000075995922
last 24 hours • #stocks #crypto shed 2t • new york attorney labels eth security • kucoin hit with lawsuit • silicon valley bank crash • huobi flash crash • biden proposes tax on btc mining • voyager liquidating assets not like weve never seen all this before ,0.4519999921321869,0.5320000052452087,0.01600000075995922
at fbs we have a class where we teach bonds and stocks debt equity why is it important to know types of bonds and stocks or understand capital stack let go on a small journey their is bank mostly used by startups its called silicon valley bank svb the shares tanked,0.7009999752044678,0.28299999237060547,0.01600000075995922
svb silicon valley bank fell sharply yesterday on news of crunched liquidity when interest rates rise this quickly something is bound to happen is this the lehman brothers type moment if yes tighten your seatbelts the downfall is just getting crazier #svb,0.7910000085830688,0.19300000369548798,0.01600000075995922
crypto and silicon valley bank failure are related people tied up in one likely were tied in the other svb is the clearest story a lot of startups likely pulled their money to cover potential costs from banking risks,0.6520000100135803,0.3319999873638153,0.01600000075995922
silicon valley bank just lost 10 billion in market share yesterday its happening,0.7850000262260437,0.1979999989271164,0.01600000075995922
silicon valley bank is constipated ,0.652999997138977,0.3310000002384186,0.01600000075995922
actual question silvergate closed a few days ago and silicon valley bank is teetering if svb blows up will companies like coinbase be caught too idk where else banks are accepting blockchain dollars,0.6340000033378601,0.3499999940395355,0.01600000075995922
i got interviewed by silicon valley bank in 2020 while i was livingworking in san francisco but didnt make it past the third round sivb yall hiring or is this a bad time,0.5730000138282776,0.41100001335144043,0.01600000075995922
if silicon valley bank fails it would be the second largest bank failure in us history and the largest bank failure since 2008 probably nothing,0.8870000243186951,0.09700000286102295,0.014999999664723873
the following chaos happened in #crypto industry in past 24 hours is insane • biden proposes tax on btc mining • new york attorney labels eth a security • kucoin hit with lawsuit • silicon valley bank crash • huobi crash lets see what happens next,0.7870000004768372,0.1979999989271164,0.014999999664723873
silicon valley bank is down 60 pct what to do what to do sell indian banks kyun bhai globalisation does not mean this level of deep connection,0.6790000200271606,0.3059999942779541,0.014999999664723873
european markets falls 2 bank stocks tanks 4 on silicon valley bank plummet #europeanmarket #siliconvalleybank #silicone #trading #investing ,0.7409999966621399,0.24400000274181366,0.014999999664723873
investors dump us bank shares amid fears over value of bond portfolios difficulties at silicon valley bank spark biggest oneday selloff since early months of pandemicfinancial times,0.6349999904632568,0.3490000069141388,0.014999999664723873
