,neg,neu,pos
easy to install dropped windows 10 pro on it from usb boot drive system up and running in no time in uefi mode,0.006000000052154064,0.15800000727176666,0.8360000252723694
great devices saved a bundle over more expensive models 2 years later price is still hard to beat,0.03700000047683716,0.12999999523162842,0.8330000042915344
super fast and good value but it wouldve been nice if it came with standoffs and screws,0.019999999552965164,0.14800000190734863,0.8320000171661377
"quick n easy install into m2 slot on motherboard
no power cables requured
nice n fast and decent capacity",0.012000000104308128,0.1589999943971634,0.8289999961853027
still working perfectly 4 months on i use it for gaming,0.00800000037997961,0.164000004529953,0.828000009059906
easy to use and setup,0.01600000075995922,0.15800000727176666,0.8259999752044678
unfortunately this product never arrived however i did by the same product elsewhere fantastic product with great speed easy to install and a great upgrade or additional device,0.061000000685453415,0.11599999666213989,0.8230000138282776
it is faster than my ssd and finally allowed me to turn off my old hdd storage drive,0.008999999612569809,0.1679999977350235,0.8230000138282776
other than the incredible small screw needed to install thai on my motherboard it was simple to use and set up just remember need to format the drive after installing,0.014000000432133675,0.17900000512599945,0.8069999814033508
did an itx build so space in the case is premium using the wd blue 550 1tb mainly just for storage at the moment downloads and random stuff copying to and from drive has been great would use this drive for gaming but i have others doing that at the moment,0.00800000037997961,0.1860000044107437,0.8059999942779541
i needed a new ssd to replace my old 250gb ssd this has been a huge upgrade as games that took 2 minutes 20 seconds to load now load within 50 seconds,0.02500000037252903,0.16899999976158142,0.8059999942779541
good value for money,0.024000000208616257,0.18199999630451202,0.7940000295639038
does as it should with no issues would recommend,0.01600000075995922,0.1979999989271164,0.7860000133514404
easy to install fast readwrite reasonable price,0.017000000923871994,0.2029999941587448,0.7799999713897705
i am always a little hesitant to buy cheaper ssds and will usually stick to the more expensive samsung drives but when i saw the price difference yet still with good performance and 5 years warranty backed by a large company like wd i jumped on it so far it has not disappointed,0.03700000047683716,0.19099999964237213,0.7720000147819519
did what i wanted it to do just fine,0.014000000432133675,0.21799999475479126,0.7680000066757202
my one works great as i got the old make was regretting not keeping 2tb one but who knows couldve suffered that 50 performance hit,0.041999999433755875,0.19300000369548798,0.7649999856948853
just popped one of these in my trash can mac pro and seems to work a treat youll need an adapter to make these work with macs,0.008999999612569809,0.2280000001192093,0.7630000114440918
" met speed expectations even on my b350 mb no unneccesary packaging well priced
simple installation simply create a partition and youre ready to go tlc drive",0.012000000104308128,0.23199999332427979,0.7559999823570251
"it does what it should
was the cheapest 1tb at the time and performs well",0.01899999938905239,0.22599999606609344,0.7549999952316284
boots up fast running fine in my 1st pc build,0.004999999888241291,0.25699999928474426,0.7379999756813049
easy to install on any motherboard that can utilise it just look at any youtube video for how to install it just be prepared for some formatting ,0.007000000216066837,0.2590000033378601,0.734000027179718
i installed this on an asus b550m board which has 2 mounting sockets m21 and m22 it seemed to work fine in m22 but then i found the computer crashing when it left sleep mode i have now installed it in m21 and it works really well,0.014999999664723873,0.25999999046325684,0.7250000238418579
use as external drive for m1 mac mini good fast drive in usbc enclosure use as both a backup boot drive and storage,0.006000000052154064,0.27000001072883606,0.7239999771118164
working ok but only been a few months,0.024000000208616257,0.2750000059604645,0.7009999752044678
very fast transfer rates,0.014999999664723873,0.2879999876022339,0.6959999799728394
well what can i say 1tb of fast storage for steam games ill never play i would do some deep analysis of speed and stuff but it goes quick so awesome,0.12800000607967377,0.17800000309944153,0.6940000057220459
great,0.06400000303983688,0.2460000067949295,0.6909999847412109
upgraded my existing 240gb nvme ssd for a 1tb nvme ssd as the drive was 90 full now have increase free space to allow computer to operate at its best,0.008999999612569809,0.3009999990463257,0.6899999976158142
thanks,0.041999999433755875,0.27799999713897705,0.6800000071525574
got this too replace my standard ssd drivewhat a speed improvement and im on an and b 350 motherboard paired with a 1st generation ryzen 5so a newer board would be even quickereasy too install too just make sure your not using your sata 56 channels as this needs themoverall very happy windows boots and it ready in about 7 seconds,0.028999999165534973,0.29600000381469727,0.6740000247955322
easy to install on the mobo no problems with detection or format and now my pc boots in seconds just got to work out what to put on the rest of it just make sure it is the only drive connected when you install an os on it for best results,0.019999999552965164,0.30799999833106995,0.6729999780654907
no problemworks as well as expected in my usb hub,0.020999999716877937,0.30799999833106995,0.6710000038146973
would have been great if it were cheaper but it definitely does not disappoint point,0.06400000303983688,0.27799999713897705,0.6579999923706055
easy installation in spare slot on an acer nitro 5 gaming laptop performance is as stated in specifications,0.007000000216066837,0.33500000834465027,0.6579999923706055
"fantastic value great speeds very happy will be buying another soon

update many people saying its not 1tb wrong but it is please look up what a partition table actually is please if you dont understand this basic principle you should probably let a computer tech upgrade your pc ",0.11100000143051147,0.2329999953508377,0.656000018119812
pefect,0.061000000685453415,0.2849999964237213,0.6539999842643738
no issues so far had the storage advertised and works faultlessly,0.03500000014901161,0.31299999356269836,0.6520000100135803
good price,0.04699999839067459,0.3009999990463257,0.6520000100135803
good,0.07100000232458115,0.27799999713897705,0.6510000228881836
fast enough only slightly slower than my main ssd samsung 970 evo plus and relatively inexpensive works reliably does not heat up,0.02500000037252903,0.3240000009536743,0.6499999761581421
delivered as promised,0.014000000432133675,0.33799999952316284,0.6480000019073486
obviously you will have to buy an enclosure but it is better than paying the £22000 they want for the proprietary one series x works perfectly with this one and it is western digital,0.032999999821186066,0.32100000977516174,0.6460000276565552
"really good nvme m2 card excellent performancecost ratio
only little downside is that it didnt come with a screw to secure it once you pop it in but perhaps that should have been on the motherboard and i lost it",0.1469999998807907,0.21699999272823334,0.6359999775886536
works fine in the razer blade 15 2021 spare slot,0.008999999612569809,0.36000001430511475,0.6309999823570251
"great memory easy to instal

be aware that screws arent included though",0.04399999976158142,0.33500000834465027,0.621999979019165
im not an expert on ssds but i got the 1tb version as an upgrade and it seems quick no issues so far,0.01899999938905239,0.36000001430511475,0.621999979019165
great see for the money value slightly slower than my 970evo from samsung but you wouldnt notice the difference in games loading times,0.0949999988079071,0.28600001335144043,0.6190000176429749
needed something a bit more capacious than the 256gb that a stock lenovo x280 offers the 1tb stick is great and performs well biz use only this is no gaming machine good value,0.09200000017881393,0.28999999165534973,0.6169999837875366
"dont usually write reviews but didnt see much in here about compatability with my macbook pro i installed this in a macbook pro late 2013 and it works beautifully
runs very smooth and now i have a much needed upgrade on my storage
note if using for this particular mac you will need an adapter",0.05000000074505806,0.3440000116825104,0.6060000061988831
its a solid ssd not the fastest but also not the slowest despite being the cheapest 1 tb nvme ssd i could find it doesnt have dram on it but it still performs aokay at least with linux,0.08799999952316284,0.30799999833106995,0.6039999723434448
slotted in with super ease works like a dram too,0.019999999552965164,0.3790000081062317,0.6010000109672546
really superb value for the price you wont notice that the performance stats are slightly lower than branded counterparts makes no difference in day to day tasks and even gaming,0.11100000143051147,0.28999999165534973,0.5989999771118164
i know all storage falls short of the advertised capacity but 70gb is a lot read and write speeds are excellent the advertised speeds are actually accurate installation was easy it did need initialising in disk management first which is to be expected,0.11299999803304672,0.2930000126361847,0.593999981880188
good price easy to install would have been nice to have the installation screws provided they cant be that expensive,0.0689999982714653,0.35600000619888306,0.5740000009536743
"recently bought laptop on ebay which had only 256gb of storage

had a quick look on youtube and was able to install this 1tb drive in under 5 mins reinstalled windows 11 and then dual booted it with ubuntu

i know there are faster m2 drives out there but for £65 this cant be beaten as a nongamer was perfect for my needs",0.024000000208616257,0.40299999713897705,0.5730000138282776
bought a gaming laptop with a slot for nvme ssd so i thought why not so installed it installation was seamless but a bit of a bugger to remove the laptop back without breaking anything especially as it was new but in the end managed it unscathed would recommend as it has worked perfectly,0.06700000166893005,0.367000013589859,0.5649999976158142
i used this product as a second m2 drive for games using gen 2 with an m2 pcie expansion card the read write speeds are fast enough using gen 2 but if you want to use it as a boot drive youll be able to take advantage of gen3 with higher speeds,0.008999999612569809,0.4449999928474426,0.5460000038146973
this drive is a good quality drive and is a lot faster than my previous sata drive installation was a bit tricky however this is a problem with my computer case and motherboard not the drive i managed to image my entire 800gb macos system over to this ssd in under an hour i used the software carbon copy cloner,0.1469999998807907,0.3109999895095825,0.5419999957084656
best value,0.05000000074505806,0.40700000524520874,0.5419999957084656
i benchmarked this drive connected in a caddy via usb30 and had read speeds of 439mbs and write speeds of 443mbs connected it to usb 31 the tealgreen usb connector on my motherboard and had read speed of 100046mbs and write speed of 95478mbs soooo more than fast enough using it as an external hard drive,0.014999999664723873,0.4440000057220459,0.5410000085830688
easy installation but only 930 gb,0.06400000303983688,0.40400001406669617,0.5329999923706055
bought this to increase storage for an already quick laptop what a transformation approx 1800 mbs write and 2400 mbs read,0.03999999910593033,0.4300000071525574,0.5299999713897705
does the job had a little issue contacted box the seller and they rectified the issue within a few days excellent customer services,0.08900000154972076,0.382999986410141,0.527999997138977
windows 10 boot up in 15 seconds after install,0.03400000184774399,0.46399998664855957,0.5019999742507935
i had to upgrade disk capacity so bought a pcie ssd card my dell t7810 motherboard only supported sata so this disk plus a small pcie ssd adapter with heat sink and everything boots and runs double the capacity and double the performance,0.01899999938905239,0.48500001430511475,0.4959999918937683
"easy to install for gaming with value for money
gaming east money for value to install gaming to value for money",0.02199999988079071,0.5080000162124634,0.4699999988079071
£68 for 1tb m2 nvme ssd whats not to like,0.014999999664723873,0.5180000066757202,0.46700000762939453
installed into asus rog strix enclosure with ease seems to be fast speed but only using as external hd on mac,0.012000000104308128,0.5220000147819519,0.4659999907016754
definitely improved windows 10 bootup time and generally noticed a snappy feel to most programs copying small files was a breeze but there is a noticeable lag and drop in speed when copying large files to or from the wd blue to other attached ssd in the system,0.1080000028014183,0.4269999861717224,0.4650000035762787
cheap ssd that actually works the speed is not the best but 2400 mbs is more than enough for me and for this price i have nothing to complain about,0.12300000339746475,0.41999998688697815,0.4569999873638153
reliable drive and brand,0.039000000804662704,0.5220000147819519,0.4390000104904175
was going to put up my m2 sata ssd drive also from wd but didnt want to confuse people thinking they were the benchmark scores for this drive in my machine though a now aging dell inspiron 7373 it was an excellent upgrade about a 4x performance uplift in io which is actually quite noticeable when using things like developer tools,0.05000000074505806,0.5230000019073486,0.42800000309944153
i purchased this around a year ago when it was cheaper and it is great nice and responsive drive only downside now is theyve upped the price i assume they stopped producing them and thats why,0.27300000190734863,0.30300000309944153,0.42399999499320984
"does what it says on the the label
i know there are faster ones but this is fine",0.03700000047683716,0.5509999990463257,0.41100001335144043
use this as my boot disk was using a sandisk x210 which was fine and a massive step up from the hdd i used to boot from but the boot speed has gone from about 20 seconds to about 5,0.05900000035762787,0.6000000238418579,0.3409999907016754
"far superior than my other ssd only issue i had was that i had to update my bios but thats not a fault of this product mentioned it as someone may have the same issue post screen not progressing

great product",0.3400000035762787,0.33399999141693115,0.32600000500679016
value,0.12099999934434891,0.5550000071525574,0.3240000009536743
cheap,0.18000000715255737,0.5070000290870667,0.31299999356269836
"slapped it in cloned my old 850 evo changed boot priority done

only use is for gaming so dont need an insane fast ssd just decided to go with m2 as ive never had one and they take up less space in the case

price at time of purchase was £110 for 1tb which is good value at this point in time",0.07800000160932541,0.6119999885559082,0.3100000023841858
not much to say but it works,0.14100000262260437,0.5569999814033508,0.3009999990463257
im using the goood,0.07000000029802322,0.640999972820282,0.289000004529953
be sure to check your computer ssd socket to be sure it is compatible before you buy,0.012000000104308128,0.7089999914169312,0.27900001406669617
used the ssd to replace by apple ssd in macbook pro 13 early 2015 along with an £8 adapter 256 gb to 1tb and double readwrite speed in an hour for £80 investment,0.024000000208616257,0.703000009059906,0.27300000190734863
does the job as expected faster boot up than ssd,0.07599999755620956,0.6589999794960022,0.26499998569488525
fast ,0.03999999910593033,0.7009999752044678,0.2590000033378601
sure theres ssds with twice the readwrite speeds available on the market nowadays but do you really need such speed im happy with the lower price on these,0.20399999618530273,0.5690000057220459,0.22699999809265137
"needed extra storage bought this i now have extra storage cant complain

not using the drive for throwing around huge amounts of data on a regular basis so cant comment if its been affected by any of wds component swapping shenanigans",0.21400000154972076,0.5839999914169312,0.20200000703334808
only problem i had was it wasnt showing up on my pc i eventually figured out i had to update my bios then everything worked great,0.24899999797344208,0.5550000071525574,0.19599999487400055
not bad for the price there are better performing ssds,0.28700000047683716,0.5370000004768372,0.17599999904632568
easy to install as you would expect as for games dont know dont play them,0.22599999606609344,0.6010000109672546,0.17399999499320984
no problems,0.22499999403953552,0.609000027179718,0.16599999368190765
play video,0.03700000047683716,0.796999990940094,0.16599999368190765
performance is as advertised,0.1120000034570694,0.7300000190734863,0.15800000727176666
always first into a game,0.10199999809265137,0.7450000047683716,0.15299999713897705
i in stalll product and it really sowekd,0.2879999876022339,0.5600000023841858,0.15199999511241913
works as expected,0.12999999523162842,0.7289999723434448,0.14100000262260437
i expected lower rated speeds from a wd blue product great value over samsung evo or wd black with very similar real world performance,0.2980000078678131,0.5640000104904175,0.13699999451637268
perfrct,0.0949999988079071,0.7730000019073486,0.13300000131130219
hadnt really had any problems with it,0.25699999928474426,0.6179999709129333,0.125
"easy to install but doesnt come with the screw to lock it to the motherboard
speed example took almost 3min to copy a folder with 31gb in ubuntu",0.3970000147819519,0.503000020980835,0.10000000149011612
the blue maybe on half as fast as the black 850 on paper but in the real world loading up your application or game youd be hard pressed to tell the difference also when theyre under £85 for 1tb its hard to overlook with that wd warranty and backing,0.22200000286102295,0.6779999732971191,0.10000000149011612
grey price,0.24799999594688416,0.6520000100135803,0.0989999994635582
as described,0.1509999930858612,0.7580000162124634,0.09099999815225601
havent had a problem yet,0.11599999666213989,0.7960000038146973,0.08799999952316284
"cons my most important spec is 4k readwrite speeds they are 40 and 100mbs it is below the same ssd average similarly other benchmarks are below average too one of the slowest among the same ssd 9th percentile

pros good price for storage",0.609000027179718,0.32100000977516174,0.07000000029802322
i spent around 10 hrs overall trying to install make it detect this hard drive in hp 14dv0603na laptop but no success so be aware it might not work with other hp models this is hp laptop from 2020 so very recent the drive worked fine in dell e7470 but it was purchased for the hp therefore had to return return process was seamless,0.4339999854564667,0.5009999871253967,0.06499999761581421
i dont think its the quickest but for a 1tb at this price point there really arent any cons,0.46700000762939453,0.4830000102519989,0.05000000074505806
does what it says,0.11699999868869781,0.8349999785423279,0.04899999871850014
havnt checked speeds in crystal disk yet but feels lightning,0.22200000286102295,0.7329999804496765,0.04500000178813934
why bother with hdd,0.503000020980835,0.45500001311302185,0.041999999433755875
"bought oct 2020 died mar 2021 replace instantly by amazon but died again oct 2021 being replaced under wd warranty but not sure i will use it again possibly a batch fault
this would an excellent buy really really fast and trouble free until it dies but it needs to last at least 5 years before dying surely",0.7670000195503235,0.20000000298023224,0.032999999821186066
fast fast fast way too fast actually about 4 times more so than my os ssd this is dedicated to games on my system so i never get to read those loading screen tips,0.8450000286102295,0.13300000131130219,0.023000000044703484
i slotted it on and screwed it down buy there was no pop up saying extra storage i tried doing it again and nothing,0.7080000042915344,0.27300000190734863,0.01899999938905239
"piece of garbage does not work faulty freezes computer had to put my smaller ssd back in

avoid this brand

update motherboard firmware update resolved issue",0.8799999952316284,0.1080000028014183,0.012000000104308128
i bought this last july ive had it 9 months and its dead already i keep getting a error when i start up my pc its a good product but dies quickly and now i have to re buy a new one because this one broke,0.9309999942779541,0.05999999865889549,0.00800000037997961
