,neg,neu,pos
very happy with the disk performs excellently,0.003000000026077032,0.008999999612569809,0.9879999756813049
great product very happy with it good price put it on my first pc build in 15 years very easy to install,0.004000000189989805,0.00800000037997961,0.9879999756813049
it arrived on time it was well packaged and it works blindly fast very happy with this product definitely will buy this again,0.003000000026077032,0.009999999776482582,0.9869999885559082
been using wd products long time and very happy with it easy to install works fast will definitely buy another one in near future,0.0020000000949949026,0.013000000268220901,0.9850000143051147
got this for a game drive for my laptop is super fast easy to install and arrived sameday couldnt be happier,0.0020000000949949026,0.014000000432133675,0.984000027179718
brilliant value and great on macbook pro,0.003000000026077032,0.013000000268220901,0.984000027179718
great m2 ssd easy to install and once setup runs super fast,0.004000000189989805,0.013000000268220901,0.984000027179718
excellent i noticed that this ssd is faster than the smaller stock drive that came with my laptop quick delivery would recommend,0.003000000026077032,0.013000000268220901,0.984000027179718
perfect for my gaming pc build great price and blazing fast big recommendation,0.003000000026077032,0.013000000268220901,0.9829999804496765
excellent drive runs really fast,0.004000000189989805,0.014000000432133675,0.9829999804496765
this came quickly and was easy to install it provides great readwrite speed similar to whats advertised i would say and so im glad i got this high performance version of the wd blue drive,0.003000000026077032,0.014999999664723873,0.9819999933242798
great product easy to install and performance is great,0.006000000052154064,0.012000000104308128,0.9819999933242798
6 months in it is amazing does the job no problems whatsoever definitely recommended,0.006000000052154064,0.013000000268220901,0.9810000061988831
really impressed with this added another level of oomph to my machine faster than the standard msata ssd it shares the machine with,0.003000000026077032,0.014999999664723873,0.9810000061988831
this has been a real upgrade for my laptop which came with a 256gb ssd easy to fit and so far flawless in use and the speed of opening programs and copying files is excellent,0.004000000189989805,0.014999999664723873,0.9810000061988831
son needed this and hes very happy with it great service,0.004999999888241291,0.014000000432133675,0.9810000061988831
wow fast i love it never going back,0.00800000037997961,0.012000000104308128,0.9800000190734863
high performance ssd would recommend works great,0.004000000189989805,0.014999999664723873,0.9800000190734863
this is very quick and it boots my os up in about 3 seconds flat so i feel happy,0.004999999888241291,0.01600000075995922,0.9789999723434448
works great im sure there are higher specs available but happy with this drive,0.004000000189989805,0.017999999225139618,0.9779999852180481
a really solid nvme drive at a brilliant price bought this because i previously had a 256gb nvme for windows and it soon filled up with other software too this is perfect for what i need and so far is working perfectly the price is also amazing for 1tb of storage so this is really impressive definitely recommend,0.004999999888241291,0.017000000923871994,0.9779999852180481
smart fast and good looking easy install best kit ive bought in a while,0.004000000189989805,0.017999999225139618,0.9779999852180481
if you are buying this for your macbook air remember to buy adapter to connect i knew this and im extremely happy with my item that was not over priced like many its fast and smooth im extremely happy with this item,0.003000000026077032,0.019999999552965164,0.9769999980926514
surprisingly fast massive performance upgrade cant actually believe it,0.004999999888241291,0.017999999225139618,0.9769999980926514
nice work in my macbook air,0.003000000026077032,0.019999999552965164,0.9769999980926514
thank you very much excellent work,0.00800000037997961,0.014999999664723873,0.9769999980926514
excellent nvme i use it as a boot device and to store my favourite games on works perfectly well worthe the money,0.003000000026077032,0.01899999938905239,0.9769999980926514
this is perfect and soo far so good did not get any problem with it,0.007000000216066837,0.01600000075995922,0.9769999980926514
love itreasonable price for the product,0.006000000052154064,0.01899999938905239,0.9760000109672546
arrived promptly well packaged very easy to install equally easy to setup i would highly recommend,0.004000000189989805,0.020999999716877937,0.9760000109672546
great deal at £83 cant complain as it solves storage problem can certify its compatible with macbook air 72,0.003000000026077032,0.02199999988079071,0.9750000238418579
replaced my slower crucial drive with this installed linux mint 20 now i have a super fast laptop with the best free operating system in my opinion all linux oses are great you cant go wrong,0.004999999888241291,0.019999999552965164,0.9750000238418579
great value for money m2 drive good speed of 2400mb on my machine great build quality,0.004000000189989805,0.020999999716877937,0.9750000238418579
the read and write speeds are great,0.004000000189989805,0.020999999716877937,0.9750000238418579
fantastic value and realy speedy would recommend 100,0.009999999776482582,0.01600000075995922,0.9739999771118164
its good so far,0.003000000026077032,0.023000000044703484,0.9739999771118164
great product well worth the money,0.007000000216066837,0.01899999938905239,0.9739999771118164
very easy to install and it does its job really well,0.006000000052154064,0.020999999716877937,0.9729999899864197
great little m2 fast af,0.007000000216066837,0.020999999716877937,0.9729999899864197
an unbelievable improvement over my old hdd breathed new life into my 6 year old gaming pc,0.003000000026077032,0.024000000208616257,0.9729999899864197
very good value for money cant go wrong with it,0.007000000216066837,0.020999999716877937,0.972000002861023
two months in and its working great pc is nice and quick no errors so far and good value for money,0.004999999888241291,0.023000000044703484,0.972000002861023
this is my second wd blue nvme they are pretty good great balance between price and performance my goto drive now,0.003000000026077032,0.026000000536441803,0.9710000157356262
read write speed essentially as advertised all around very happy ,0.004000000189989805,0.026000000536441803,0.9700000286102295
recently installed this on a new pc build easy to install high capacity and high performance also great value for money compared to other nvme ssds,0.003000000026077032,0.027000000700354576,0.968999981880188
this installed in seconds worked immediately i did a clean install of windows dumped all my documents etc on a second standard drive from backup the whole thing is whizzing along i am seriously impressed,0.006000000052154064,0.024000000208616257,0.968999981880188
amazing price since it gives you 1tb for less that 100 pounds also the reading and writing speeds on this ssd are above average,0.006000000052154064,0.026000000536441803,0.968999981880188
boughtva caddy for this boy works great,0.004999999888241291,0.02800000086426735,0.9670000076293945
put simply this gave me a significant boost in drive space for my optiplex 7060 its fast cheap for these days and extremely easy to install,0.004000000189989805,0.029999999329447746,0.9670000076293945
"this thing has breathed new life into my pc reinstalled my os on this and with quickboot my pc now boots faster than my monitor can turn on from power button to desktop in less than 10s

its easy to install i think it took me about 2 minutes to install just because of the m2 heat sink on the motherboard",0.004000000189989805,0.028999999165534973,0.9670000076293945
this m2 drive has a great capacity and was a breeze to install the rated 1tb capacity is on par with other drives in its class the speed is again on par with drives in the same class,0.004000000189989805,0.028999999165534973,0.9670000076293945
this item is a excellent buy excellent quality easy to install no negative remarks excellent brand,0.00800000037997961,0.026000000536441803,0.9660000205039978
great ssd for my first pc build benchmark tests confirm its stated readwrite speed windows loads in under 10 seconds i think my record has been just under 4 seconds once,0.003000000026077032,0.03099999949336052,0.9660000205039978
great ssd a lot cheaper than most out there with fast speeds and very easy installation,0.006000000052154064,0.028999999165534973,0.9649999737739563
so glad i bought this w0 loads so fast as do the programs and games,0.006000000052154064,0.029999999329447746,0.9639999866485596
very fast ssd definitely worth the money,0.003000000026077032,0.03400000184774399,0.9629999995231628
great value for money easy to install fast to operate will buy another for my second slot when ready to upgrade again,0.004000000189989805,0.03500000014901161,0.9610000252723694
"easy to install make sure you follow the instructions to format and install macos
stuck this in an a1465 macbook air and runs big sur soooo fast
very happy",0.004000000189989805,0.03500000014901161,0.9610000252723694
great item plug and play,0.006000000052154064,0.032999999821186066,0.9599999785423279
works perfectly installed in my gaming pc and it works a treat,0.003000000026077032,0.03700000047683716,0.9599999785423279
its very fast in my system i didnt use it for too long but so far everything is great,0.006000000052154064,0.03400000184774399,0.9599999785423279
great price for a 1 tb nvme m 2 ssd drive from a very reputable brand who have been in the hard drive business for decades great,0.004000000189989805,0.03700000047683716,0.9589999914169312
i installed this as my main drive in a new audio production occasional gaming pc build and im pleased to say it is performing perfectly my pc is super quick and very quiet some reviewers have reported a high pitched whine sound from this drive but im having no such problems so im happy,0.007000000216066837,0.03500000014901161,0.9580000042915344
"one of the best value nvme drives on the market until recently when the wd blue sn570 was released

for gaming especially as a secondary drive this is the best value for money you can buy",0.007000000216066837,0.035999998450279236,0.9570000171661377
wd top brand easy to install and very fast speeds,0.004999999888241291,0.03700000047683716,0.9570000171661377
got it installed within 2 mins windows installed bang on for the bucks,0.004000000189989805,0.03999999910593033,0.9559999704360962
"super fast drive with huge capicity i love it
note for linux users once physically installed and partitionedsetup you may need to change permissions to actually get it working rwx",0.004999999888241291,0.03999999910593033,0.9549999833106995
good value for money bought it on sale it works it is reliable and easy to install being m2 also it is fast enough to play games on very well no loading issues,0.004999999888241291,0.03999999910593033,0.9549999833106995
excellent product,0.007000000216066837,0.03700000047683716,0.9549999833106995
games run incredibly fast loading screens are less of a hassle compared to my other drives great buy would recommend,0.007000000216066837,0.03999999910593033,0.953000009059906
"i put this ssd in my legion 5i works perfectly and is very fast
would recommend this at this price point",0.004999999888241291,0.0430000014603138,0.9520000219345093
bought to upgrade the wd sn520 256mb drive in my hp laptop not only do i now have 4x the capacity the tests i have run show it to be between 2 and 3 times faster at reading and writing data than the original drive highly recommended,0.004000000189989805,0.04500000178813934,0.9520000219345093
"upgraded stock installed 512gb m2 ssd with this item it worked fine and increased speed about 1520
nice product and value for maney",0.004999999888241291,0.04500000178813934,0.9509999752044678
"very good ssd installed easily in an m2 slot in my motherboard

significant change in speed from a hdd and is worth the money 100",0.007000000216066837,0.041999999433755875,0.9509999752044678
this is exactly what i wanted but would be even better if a mobo standoff and screw were included,0.007000000216066837,0.0430000014603138,0.949999988079071
"performance is really good
it uses sandisk memory and control chip
id buy it again with no hesitation if i needed to",0.00800000037997961,0.041999999433755875,0.949999988079071
bought as an upgrade for my laptop and serves the purpose well readily accepted by the operating system after being initiated via computer managementstoragedisk management very pleased with performance to date,0.004000000189989805,0.04600000008940697,0.949999988079071
easy to install very high quality product and the price is always good compared to other ssds while being a very reputable brand,0.00800000037997961,0.0430000014603138,0.9490000009536743
it is very quick at loading up better than a normal hard drive,0.004999999888241291,0.04800000041723251,0.9480000138282776
has worked perfectly for me since install good little drive,0.007000000216066837,0.04800000041723251,0.9459999799728394
good quality nvme m2 it may not be the fasted but for the price its worth it,0.007000000216066837,0.04899999871850014,0.9440000057220459
good performance cant complain about the value,0.009999999776482582,0.04500000178813934,0.9440000057220459
the product is great super easy installation the only issue i had was remembering how to move the operating system from a 25 ssd to the nvme apart from that really simple good price and a great amount of storage would get again,0.009999999776482582,0.04600000008940697,0.9430000185966492
i upgrade to this from hdds it has made a massive difference to my pc life,0.008999999612569809,0.04899999871850014,0.9419999718666077
"fantastic super fast windows install 1 min from usb 3

check you have an m2 screw before ordering",0.004000000189989805,0.0560000017285347,0.9399999976158142
its very good for the price just to let everyone know its actually 930gb not 1tb but for the money its a good deal i also wish it was black because it looks a bit weird as you can see but overall i think its a good product and i would definitely buy again if its the cheapest option,0.010999999940395355,0.052000001072883606,0.9369999766349792
fast easy and well priced i cant think of a better option for the money,0.012000000104308128,0.050999999046325684,0.9369999766349792
"brilliant for games to load and files i use it for my os windows 10 pro 64bit
wait till it goes on sale for like £80 to £90 thats a perfect price for this upto £100 is abit much ",0.007000000216066837,0.057999998331069946,0.9359999895095825
"cheap1tb ssd nvme drive good performance even is almost full good for gaming
",0.007000000216066837,0.057999998331069946,0.9340000152587891
i bought it because at the moment it was the cheapest in its class it has been working for several months without any problems keeps going fast,0.007000000216066837,0.05999999865889549,0.9330000281333923
bought this as i have had enough of normal harddrive breaking found it easy to install with an external case and works a treat have all my stuff on it now great will be getting another one,0.009999999776482582,0.057999998331069946,0.9319999814033508
replaced a failed ssd works really well has motherboard has two m2 slots great replacement,0.009999999776482582,0.05900000035762787,0.9309999942779541
works very well installed in three separate machines so far motherboard bios recognises the drive easily speed is excellent and benchmarks at what its advertised for 2400mbs with wd 5 years warranty,0.004999999888241291,0.06700000166893005,0.9290000200271606
ive got a couple of these now in the 2nd m2 slots on motherboard these are a great value not as lightening as some of the other drives out there but at the price and for most needs these are great value no reliability issues and temps seem fine unlike a pci4 drive i had that was scorching hot,0.008999999612569809,0.06599999964237213,0.925000011920929
perfect for gaming etc,0.006000000052154064,0.07000000029802322,0.9240000247955322
been using for a few months now no noticeable degradation great access and write speeds,0.006000000052154064,0.0729999989271164,0.9200000166893005
really easy to install and also really thin,0.013000000268220901,0.06599999964237213,0.9200000166893005
just realized it was possible to upgrade my 4 years old desktop from m2 sata to pcie excellent upgrade from a crucial mx300 275gb m2 sata 285 mbs average read to this 1tb m2 pcie 1049 mbs average read,0.004999999888241291,0.07800000160932541,0.9179999828338623
this addition to my pc means everything goes fasterr than before,0.006000000052154064,0.07699999958276749,0.9169999957084656
"the installation is the only point that could be improved providing an appropriate bolt to fix it on the mb would make life so much easier

but the drive itself is awesome speeds are so good i tested with both default configurations and nvme specific",0.017999999225139618,0.06599999964237213,0.9160000085830688
fast simple to install and works with no problems cant fault it,0.013000000268220901,0.07100000232458115,0.9160000085830688
if this product is suitable for your laptop dont hesitate to buy it its easy to install and compared to other good products its cheaper but its as efficient as the pricey ones,0.007000000216066837,0.07699999958276749,0.9160000085830688
good as expected no issues,0.01600000075995922,0.07400000095367432,0.9100000262260437
this was easy to install in my machine and upgraded my windows boot drive from a 250gb m2 to 1tb what more is there to say,0.007000000216066837,0.08299999684095383,0.9100000262260437
good value for money very easy to install and initialized right away without issues which cannot be said about more expensive alternatives ive tried before the brand speaks for itself and no issues with the drive after over 2 months of using,0.017999999225139618,0.0729999989271164,0.9089999794960022
fast and reliable i run some pretty heavy software of the is and game alot recommended for its speed and money transfers are fast,0.007000000216066837,0.08399999886751175,0.9089999794960022
read about these highperformance m2 pcie nvme ssds and decided to install one in my desktop to replace the 7200rpm system hdd the difference in speed and performance is not only significant it is incredible i would compare it to getting behind the wheel of a sports car after years of driving the family saloon,0.007000000216066837,0.08399999886751175,0.9089999794960022
"everything is exactly how reported on the amazoncouk page
cheap and fast i cant exept enything better from this
rig
mb asrock b450 steel legend
cpu amd ryzen 7 3800x
memory corsair vengeance lpx ddr4 3200 c16 2x8gb
gpu asus 2060 rog 6gb",0.008999999612569809,0.08500000089406967,0.906000018119812
"my old ssd could only hold one pc game as i use mods and extra content this is great holds more than enough now easy to install windows from a usb boot the price was low cost i would recommend this for people on a budget

update still going strong if anything i need a new laptop next time i need storage i will go with this ",0.014000000432133675,0.08100000023841858,0.9049999713897705
this has been an amazing edition to my pc but you do need mounting screws shame it didnt come with some,0.02800000086426735,0.06700000166893005,0.9049999713897705
this is essential if youre a gamer and what to load into the game quickly this product provides this,0.004999999888241291,0.09200000017881393,0.902999997138977
this is much faster than the traditional sata ssd drives my machine now literally turns on from cold in 5 seconds,0.009999999776482582,0.08900000154972076,0.9020000100135803
this ssd is fantastic for the price in my opinion as i filled my laptops space some pc games are getting silly big so i needed extra space and this was perfect to help with that problem the load times is fantastic and my only regret is not getting the 2tb one,0.03099999949336052,0.06700000166893005,0.9010000228881836
added second nvme to new build was easy to install and has performed very well transfering large files between the two,0.004000000189989805,0.0949999988079071,0.9010000228881836
"an excellent option when shopping for an m2 drive with plenty of space and speed without breaking the bank
just what i needed when i was in the market for one
has not disappointed
would reccommend",0.008999999612569809,0.09200000017881393,0.8989999890327454
needed an additional m2 drive for a laptop this fits the bill perfectly maybe not the fastest in benchmarks but performs very well in day to day use a good trade off in performance against price,0.009999999776482582,0.09600000083446503,0.8939999938011169
wow pc boots up under 20 secs worth every penny,0.010999999940395355,0.09600000083446503,0.8930000066757202
"unbelievably fast installed skyrim on this and now i can enter buildings with only like a 2 second loading screen

anything installed on this loads like instantly its insane",0.01600000075995922,0.09200000017881393,0.8920000195503235
easy to install fast and does the job,0.014000000432133675,0.09600000083446503,0.8899999856948853
good value fast speeds stays pretty cool low temps i do have a heatsink on it,0.004999999888241291,0.10700000077486038,0.8870000243186951
quick and easy to set up and recognised straight away when pc turned on drive reads data quick and loads games in no time,0.007000000216066837,0.11100000143051147,0.8820000290870667
nothing much to say about this product if you know youre pcs this product description says it allyou get bang for buck speed is really good,0.017000000923871994,0.10100000351667404,0.8820000290870667
nice as an audiophile transport source,0.00800000037997961,0.11100000143051147,0.8809999823570251
i needed more storage in my legion 5 laptop and this was perfect you dont need the highest end ssd for games and this one has the added benefit of consuming less power better for battery life,0.02199999988079071,0.10000000149011612,0.878000020980835
works well no issues after 2 months of use,0.009999999776482582,0.11299999803304672,0.878000020980835
all working perfectly no issues,0.013000000268220901,0.10899999737739563,0.878000020980835
this storage device has been working for a month or os without problems speed was not a requirement but reliability was works fine,0.013000000268220901,0.1120000034570694,0.875
good value for money ssd fast and nvme pcie gen 3,0.004999999888241291,0.12099999934434891,0.8740000128746033
worked first time lightning fast recommended,0.004000000189989805,0.12600000202655792,0.8700000047683716
i bought this in order to upgrade my system drive from 500gb to 1tb yes these are not quite as fast as other manufacturers eg samsung but way cheaper my rig is mainly for gaming and general office type work and this drive is great value for money,0.014999999664723873,0.11599999666213989,0.8690000176429749
70£ for 1tb of nwme ssd card perfect deal for now the prices should go down again by time,0.007000000216066837,0.12399999797344208,0.8690000176429749
"it runs a little hop when under pressure but well withing acceptable limits
it is well made and fast",0.012000000104308128,0.12099999934434891,0.8669999837875366
good upgrade either installed on your motherboard or used with a caddy not the fastest m2 available but probably the cheapest and ultimate speed only matters to serious gamers so much faster than a platter drive or even an ssd,0.014999999664723873,0.11999999731779099,0.8650000095367432
i cant speak for the reliability but i am more than happy with the speeds considering the low cost,0.014000000432133675,0.12200000137090683,0.8640000224113464
best ssd available in market,0.012000000104308128,0.12399999797344208,0.8640000224113464
very good value m2 pcie nvme ssd,0.007000000216066837,0.1289999932050705,0.8629999756813049
brought two of these for my synology ds1621 6bay desktop nas for readwrite caching so much cheaper than the synology nvme ssds good value for money,0.006000000052154064,0.1340000033378601,0.8610000014305115
price is solid and not that much more compared to an hdd at significantly higher read write speeds great for gaming and general use,0.012000000104308128,0.12999999523162842,0.8579999804496765
great nvme ssd at this price decent length warranty and hopefully reliable in the long term only downside is the blue colour scheme as hard to tie in with a typical motherboard colour,0.03200000151991844,0.11100000143051147,0.8569999933242798
im not the greatest gaming fan but i like my fifa this drive has no wait time at all on boot or game load obviously content creators would prefer the wd black version but again this is more than enough to get casual enthusiasts by,0.02500000037252903,0.12099999934434891,0.8539999723434448
"looks really good value and speed as stated by wd is right main chip is made by sandisk

cons
on full load during test was noisy
packaging says product is made for australia market",0.014000000432133675,0.13199999928474426,0.8539999723434448
does what it says it will do on the page great value,0.007000000216066837,0.1459999978542328,0.847000002861023
i wanted to see for myself how much the compare directly to speed of the series x ssd speed even over my last drive at 2000mbs also i then accelerated load time via ram caching at 3006mbs so yeah load times are great saves time and power,0.007000000216066837,0.1459999978542328,0.847000002861023
good price good quality,0.02800000086426735,0.13099999725818634,0.8410000205039978
"bit slow for nvme but the price is way to good

update its sti performing well",0.02199999988079071,0.13899999856948853,0.8389999866485596
