,neg,neu,pos,compound
it seems that many liberals really believe that there are no solution to the rising of far right fascism other than voting for democrats the problem with this theory is that joe biden is in solidarity with republicans far more than he is with the actual left of this country,0.088,0.83,0.081,-0.1027
jill biden is one crazed woman wanting biden to run in 2024 he could be indicted by then,0.081,0.919,0.0,-0.128
president biden is weighing decision to block elon musks twitter buyout on national security grounds,0.158,0.71,0.131,-0.128
you couldnt destroy america any faster than joe biden has since being installed as president hes done everything opposite of president trump thats hurt most americans ,0.112,0.793,0.094,-0.1406
breaking report federal appeals court puts a hault to bidens student loan forgiveness program to consider request from states to block the plan,0.116,0.8,0.084,-0.2023
federal appeals court halts bidens student loan forgiveness program to consider request from gop states to block the plan,0.132,0.773,0.095,-0.2023
us court of appeals issues pause to president bidens student debt relief program as it considers a request from six republicanled states to block the program permanently listen up young folks you aint getting shit from repubs except more debt vote accordingly,0.158,0.721,0.121,-0.2206
biden said if we vote republican we will go back to a trump economy like when inflation was 14 and i could buy fuel for under 2 bucks a gallon instead of 6 when folks could fill a whole shopping cart instead of one bag hell yeah vote red lets go back,0.088,0.822,0.09,-0.2263
breaking a foia disclosure has shown that the white house has demanded an extra truckload of depends be delivered to the white house on or before november 8 details to follow the changing of bidens diaper,0.054,0.946,0.0,-0.2263
breaking us appeals court temporarily blocks bidens student loan handout,0.174,0.826,0.0,-0.2263
cbp leadership waited until late on a friday night to release the most recent border numbers to cover up the biden administrations failure to secure our southern border the american people deserve more transparency and accountability from their government 12,0.077,0.867,0.056,-0.2263
pres biden leads the entire country his programs benefit all americans not just some you try to divide the people 8 of top ten murder states are red,0.14,0.716,0.143,-0.2263
although i am frustrated by inflation and sometimes worry that joe biden is out of touch with my values i voted for the democratic party today because i believe that the republican partys erratic behavior is disqualifying,0.151,0.719,0.129,-0.2263
joe biden is a national security threat not ,0.315,0.463,0.222,-0.25
marjorie greene no matter what joe biden says about inflation you cant put lipstick on pig,0.127,0.809,0.064,-0.2732
pres biden gave a great speech in early september warning that maga gops rejection of democracy and embrace of fascism threatens the very foundations of our republic not sure why that theme is not being loudly screamed by democrats in closing weeks of 2022 campaign,0.187,0.663,0.15,-0.2732
a federal appeals court has temporarily blocked the biden administrations student loan cancellation program nancy pelosi was right this program is an unconstitutional use of executive power,0.077,0.923,0.0,-0.2732
the gop agenda • investigate hunter biden • end aid to ukraine • defund the fbi • shut down the government • gut ss and medicare • investigate hunter biden • impeach the president • force 10yearolds to give birth • investigate hunter biden am i missing anything,0.056,0.944,0.0,-0.296
joe biden says he plans to tap the reserves until they are gone with no plan to refill them he vowed to end us oil and gas production and now hes doing it,0.064,0.936,0.0,-0.296
the federal deficit has been cut roughly in half joe biden is the most fiscally responsible president in history,0.205,0.684,0.11,-0.3008
in a friday news dump the biden administration revealed that fy 22 had the highest ever number of encounters at the southern border over 23 million this doesnt even include people whove gotten away biden has erased our southern border its unamerican what hes done,0.057,0.915,0.028,-0.3182
in other words the three states that lost the most jobs during trumps predatory presidency have fully recovered under biden,0.108,0.892,0.0,-0.3182
former us secretary of state president biden is making the same mistake that president obama didhes refusing to stand with the iranian people in hopes of getting a deal with the regime it wont work,0.131,0.797,0.072,-0.3182
donald trump was president from 2017 until early jan 2021 63000 americans died of fentanyl during that time there was not one seizure of fentanyl under his leadership joe biden on the other hand seized 621 pounds of deadly fentanyl at the boarder in one month alone,0.106,0.833,0.061,-0.34
ask a democrat where is the freedom when first responders are fired when the military are dischargednow kids are being forced the concoction vaccine or they wont be able to go to public schools america is now a communist state under biden and the democrats,0.13,0.787,0.083,-0.34
loving joe biden calling out mega maga trickle down economics the age old republican scam to steal from the poor and give to the rich,0.267,0.533,0.2,-0.3612
one thing we dont need right now is an activist court undermining joe bidens accomplishments,0.152,0.848,0.0,-0.3612
the bidens always use beau biden as a ploy when they get in trouble joe said beau died because of the burn pits in iraq not to be unkind but i did not know they had burn pits in the green zone where the jag officers were,0.087,0.88,0.033,-0.3732
bidens agenda has been so good for all of us in america he has kept his promise to govern for the working class republicans have already signaled an end to ss medicare lower drug prices gun safety abortion wno exceptions once america understands it will be hell no,0.186,0.669,0.144,-0.3734
democrats losing in 2022 is a path to getting rid of biden in 2024 and pelosi as speaker,0.14,0.86,0.0,-0.3818
dr biden is trending because joe biden was giving an interview and paused for a moment midsentence thats it no dementia no falling asleep dude literally was just pausing at least his suit wasnt tan i guess,0.152,0.787,0.061,-0.3818
joe biden unleashed a crime wave that is putting the safety of american citizens at risk,0.275,0.588,0.137,-0.4215
heres how it works zelensky warns that russia is going to blow up dam then zelensky blows up dam and biden and zelensky blame russia along with lap dog media,0.119,0.881,0.0,-0.4215
since biden took office more than 47 million illegal immigrants have crossed the border illegally that includes 900000 gotaways who managed to escape border patrol and vanish into the country,0.108,0.841,0.051,-0.4404
did you see biden fall asleep during that interview yesterday the economys in the tank and that fool cant stay awake,0.127,0.873,0.0,-0.4404
after the catastrophic afghanistan withdrawal biden couldnt understand why his allies werent on tv defending him call them call their offices an exasperated biden ordered aides see why theyre not out there but they were unwilling to publicly defend him,0.095,0.88,0.025,-0.4497
biden is about to deliver democrats the biggest midterm defeat in american history,0.2,0.8,0.0,-0.4588
if you met up with joe biden right now what would you have to say to him i cant say on here or i will prop get banned,0.107,0.893,0.0,-0.4588
why are you thanking biden honestly you should be thanking hard working americans for paying your daughters debt you should be especially thankful for the ones that did not go to college themselves but will be forced to pay for you daughters choices,0.171,0.739,0.09,-0.4684
democrats passed a burst of legislation that paves the way for new chip plants and spurs investment in new electric vehicle ventures biden is building american manufacturing while maga is waving bibles and fake cop badges #votebluetoendthelies,0.081,0.919,0.0,-0.4767
why did biden just say his inflation reduction act is working hasnt his fiscal irresponsibility increased the national debt by 4 trillion and led the us into a recession,0.169,0.764,0.067,-0.4939
republicans plan to lower gas prices and stop inflation by investigating hunter bidens laptop,0.268,0.732,0.0,-0.5267
in an interview yesterday biden was unable to answer if his wife wanted him to run for a 2nd term he was totally confused our president not being able to answer a question like this is a national security threat his cognitive decline is too far gone he needs to resign now,0.146,0.768,0.086,-0.5413
appeals court pauses biden student debt relief program the order came from the 8th us circuit court of appeals in a case brought by six republicanled states the gop just pissed off around 40 million voters,0.16,0.766,0.074,-0.5574
joe bidens 2022 illegal migration delivers 7 migrants for every 10 us births replacement is in process,0.194,0.806,0.0,-0.5574
of course the biden admin waited until late on a friday night to announce the record 24 million illegal immigrant encounters this fiscal year thats a new record and a new low in democrats complete failure to secure our borders and keep us safe,0.179,0.716,0.105,-0.5719
biden keeps draining our strategic oil reserves to artificially lower gas prices before the midterms it will not lower prices nor help democrat election chances but will put our national security at the highest level ever that idiot has to be impeached asap in january,0.176,0.739,0.085,-0.583
yesterday president biden announced that the deficit fell by 14 trillion this year this is the largest oneyear drop in american history,0.194,0.806,0.0,-0.5859
president biden has cut the deficit by the largest amount in us history this year 14 trillion,0.242,0.758,0.0,-0.5859
president biden cut the us deficit by 14 trillion dollars after the gop raised it by 6 trillion during tfgs term its the largest one year reduction in history why isnt this all over the news,0.127,0.873,0.0,-0.5859
obama started all this fucking divisive shit that he couldnt finish because michelle took his balls now bidens finishing it,0.17,0.83,0.0,-0.5965
candidate biden said he would end fossil fuels no more drilling no more fracking this ends now potus biden now criticizing oil companies for not producing enough not investing enough and making too much money what kind of special idiot is biden pretty damn special,0.223,0.639,0.138,-0.5975
build back better the great reset biden is using up his already depleted oil reserves the us destroyed ns1 2 opec cut oil prod by 5 the us are stealing syrian oil by night the us are trying to prevent all new oil gas resources being exploited on us soil,0.196,0.671,0.133,-0.5994
its time to stop this farce that theres nothing cognitively wrong with joe biden he was on msnbc the host asked if he was going to run again he got that blank no ones home look on his face just froze staring into space he finally came out of it finished mumbling,0.13,0.826,0.044,-0.6087
hunter biden and ashley biden have never denied the information in hunters laptop or ashleys diary what thst tells us is joe biden is a terrible father an alleged sexual predator and a sick person think about it,0.153,0.789,0.058,-0.6116
ive already seen several repub ads claiming biden and inflation are to blame for the cost of turkey avian flu hit many domestic poultry farms coast to coast this year carried further by migratory birds knowledge is power vote accordingly,0.116,0.884,0.0,-0.6124
if maga takes back congress they will cut social security medicare extend tax cuts for wealthy corporations kill bidens student loan forgiveness ban abortion and make sure we never have free elections again please go knock some doors today #votebluetosaveamerica,0.266,0.503,0.231,-0.6126
bidens new phrase that he rehearsed b4 he could say it is mega maga trickle down it has hillary clintons fingerprints alloverit because she was the drunk genius that came up with it shh will biden spew more hillarys crazy phrases before the election,0.108,0.892,0.0,-0.6222
biden and boris johnsons antirussia policy caused economic disaster in uk and europe and it is the main reason for downfall of liz and political instability in uk and europe,0.124,0.876,0.0,-0.6249
buccees denton tx reg gas307 no ethanol gas 429 diesel 469 biden and his asinine policies are killing this nation,0.253,0.651,0.096,-0.6249
joe biden is the worst president of your lifetime,0.339,0.661,0.0,-0.6249
bidens fentanyl crisis continues as 22 pounds of deadly fentanyl were seized by west tennessee drug task force agents bidens open border policies are allowing this illicit drug to flow across our southern border and into tennessee communities,0.1,0.9,0.0,-0.6249
have we ever seen biden boris macron visiting churches blowing up tax payers money waving to imaginary crowds and making a spectacle out of it what utter nonsense goes on in india in name of religion ridiculous,0.133,0.867,0.0,-0.6369
has joe biden cured cancer yet,0.468,0.532,0.0,-0.6597
fascists are blocking president bidens student debt relief planfascist maga assholes in ne and fascist maga judges are helping them they are not republicans the republican party is gone so if you dont get some of your loans forgiven its because of fascists not joe,0.261,0.567,0.172,-0.6705
biden administration allocates 900 million for electric vehicle chargers should be spent on veterans medical care for cancer patients and those americans who are below the poverty level ,0.214,0.696,0.089,-0.6705
i think ill retype this every day until 118 you are aware that the insane and unscientific decision by biden and big pharmas cdc to add these shots to the childhood schedule now means your states vote for governor in nov will decide if your kids take them for life right,0.103,0.897,0.0,-0.6705
a lot of what weve done has not kick in yet are you freaking kidding me so biden is saying the plan is for things to get much worse red wave cant come soon enough,0.154,0.809,0.037,-0.6705
fetterman biden met yesterday but no one was allowed to record gee i wonder why it mustve been like a drunk stan laurel meets a drunk lou costello ,0.271,0.632,0.098,-0.6956
id tell joe biden to kiss my ass but hed probably enjoy it so ill just tell him to go fuck himself instead,0.315,0.509,0.175,-0.7131
im now convinced that democrats are going to get crushed in the midterms and that its powells fault for deliberately crushing the economy and bidens fault for reappointing powell and then not firing him,0.246,0.645,0.109,-0.7153
the price of gas is high corporate greed putins aggression but have you ever filled a tank in canada france the uk how is that bidens fault again,0.226,0.774,0.0,-0.7184
us has one of the lowest inflation rates gop against inflation control bill gop are trying to stop biden paying on federal educational debt if gop keep it from passing do not pay your bill,0.184,0.783,0.033,-0.7188
sleepy joe just reduced the deficit from 28 trillion to 14 trillionhe cut the deficit in halfno silly childish immature name you call him will change that factjoe biden is a bada thank you ,0.241,0.67,0.089,-0.7269
biden likes to say he reduced the deficit never mind that trumps failures on that had to do with s disappointing tenure and and others who caved to dems on social spending would have whipped their pimply butts #deficitsdomatter,0.195,0.744,0.061,-0.7269
psa biden has cut the federal deficit by 17 trillion dollars in under 2 years no other president has ever even come close to such a substantial cut,0.285,0.658,0.056,-0.743
democrats have set up a tent city for illegal immigrants with fluff and fold laundry tvs and xboxs paid for by taxpayers meanwhile 25 of americans have to skip thanksgiving due to democrat inflation all part of the dems build back broke agenda #fjb #biden #bidenflation,0.13,0.87,0.0,-0.7506
history shall not be kind to biden for not seizing upon the opportunity the fates have granted him to conquer britain in their time of weakness greatness was thrust upon him but he was too demented and mediocre to act the bald eagles weep,0.172,0.761,0.066,-0.7534
if ur sick of the clown circus shit show that is the biden administration plz get out and vote red,0.274,0.675,0.052,-0.765
having dementia is the least of our worries when it comes to biden hes the most compromised man to ever have the wh his relationship with china puts every single americans safety in jeopardy the chinese own our politicians our land they have police here terrifying,0.176,0.772,0.051,-0.7783
im not afraid to say the biden student loan infuriates me something awful along with all my friends how stupid do dems think we are,0.293,0.616,0.091,-0.7845
we have really failed to keep track of what a dumpster fire this country was from the federal government on down when trump left office and take for granted just how well things have went because of biden im not sure anyone else could have fixed half the mess he cleaned up,0.2,0.731,0.068,-0.7879
covid spending is coming to an end so biden claims he is reducing the deficit is he really this stupid,0.281,0.719,0.0,-0.7934
more than 23 million illegal immigrants have crossed the border in fiscal year 2022 breaking the record bidens adm set a year ago by 37 the total of the two recordsetting years of illegal migration under the biden administration is now 47 million 10222 newsmax,0.146,0.854,0.0,-0.802
difference between biden and hu jintao both old and not fit they are giving power to biden an elder abuse a constant humiliation to put him on stage and have him make fool of himself hu jintao is invited to assist cpc congress as sign of respect as ex china president,0.207,0.705,0.088,-0.8131
joe biden today on marjorie taylor greene and ted cruz who in the hell do they think they are joe biden when asked for his reaction to steve bannons prison sentence i never have a reaction to steve bannon dark brandon is going on mount rushmore,0.157,0.817,0.026,-0.8225
while you worry about feeding your family affording gas rising crime and heating your house this winter know that biden voters are worried about spending your money on their student loans and getting creampies,0.217,0.783,0.0,-0.8225
bidens an idiot harris sucks prove me wrong anytime,0.597,0.403,0.0,-0.836
folks if republicans get their way they will extend the donald tax cuts and add 3 trillion to the deficit biden has worked hard to cut this number lets not let the red devils have their way vote blue ,0.262,0.671,0.067,-0.8412
people i know from hs call biden evil they cant say why really they dont know his specific crimes though theyre convinced hunter is involved they just know hes evil because theyre fed an endless diet of newsmax foxnews and they cant tell truth from lie,0.198,0.753,0.05,-0.8427
biden the inflation reduction act will lower costs inflation increases biden no americans left in afghanistan hundreds of americans are still stranded behind enemy lines biden no new taxes on americans making under 400k taxes hike at every income level,0.219,0.781,0.0,-0.8442
grocery store prices inflation disease drought oil companies greed big corporations greed war not biden,0.437,0.563,0.0,-0.8519
dr biden the usual raft of bs about the president ensues i also have a stuttering problem i often have to close my eyes a couple of seconds to get my tongue in order ive been a caregiver around dementia patients and see no signs of it with biden political enemies do,0.195,0.805,0.0,-0.8555
 we are going to be leading a revolution in congress biden and his family will be a top target so will the cdc fbi doj doe dhs and many other government entities that have abused power this woman is a domestic terrorist who continues to threaten america,0.202,0.763,0.034,-0.8689
why arent you energy corporations fighting the lies of biden and democrats show some stones stop being cowardly,0.478,0.522,0.0,-0.8724
 is running on reimplementing masking and mandating covid vaccines hes running on gun control open borders thug coddling and expanding bidens disastrous policies in florida and hes shocked hes losing by double digits,0.279,0.721,0.0,-0.8807
i was mistaken yesterday right now many of our ohio stations are over 4 a gal some very close to 5 which it soon will be when this hoax biden is pulling for the midterms by using the reserves ends the guy is a stone liar about prices coming down dems are 2 stupid to see it,0.198,0.802,0.0,-0.8904
info that the news wont report on biden breaks his annual record with 23m illegal border crossings biden predictably released his recordbreaking illegal migrant border crossing data friday a whopping total of 47m illegal border crossings in 2 years,0.241,0.759,0.0,-0.8957
so the left was angry rightly so when mike lindell was invited to the oval office but why no complaints when biden invites the equally disturbed dylan mulvaney mulvaney is an adult man who newly identifies as a young girl and refers to womens vaginas as barbie pouches,0.217,0.783,0.0,-0.8979
had to block joe biden today tired of looking at the stupid sht that someone is writing for the idiot,0.439,0.561,0.0,-0.91
a reminder that oilgas companies continue to rob americans blind by price gouging and they pay fascist republicans to blame it all on biden so that they can all make their many billions as democracy crumbles it should be bigger news,0.281,0.719,0.0,-0.9136
dems should be hammering over over not in any order maga threat to democracy crime rate much higher in red states mass shootings gun violence are crimes bodily autonomy under assault bidendems saved us economy from worldwide inflation wpolicies,0.325,0.623,0.053,-0.9371
hey magats say what you want about president biden but at least he didnt let over 1 million americans die from covid while he was simultaneously selling our top secret information to our enemies so fuck you,0.316,0.617,0.067,-0.948
