,neg,neu,pos,compound
other than biden dems have shifted from the economy is actually doing great to yeah well the economy sucks but the gop wont do anything about it if they win what a great slogan that is for the dem party lol,0.03,0.556,0.414,0.9721
joe biden has always been a mean guy he unjustly grilled justice clarence thomas at his supreme court hearing hes been a know racist most of his life best friends with a kkk grand wizard throw in his obvious dementia this is what we get ,0.07,0.628,0.302,0.9231
if you compare jill biden to melania trump there really is no comparison melania reaks of class dignity kindness beauty like no other flotus and loves our country above all else jill is exact opposite fishnet hose look sums her up,0.091,0.622,0.287,0.8944
1 day after amy coney barrett refused to take a case about bidens student loan forgiveness program an appeals court blocked it from taking effect so what looked like a win with the supreme court a day later looks more like collusion between the sc conservative lower courts,0.113,0.626,0.261,0.86
republicans will not ban contraception ban abortion cut social security give ukraine to putin install trump as president get rid of anyones right to vote or overthrow joe biden if you believe any of this please go outside,0.046,0.718,0.237,0.8304
everyone who was all the student debt relief isnt enough it should be more bernie would have made college free forever todays suspension of the biden executive order for student debt relief was triggered by a suit filed by republicans the parties are not the same,0.089,0.694,0.217,0.802
biden forgave student loan debt and descheduled weed two issues you said you cared about if you dont show up to vote dont blame politicians for not doing anything for you thats on you you showed them that passing what young people care about doesnt matter,0.066,0.741,0.193,0.7822
i truly do appreciate joe biden more than i ever thought that i could he always moves forward enrages the cult and just gets it done if he runs again he has a good chance if he were 20 years younger he would trample the cult underfoot for all of time he still may yet,0.047,0.776,0.177,0.7717
millions of people could have seen student debt relief under the biden plan now gop governors have filed suit and won a temporary stay of the debt forgiveness program with the help of their cronies on the federal bench remember that on election day vote them out,0.088,0.707,0.205,0.765
ever since i put my biden sign on my lawn i have been an outcast love it got biden signs for my liberal neighbors that really drove them crazy to have 4 signs in a row 1 said i know youre a biden lover i said you got that right,0.054,0.785,0.161,0.7458
funniest thing are the cpusa members who support biden but are also grover furr type stalinists who think beria was innocent,0.0,0.713,0.287,0.7391
good morning friends i was heartened to hear biden tell an interviewer that we are in the time where this generation must defend democracy it is our turn to do what needs done vote,0.0,0.838,0.162,0.7184
for those who insist djt won the 2020 election and biden is an illegitimate president then by the provisions of the 22nd amendment djt is ineligible from seeking a 3rd term cant have it both ways please retweet #ineligible2024,0.0,0.857,0.143,0.7184
we just came back from a neighborhood cocktail party every single woman and their husbands said they were voting they all liked my joe biden shirt,0.0,0.807,0.193,0.6705
biden is making a huge effort to bring back the american middleclasstrying to take the country into the 21st centurysustainable living green energy that will create millions of new jobsit will take a few years a vote for the gop is a vote to take us back to the dark ages,0.0,0.871,0.129,0.6705
ive said it once and ill say it again im still damn proud to have voted for president biden for the shitstorm he was given on purpose hes doing a fantastic job lets do our part and give him the blue majorities in both house and senate he needs to do more good,0.088,0.753,0.159,0.659
todays temporary decision does not stop the biden administrations efforts to provide borrowers the opportunity to apply for debt relief nor does it prevent us from reviewing the millions of applications we have received,0.089,0.718,0.193,0.6386
the elections commissioner for wisconsin republican was asked multiple times by msnbcs alex wagner if joe biden won the 2020 election all three times don millis refused to simply say yes biden wonhe will be overseeing the election this november in ron johnsons state,0.044,0.827,0.129,0.6369
breaking report court to allow missouri ags team to depose dr fauci jen psaki fbi agent elvis chan and multiple other biden administration officials relating to collusion with social media to suppress free speech,0.0,0.86,0.14,0.6369
fun fact trump is the first president since hoover to leave office with less jobs in america than when he started meanwhile president biden created 10 million jobs he did that ,0.035,0.812,0.154,0.6249
dont kid yourself if the red party is back in power they will go after medicare social security gay marriage contraception and roe will be nonexistent oh and they will try and impeach biden just to name a few heinous items on their agenda,0.0,0.889,0.111,0.6249
how does biden hiring 100000 cops and 87000 irs agents help you and your families survive a surging pandemic and the biden great recession,0.095,0.676,0.23,0.6124
biden 15 wont pass arp reconciliation plus dont have votes populists boo you neoliberal hes right biden scotus wont stand eviction moratorium populists boo go cori bush right again biden i cant mass cancel 50k to all populists cancel all todays news,0.0,0.864,0.136,0.6072
so biden and the democrats are considering preventing elon musk from buying twitter for national security concerns in fact the only security theyre worried about is the security of their own power to control the conversation,0.08,0.747,0.173,0.5994
washington post with trump as president trumps denial mismanagement and magical thinking led to pandemics dark winter washington post with biden as president covid was beyond his control amazing,0.0,0.881,0.119,0.5859
everyone remember the gop went to court and got student loan forgiveness blocked by the courts today so when payments start back up in january dont forget joe biden tried to give us a bit of relief,0.051,0.781,0.168,0.5812
why isnt the mainstream media reporting the countless successes that president biden has had especially while only having a razorthin margin in the profilibuster senate,0.0,0.865,0.135,0.5574
will someone please please educate biden as to what maga means,0.0,0.662,0.338,0.5574
the cdc voted to have our kids take the covid vaccine or they cant go to public school brought to you by the communist biden administration thank god my grandkids dont go to public schools,0.0,0.878,0.122,0.5574
who here agrees biden doesnt give two shits about our country,0.0,0.674,0.326,0.5194
this is just another lie notice the white house doesnt confirm that it was a factual statement the wording of this tweet is very important the white house doesnt say the deficit went down they only say biden said it did big difference,0.0,0.902,0.098,0.5189
what has joe biden done to earn our trust,0.0,0.708,0.292,0.5106
gettin fin tired of waiting for this biden wh to address the pardon of reality leigh winner how about you,0.112,0.654,0.235,0.4939
do the people who think a starmer government will save us from fascism also think biden is saving america right now,0.0,0.856,0.144,0.4939
despite the risks ill be the one to come out and say itjoe biden is a thug,0.0,0.772,0.228,0.4847
why would 6 red states bring a lawsuit against the biden administration for student debt relief do they not believe that they have constituents who would benefit this is when gop voters should start questioning their representatives stop voting against your own self interest,0.154,0.672,0.175,0.4767
i talked to my friends high up in the gop yesterday as soon as the new congress opens jan 2023 they will start investigations into big tech investigations into hunter biden investigations into ukraine investigations into fbi corruption and start impeachment process vs biden,0.0,0.931,0.069,0.4767
biden is now calling us the maga force whatever were paying this guy its well worth it,0.0,0.789,0.211,0.4588
under president biden insurrections are down 100 thanks joe,0.0,0.734,0.266,0.4404
my pet goldfish would be a better president than joe biden,0.0,0.756,0.244,0.4404
shout out to the republicans for highlighting each time drugs are seized at the border and for making biden look good in how he is doing his job ,0.0,0.903,0.097,0.4404
good morning america except for those that voted for biden,0.0,0.756,0.244,0.4404
trump was handed the president obama economy and by the midterms he hadnt managed to destroy it all president biden was handed the trump economy and by the midterms he hasnt managed to fix it all mainly because the republicans wont let him,0.0,0.936,0.064,0.431
focus they want to talk about biden when he doesnt legislate our state my opponent acts like he is running against biden the idaho gop supermajority led by my opponent are in control of writing the legislation that governs our lives hold them accountable vote nov 8 #idpol,0.0,0.922,0.078,0.4215
today is october 22 2022 and the biden family is the most corrupt family in the united states of america,0.0,0.872,0.128,0.4215
trump and maga added 400b to the deficit with their 2t tax cut for the rich and corporations president biden reduced the deficit by 14 trillion this year and 350b last year the largestever improvement dems are the real party of fiscal responsibility,0.139,0.688,0.173,0.4215
1 returned from africa in time to hear bidens speech one of his best he outlined the differences between his administration snd trumps pointing to his reduction of the deficit vs trumps nearly tripling it he ascribed this mostly to tax cuts for the wealthy which are,0.091,0.784,0.125,0.4215
biden and his aides eventually settled on describing the republicans as ultramaga the result of a sixmonth research project led by anita dunn who rejoined the white house as a senior adviser in the spring and the center for american progress action fund a liberal group,0.0,0.938,0.062,0.4215
i started to fill out bidens report card but i cannot figure out what courses he is taking it is definitely not those i assigned as a result he gets an f minus no extra credit for screwing up things i did not assign,0.112,0.738,0.151,0.4215
over 600000 people slept on the streets last night in america as biden ignores the situation and sends over 120 billion to ukrainian nazis is that a win,0.068,0.809,0.123,0.4019
the bottom line teachers unions turned the pandemic into a bargaining chip and kids everywhere suffered and they did so with the incestuous support of biden newsom legacy media and the left kids deserve so much better,0.076,0.784,0.14,0.3976
big senate republican leader mitch mcconnell called on biden to increase arms supplies to ukraine his statement said he also promised that republicans in the senate will guarantee the timely delivery of more weapons for ukrainian forces whats up russia ,0.069,0.783,0.148,0.3832
has joe biden ever experienced a real journalist grilling like president trump did seems to me its never ending softballs for the big guy,0.0,0.898,0.102,0.3612
never seen so many biden lovers with 03 followers all out in force dems must be worried,0.105,0.719,0.176,0.3535
we had a recession under trump in 2020 did everyone forget biden had to save the economy and the people and people think trump and gop are better at the economy all recessions during our lifetime have been by republican led presidents and gop media leaves this out,0.087,0.799,0.113,0.34
the real question that should be asked is that juneteenth hip hop holiday putting gas in your car paying for the grocery bill that has doubled within the past year this is all that voteps got for voting biden in yeah im going there all of yall should feel embarrassed,0.046,0.864,0.09,0.34
biden warns us if we vote republican we will go back to an economy under trump lol biden just gave the election to republicans ,0.053,0.84,0.107,0.34
i miss trump he didnt hate america and put us first biden doesnt,0.11,0.685,0.205,0.3395
joe biden is toxic and every democrat asking him to please stay away from their campaign knows it,0.0,0.881,0.119,0.3182
i had a #dream last night mar a lardo was forfeited seized a condominium was built on the land after trump owed america how bad he did the united states of america thanks president biden #democratsdeliver,0.092,0.759,0.149,0.296
the fbi seized hunter bidens laptop in 2019 steve bannon was subpoenaed by congress in 2021 theres no justice just political persecution,0.086,0.781,0.133,0.296
republicans just want to obstruct everything biden does or tries to do vote for dems straight down the ticket bidens has more work to do vote blue,0.0,0.887,0.113,0.296
all the republican house members who got hundreds of thousands of ppp dollars forgivenwhich means taxpayers get the tab have sued and blocked bidens student loan forgiveness program when will the gqp base realize that rs dont give a crap about them christ wake up ,0.044,0.865,0.09,0.2924
how does it feel now that the courts have found that bidens student loan cancelation is unconstitutional and student debt will not be forgiven or paid they are accepting applications with all of the applicants personal information i am laughing my off,0.099,0.779,0.122,0.2769
ultra maga trickle down biden sure hates our president doesnt he i wonder if he dreams about president trump ,0.127,0.655,0.218,0.2732
a priority for the house next year should be to conduct a comprehensive impeachment inquiry into biden and his political appointees,0.0,0.9,0.1,0.25
breaking courts temporarily blocks president biden from forgiving student loans after 22m already applied,0.113,0.714,0.173,0.25
so joe biden did an event to campaign for john fetterman and fetterman didnt even speak odd,0.0,0.891,0.109,0.2411
biden said his proposed student debt forgiveness would only help the middle class thats a lie those with law degrees stand to get an estimated 29500 in loan forgiveness while those with medical degrees would get an average of 48500 in debt cancellation,0.102,0.757,0.141,0.2263
the wealthy wont allow president biden to help ordinary americans with student loans but they allowed forgiveness for marjory traitor greene matt gaetz and jared kushner for their ppp loans we are at war with the wealthy whether people realize it or not #eattherich,0.123,0.701,0.175,0.2064
thanks president biden for leading the american people and not dictating like the last guy,0.117,0.722,0.161,0.1999
if newsom and biden really wanted to help the america people they should stop the federal and state gasoline taxes,0.095,0.777,0.128,0.1935
honestly im shocked msnbc let that clip of biden see the light of day,0.133,0.694,0.173,0.1779
just so ya know the scotus already ruled on student debt relief they sided with president biden keep applying,0.111,0.752,0.137,0.1531
22 million americans have applied for student loan forgiveness under bidens program in just the first few days republicans are filing injunctions asking the courts to prevent them from receiving debt relief under this initiative which party is declaring war on america again,0.122,0.706,0.172,0.1531
i want mitch out as much as i want biden out,0.0,0.729,0.271,0.1531
that is because they were the top three states who lost the most jobs they should all be thanking joe biden and the dems for passing policies that create jobs,0.069,0.813,0.117,0.1531
we must unleash our american energy bidens america last policies are hostile to energy companies and theyre driving our prices through the roof this must end,0.087,0.772,0.141,0.1531
biden doesnt want elon to buy twitter but neither does elon that means theres a deal to be done elon can get off the hook because the government stops the deal its not crazy elons two biggest businesses are closely tied to government spending lots of levers to pull,0.06,0.89,0.051,0.1388
biden rips the mask off of kevin mccarthy and the gop president biden exposed kevin mccarthy and gop as being motivated solely by power and said that they have no platform other than to tear down,0.089,0.835,0.076,0.128
the democratic party and joe bidens border policies have created an outofcontrol border crisis i dont believe its an accident open borders do not work for americans if it is helping the democrats accomplish their goal what is their goal,0.144,0.661,0.194,0.128
8th circuit court of appeals temporarily stops biden student loan forgiveness plan obviously the effort was led by republicans,0.077,0.821,0.101,0.128
the most difficult decision biden has to make each day is what flavor ice cream he wants and what size cone everything else his handlers decide and take care of,0.082,0.824,0.094,0.1045
we spent a lot of money to help ukrainians but this is much more than about ukrainians its about nato about western europe its about making sure russian president vladimir putin cant succeed us president biden,0.086,0.795,0.119,0.092
so biden is asking if you want to go back to the trump era economy so do you ,0.0,0.929,0.071,0.0772
the mid terms will be a choice of what kind of country you want joe biden,0.0,0.915,0.085,0.0772
fact republican candidates overwhelming want donald trump to campaign for them democrat candidates overwhelming are telling joe biden to stay away the crowd wont report it,0.0,0.951,0.049,0.0772
the media said joe biden was toast hes now president of the united states ignore them,0.13,0.725,0.145,0.0772
dear president biden not a god damned thing is your fault,0.295,0.392,0.313,0.0695
biden warns republicans will tear down all of his accomplishments if they win the midterms what accomplishments has biden done the only thing that comes to mind is hes destroyed our economy,0.123,0.775,0.102,0.0516
in the midwest gas was down to 2 a gallon under trump but went up to just over 5 a gallon under biden now its hovering right around 4 a gallon and democrats are taking credit for the price decrease this is how they think this is why were a mess,0.067,0.863,0.07,0.0387
if biden unleashes the federal government to prevent elon musk from buying twitter then youll know weve become china,0.0,0.942,0.058,0.0258
joe biden got lost trying to walk off the stage again this time at the fetterman speech and that was the highlight for senile joe today ,0.08,0.836,0.084,0.0258
joe bidenwe have spent a lot of money to help ukrainians but its much more than about ukrainians its about nato about western europe it concerns ensuring that russian president vladimir putin could not succeed he said in an interview with msnbc,0.075,0.827,0.098,0.015
very misleading but not unexpected from a habitual liar like biden thats just like gas prices are down to 4 after he raised them to 5 but they were 2 under trump,0.174,0.65,0.176,0.0138
when asked about the republicans platform president biden said they dont have a platform they tear down what ive been able to do and what weve been able to do but i dont really know what theyre for,0.0,1.0,0.0,0.0
i remember when trump would speak and stumble over a single word making the left claim he was unfit mentally to be president biden falls asleep during interviews and nobody bats an eye,0.0,1.0,0.0,0.0
whats joe bidens plan to give taylor back her girlhood,0.0,1.0,0.0,0.0
president biden on republicans they dont have a platform other than to tear down what ive been able to do weve been able to do and i dont know what theyre for ,0.0,1.0,0.0,0.0
biden hasnt gone a day in his life without telling a lie,0.0,1.0,0.0,0.0
if joe biden is the president then im the king of england,0.0,1.0,0.0,0.0
biden isnt running for office but im still gonna put a big biden sign on my lawn,0.0,1.0,0.0,0.0
maybe garland will consider charging trump after 1 the gqp takes control of the house and doj purse strings w trump possibly named as speaker to lead biden impeachment 2 trump announces that he is running again chess grandmaster at work here folks,0.0,1.0,0.0,0.0
how about being on americas side fk bidens side,0.0,1.0,0.0,0.0
what do you get when joe biden and john fetterman campaign together one gigantic incoherent word salad,0.0,1.0,0.0,0.0
nolte nearly 70 of parents disapprove of joe biden,0.0,1.0,0.0,0.0
remember regardless of what republicans are telling you president biden and democrats did not cause the inflation being felt by people not only here but around the world if you havent already noticed republicans will say and doing to regain power to control your lives,0.0,1.0,0.0,0.0
xi jinping is conducting purges on camera joe biden is taking naps on camera,0.0,1.0,0.0,0.0
i hear jill biden headed down to florida because she heard they have cuban breakfast tacos down there,0.0,1.0,0.0,0.0
how is pulisic still not on for sterling somebody call biden man,0.0,1.0,0.0,0.0
almost 4 million illegals have crossed the border since biden,0.0,1.0,0.0,0.0
cabinet ya hustlers inashinda networth ya biden and his entire cabinet,0.0,1.0,0.0,0.0
isnt that what biden wants to do with his predecessor,0.0,1.0,0.0,0.0
when fetterman biden were campaigning togethercould they understand each other ,0.0,1.0,0.0,0.0
why repubs are so hellbent on canceling pres bidens student loan forgiveness loan forgiveness helps people of color more than white people black students are more likely to accrue college debt extending the cycle of poverty despite getting an education #resistanceunited,0.119,0.741,0.14,0.0
breaking record 24 million migrants illegally crossed border in fy2022 almost 4 million total under biden new cbp data shows,0.0,1.0,0.0,0.0
where is james biden is he in the witness protection program,0.0,1.0,0.0,0.0
wheres biden campaigning today,0.0,1.0,0.0,0.0
bidens catch phrase to aides tell me what to do docs the president would frequently say,0.0,1.0,0.0,0.0
why are the mainstream media so afraid of republicans possibly impeaching joe biden they rooted for democrats to impeach donald trump from the moment he came down the escalator republicans have actual evidence its not a sham could be that be a reason why theyre afraid,0.0,1.0,0.0,0.0
biden will be the fall guy after the election,0.0,1.0,0.0,0.0
biden is using the fbi to silence his political opponents,0.0,1.0,0.0,0.0
is jill biden a socialist,0.0,1.0,0.0,0.0
biden calling elon musks twitter buyout a national security is just another way of biden saying my agenda cant move forward unless i have full control of speech he doesnt look at his illness or border being a national security risk only a business man buying twitter,0.099,0.802,0.099,-0.0
biden is also trying to imprison his predecessor,0.0,1.0,0.0,0.0
whats the difference between biden and a guy with alzheimers,0.0,1.0,0.0,0.0
omg did you see bidens interview on msnbc that happened today,0.0,1.0,0.0,0.0
abbott has caused high inflation in texas not bidenlook at your electricity bill rate extra taxlook at water billgas taxtaxes in countycityhospital now look at house and car insurance up now add health insurance premiums due to most uninsured in usno extended medicaid,0.0,1.0,0.0,0.0
i read something this morning that said republicans are not asking trump to campaign for them bc they dont think they need him yet for weeks the articles have said that democrats are running away from joe biden because he has not been asked to campaign for them,0.0,1.0,0.0,0.0
joe biden has sold off more of our strategic oil than every past president combined,0.0,1.0,0.0,0.0
yet they never can say what biden has done criminally just a myriad of things,0.0,1.0,0.0,0.0
if you were struggling to find a job when joe biden was inaugurated struggling to pay family expenses after trumps disastrous covid policies you were helped immensely by child tax credit covid relief and the best job market in our lifetimes,0.203,0.613,0.184,-0.0
just the news judge orders fauci biden officials to be deposed in social media collusion case,0.0,1.0,0.0,0.0
my president joe biden is as smooth as tennessee whiskey,0.0,1.0,0.0,0.0
the average gallon of gas in the us was 225 when biden took office,0.0,1.0,0.0,0.0
hispanic unemployment is at an all time low thats a biden win,0.298,0.476,0.226,-0.0516
ever notice that it takes biden longer to leave a stage than to actually make a speechconfused much,0.074,0.926,0.0,-0.0516
thanks to biden we have the highest gas since carter was in office our military is on food stamps our southern border is wide open to anyone and yet poor joe continues to send billions of tax payer dollars to ukraine,0.069,0.867,0.064,-0.0516
joe biden the big guy doesnt want americans going back to trumps booming economy come on man,0.071,0.929,0.0,-0.0572
kevin mccarthy was asked if anyone in the biden administration has done anything that would cause him to consider impeachment he said he did not see it before him now he also said the people dont want impeachment for political purposes that the country needs to heal,0.026,0.974,0.0,-0.0572
join me in this campaign #bidenkilledintigray simple as that biden hasnt said a word about a million being slaughtered by his allies the uae turkey along with abiy just repeat #bidenkilledintigray we all see him strategically ignoring but he wont live this genocide off,0.043,0.921,0.037,-0.0644
just in federal court blocks president bidens student debt relief program,0.284,0.516,0.2,-0.0772
has joe biden cured cancer like he promised yet,0.286,0.39,0.325,-0.1027
im seriously tired of the spoiled us media criticizing bidenlike were still the same rich prosperous country as in the 1950swake up for fuck sakemany of our cities look like 3rd world compared to japanchinaaustralia and europetrying to repair 40 years of trickledown0,0.19,0.645,0.165,-0.1027
