,neg,neu,pos,compound
sounds like rdna 3 has a whole new encoder setup so itll be interesting to see people dig into that and see how it goes its also great theyre getting all these technical partnerships around their encoders which should help improve things as well,0.0,0.676,0.324,0.9457
i agree that rt is important rumor is the increase in rdna 3 over 2 is more than double in rt i guess well have to wait and see i would say that if the 7900xt was 90 of the rt perf of 4090 and cost like 1000 it would be a great alternative,0.0,0.733,0.267,0.9231
"its hard to believe but they did it with rdna 2

every single review said they didnt

here is the latest review from tpu 6950xt review so that drivers are more recent than say directly looking at launch reviews the most efficient rdna 2 card 6600 is 33 more efficient than the most efficient rdna 1 card 5600xt",0.019,0.789,0.192,0.9219
i know but the fact that best known leakers keep saying that its a good sign mark my words rdna3 will have the same price treatment as zen4 no price bump meaning that 7900xt msrp will be the same as 6900xt and so on amd needs to make the 4080 and 4090 irrelevant for its price if the performance its right there things will get interesting,0.037,0.789,0.174,0.9081
i understand almost nothing of what you wrote here but i can tell that youre pretty passionate about it and thats why i read through the whole thing 1010 would read your rdna 3 impressions when it comes out ,0.0,0.74,0.26,0.9052
"very interesting points

only one question

while im gathering a good sense of real potential for rdna3 to be a powerperformance monster why should we be thinking theres a really good chance it will also exceedor even matcha 4090s performance at the top especially in the allimportant it would seem to have become ray tracing metrics",0.0,0.789,0.211,0.8973
av1 hardware encoding is coming and that will help this a lot it will be a big step up from nvenc intel arc cards support av1 and i have heard rdna3 will as well we just need twitch and youtube and the streaming platform software like obs to open av1 streaming support,0.0,0.776,0.224,0.8934
"yea raster performance is way more important since not even 3080 rtx can run rt in any decent way

i do hope rdna3 will be able to run rt way better than 3000 series so maybe we will have rt that is worth running if performance is good",0.0,0.768,0.232,0.8932
okay very nice tbf i am more looking forward to handheld pcs like a new steam deck with a zen4rdna3 apu so maybe phoenix is going to be the best bet for that,0.0,0.69,0.31,0.8932
the 4080 being priced at an eyewatering 1200 usd kinda suggested to me that rdna3 wouldnt be anything terribly exciting and it looks like both companies have decided to hold hands and release the top models only at the beginning big yawn energy,0.0,0.752,0.248,0.8891
"the 2080 super is a gen older and a less powerful gpu overall

literally proving my point that rdna2s ray tracing cost is higher and rdna3 realistically wont match ampere there

the circlejerk is too strong right now",0.0,0.773,0.227,0.866
"n6 is just a improved version of n7 you wont see large frequency gains either

the original 6900xt just boosts to 2223ghz on average even if amd arent improving clocks the latter rdna2 chips already have around 500mhz better clocks than that
 ",0.046,0.695,0.258,0.8647
i see fair i hope rdna3 is good for sure,0.0,0.278,0.722,0.8555
"amd are currently pretty competitive on features everything is slightly worse but theyre all there and perfectly usable

rdna 3 is meant to come with av1 as well so the disadvantage amd currently has with their encoders should be minimised its only really cuda they cant compete with if it lives up to the other 2x perf increase in rt",0.083,0.714,0.204,0.8329
iirc the complete architecture overhaul will take place on rdna 4 according to rgt rdna 3 is simply an enhanced and improved rdna 2 im not too hot to upgrade the av1 encoding support might be something that might interest me though,0.0,0.804,0.196,0.8316
why they probably better of allocate more 5nm capacity for zen 4 rdna3 shares the same node as zen4 zen4 is far more profitable,0.0,0.707,0.293,0.807
amd did a good job with these two rdna3 cards reasonable pricing and great specs that 7900 xt will be mine,0.0,0.72,0.28,0.7906
i dont personally believe these but there are also wild rumors circulating about rdna3 things like 4ghz clock which would blow away 4090 if true since navi31 also has 24x shader count over navi21 6900xt,0.0,0.822,0.178,0.7876
"on raytracing and dlss i expect the rdna3 to match dlss 2x but not dlss 3 which is just fine and well since dlss 3 is more of an interpolation i dont consider those real frames

and i fully expect that interpolation to be hacked and applied to non 4000 series cards and maybe even amd cards though its really just a bonus point",0.053,0.799,0.148,0.7556
"steam survey for example rtx 30 cards have more than 10 times the share of rdna

amd can always redirect wafers towards zen chiplets thats where their best money maker is in epycs and tr pro rdna is at the bottom of their totem pole in terms of per mm2",0.0,0.882,0.118,0.7506
its on the same node as zen 4 its impossible to do a 11 comparison between the cpu and gpu but the efficiency of zen4 at lower power levels on the same node rdna 3 is being made on is an indicator they may have extremely good efficiency at lower power levels ,0.093,0.729,0.179,0.7343
i hope rdna 3 is a success because it would mean a world of oportunity for designs similar to the m1 family but even more flexible,0.0,0.728,0.272,0.7261
i think this time amd could undercut nvidia real good amd is still using gddr6 and a slightly cheap node compared with tsmc n4 it all depends on how much profit wants with rdna3 and obviously how it will be fare against the 4000 series,0.0,0.876,0.124,0.7003
"early roadmaps rdna2 was called navi 2x and rdna3 called navi 3x its pretty clear what goals they had in mind

going to 5 nm chip lets with io dies being separate and a doubling of comoute units id be suprised if they dont hit double performance",0.0,0.881,0.119,0.7003
keep in mind that 4k will probably be better than expected on rdna3 over rdna2 if its true that navi31 uses a bigger bus,0.0,0.787,0.213,0.6908
im hoping rdna3 atleast comes within 7080 of adas rt performance if amd could do that id definitely consider switching,0.0,0.766,0.234,0.6705
rdna3 got rid of most 3d engine components making them all shaders instead makes more sense to me idk how dedicated cores is supposed to be better really,0.043,0.774,0.183,0.6705
i missed the stream but i know that fsr 3 was a highlight and im not going to upgrade from my 6800 yet did they say what the improvements to fsr 3 was and if its locked to rdna 3 is it faster than fsr 2,0.037,0.825,0.139,0.6652
pretty much likely as a 3090 user since launch this time nvidia went too far specially the 4080 segmentation is a joke waiting to see the amd reveal of rdna 3 and probably getting a 7900xt and a 7950x,0.0,0.856,0.144,0.6597
"the topped out board power period possible for rdna3 is 450w

this is interesting whats convinced you so",0.0,0.748,0.252,0.6597
agreed i think the only scenario would be with some perfect setupzen 4x670erdna3direct storagesam a game developed to exploit it all,0.06,0.69,0.25,0.6597
rdna 2 traded blows and flat out beats nvidias best with rdna 2 rdna 3 is shaping up to be an even bigger leap,0.0,0.826,0.174,0.6369
"if youre not at 4k theres really not much reason to be sniffing around the 40804090s

if you are at 4k though and demand 120hz well youre going to pay for it i am definitely in the market for 4k 120hz but am going to wait and see what rdna3 looks like",0.044,0.835,0.121,0.6369
ive gone full fanboy over rdna3 lately i love reading these leaks,0.0,0.704,0.296,0.6369
"not really it depends on how the rt is implemented even now most of the times in 4k the performance hit is not worth it even with 4090 also 3070 cannot handle 4k60 even without rt

lastly rdna 3 is rumored to have much better rt performance than 3000 series so i would say definitely keep an eye out for the reviews",0.026,0.883,0.091,0.6367
" thanks to nicehash my 3 kids and i all have ampere cards and we are all very happy with performance

ill wait for rtx5xxx or rdna4",0.091,0.684,0.225,0.624
"all while amd clearly built rdna3 to be costeffective more than anything

and honestly i think that was the right move were heading into a recession and i like to make the savings where i can especially when the performance hopefully wont be too much worse",0.112,0.682,0.206,0.6124
"there is a reason why amd waited on nvidia for pricing amd will most likely give us 50 discounts compared to nvidia for same level performance in these higher tiers

it would be funny if fsr 30 releases with rdna 3 and with interpolationfake frames as well",0.0,0.896,0.104,0.6124
cannot wait to see what rdna3 brings might be the only upgrade i get this year although i have been really happy with my rx6800 reference card ,0.0,0.857,0.143,0.6115
isnt this like the exact same situation as with rdna2 vs ampere rdna2 better at raster 2x slower at rt we can see from the steam hw survey how the market responded to that rtx 30 series is 12x more popular than rx 6000 series,0.042,0.838,0.12,0.5971
if rdna3 has good performance at significantly lower power draw i think they win this round even if they dont top the charts i dont think people want to have to install 3 slot coolers and smoking power cables,0.117,0.726,0.157,0.5699
its exactly like ive been trying to warn people rdna3 and the chiplet design isnt built for maximum performance its built for incredible cost and space efficiency,0.046,0.789,0.164,0.5574
itll have frame generation similar to dlss3 unknown if itll be locked to rdna3 but the optimist in me wants to say no unless theres specific new hardware being added to support that feature theres no reason it couldnt also be done on 2 if its all software,0.099,0.758,0.144,0.5499
its likely that navi33 still hits 3ghz since its monolithic nah navi 33 is still on tsmc 6nm so while 3ghz isnt impossible theres no process benefit to get there above rdna2 either,0.039,0.827,0.135,0.5405
i wouldnt say 1015 overall is that big of a margin though its pretty clear that some games really dont like rdna3 so we will see,0.082,0.719,0.199,0.5286
yeah its going to be a joke how the 4090 had dp14 with hdmi21 and rdna3 has dp20 the former maxes out at 4k on dp while the latter only requires dp14,0.0,0.868,0.132,0.5267
it might not be far off imo rdna 3 could very well have a solid 4080 competitor for 600700,0.0,0.779,0.221,0.5034
"im surprised there havent been more substantial rdna3 leaks so far

edit im pretty sure ive seen this design leaked before though months ago the three red fins are pretty distinctive but i cant remember where i saw it",0.074,0.75,0.177,0.5016
for me amd needs to keep the 1080p and 1440p crown while figuring out the drop in 4k but even 5fps behind isnt a bad thing if the case for rdna 3,0.047,0.84,0.113,0.4981
"amds chiplet strategy first deployed in rdna3 while mixing fab nodes should minimize costs

they can make them in large amounts on the cheap and price could undercut nvidias cost not price but actual cost while remaining profitable

amd might cut margins and go for the marketshare this time around",0.048,0.847,0.105,0.4939
read it as launch rdna 3 to save the world probably not too far off though ,0.0,0.814,0.186,0.4939
i really hope they make some version of rdna 3 that doesnt have trashtracing,0.0,0.775,0.225,0.4927
whatever rdna3 results would end up with thats a really good analysis,0.0,0.758,0.242,0.4927
dude a 300watt rdna3 will easily beat the 4080 know why the 80 class of nv sucks this time so please dont insult rdna3 by suggesting it would lose to 7070ti class card,0.128,0.666,0.206,0.4866
i do wonder if the ic has been improved in rdna 3 where its basically doubling of ic with the same amount of mb,0.0,0.871,0.129,0.4767
"really hoping rdna3 can hit 60fps ray traced 1440p in cyberpunk thats my target and if they cant hit it im gonna have to go nvidia which i would rather not do

im getting 4550 with my 6800 so in theory it should be do able",0.0,0.934,0.066,0.4754
"perhaps the biggest factor of all rdna 3 is going to pack major heat

i hope you are right",0.0,0.847,0.153,0.4404
they should throw in rdna 3 adidas shirt for pre order upvote so amd sees it lol,0.0,0.843,0.157,0.4215
it will come to desktops eventually and yes it is officially confirmed to be rdna3,0.0,0.838,0.162,0.4019
"the flagship rdna3 card will have 12200 cores vs 6900 xt at 5120 thats a 138 increase

3090 had 105k cuda cores vs the 44k of the 2080 ti it didnt convert into performance while the details are unknown amd is doing a similar dualalu change here",0.0,0.921,0.079,0.4019
im most excited about rdna 3 apus,0.0,0.65,0.35,0.4005
im most excited about rdna 3 spaceships,0.0,0.65,0.35,0.4005
my hope is that they identified this problem early in internal rdna 2 testing so that they were able to do this much better rdna 3,0.104,0.702,0.194,0.397
they spent more time showing us ads for samsungs monitor games and trying to promote zen 4 than they spent talking about actual performance of rdna 3,0.0,0.902,0.098,0.3818
 it looks like rdna3 already implemented matrix accelerators,0.0,0.737,0.263,0.3612
"again by your own words if you cant predict perf then its useless marketing

yes but rdna 3 hasnt launched yet for rdna 1 and 2 its meaningful but we will have to wait until november to know if its not just marketing for rdna 3",0.075,0.822,0.104,0.3281
"yup people are forgetting how amd acted with zen 3 pricing and rdna 2 when they had room to charge more

amd is going to sell rdna 3 for as much money as possible youre not going to see a 7800xt for 650 the original 6800xt msrp it will probably be 750800",0.0,0.953,0.047,0.3182
i am pretty excited for rdna3 tbh especially after the rtx 40 fiasco,0.184,0.503,0.313,0.3182
announce that evga will join amd with rdna 3 ,0.0,0.761,0.239,0.296
dlss makes 60 fps with current cards possible i use a 3080 but if you can grab an rdna 3 card and it isnt overpriced junk like lovelace then thats probably the better option,0.075,0.817,0.108,0.2926
"rdna 3 is going to bring major rt improvements also im not arguing rtx 40 are bad cards the whole takeaway from my post is why i think rtx 40 pricing wont hold and will likely be the fastest depreciating lineup nvidia has ever released

i would also not underestimate amds fsr roadmap",0.062,0.819,0.119,0.2887
"its worth noting that amd is the 2nd largest tsmc 5nm customer and that the allocation isnt shared with the consoles in the market

of course it still depends on how much amd dedicates to rdna 3 vs zen 4 and cnda 3 yeah",0.046,0.861,0.093,0.2649
dont underestimate rdna 3s mcm designs though they beat nvidia to this futuristic technology which could give them a leg up,0.0,0.91,0.09,0.2235
in what sense your rdna 2 card wont stop working on nov 3rd,0.0,0.854,0.146,0.2235
"so was rdna1 vs 2 and it still got a massive clockspeed boost

but that doesnt mean that will happen again for rdna3",0.0,0.915,0.085,0.2144
it is 32 rdna3 cus not rdna2 ones you are comparing apples with oranges navi31 is rumored to have 96 cus and it will need to have double the performance of the 6900xt to be at the minimum competitive to nvidia offerings,0.0,0.96,0.04,0.1779
"rdna3 being a stellar architecture will lead to all sorts of good things though

all that is known is 50 higher performanceperwatt

there is no information on how stellar rdna3 architecture is",0.065,0.85,0.085,0.1779
rdna 3 gets launched on nov 3rd,0.0,0.769,0.231,0.128
rdna2 is still pretty far behind turing on rt performance i really doubt theyre matching ampere there they may not even match turing rt with rdna3,0.096,0.793,0.11,0.1045
i know mlid is a love or hate in this forum but hes been saying rdna 3 is double performance ages ago there had been leaks,0.091,0.809,0.1,0.0644
im pretty sure rumors of 2 gcds are dead for rdna3,0.256,0.417,0.327,0.0516
i think the 7900xt will come in at close to 400w and amd may reach for a card above that with 425 to 435w the topped out board power period possible for rdna3 is supposedly 450wfor reference lovelace peak possible board power is over 600w,0.0,0.974,0.026,0.0258
at last its surprising how amd manage to keep rdna3 leaks in check so close to the announcement in every other radeon gpu launch announcement at this point we had almost every specification leaked photos from cooler desing aib box covers,0.047,0.904,0.049,0.0164
keep rdna3 in mind,0.0,1.0,0.0,0.0
if you cant afford the 4090 wait to see how rdna3 fares against nvidia,0.0,1.0,0.0,0.0
when is the rdna3 and 4080 being released im looking to upgrade from a 1080 for vr,0.0,1.0,0.0,0.0
rdna 3 announcement is 113 with release tbd im expecting late nov or early dec 4080 is launching 1116 for 1200,0.0,1.0,0.0,0.0
thats the caveat but as far as cache size and memory bandwidth is concerned which is the theorized source of the different performances at different resolutions the roles are now reversed rdna 3 has more bandwidth and less cache than lovelace which doesnt really mean anything anyway,0.0,1.0,0.0,0.0
nvidias launch hyped the rdna3 offers,0.0,1.0,0.0,0.0
"1 its way denser and spaceeffective than ada

how is rdna3 denser than ada when their on the same node infact nvidia worked with tsmc for a custom n5 node",0.0,1.0,0.0,0.0
"you know ampere is the 3000 series right not the 4000 series

so rdna 2 matched the gen older from nvidia 2080 why cant rdna 3 match the gen older again 3080",0.0,1.0,0.0,0.0
"jesus keplerl2 on twitter talked about a lot of legacy fat trimmed off didnt expect this and a lot smaller ic wonder how the heck thatll be handled at 4k

i really wonder what the performance targets are still full fat n31 221x over the 6900xt 2223x 2425x do rdna 3 tflops rdna 2 tflops in gaming what wattage",0.0,1.0,0.0,0.0
more likely scenario is an rdna3 refresh with stackedcache and maybe moving the gcd to n4 node for higher clocks,0.0,1.0,0.0,0.0
rdna 3 also seems to be halving fp64 if the article is correct,0.0,1.0,0.0,0.0
"could this be 3 in a row

zen 4 september raptor lake and ada october rdna 3 november",0.0,1.0,0.0,0.0
amd dont fuckup gpu prices with rdna3,0.0,1.0,0.0,0.0
they announced rdna3 apus,0.0,1.0,0.0,0.0
phoenix zen4 rdna3 coming next year,0.0,1.0,0.0,0.0
ahh but that is for laptops i thought they were going to announce apus for desktops also have there been cinfirmation that phoenix will come with rdna 3,0.0,1.0,0.0,0.0
i will say if i was to choose between 30 and amd rn id get a 6950 xt or 6900 i have a lg cx all depends on performance of rdna 3 and 80 series,0.0,1.0,0.0,0.0
now we need 16gb 7800xt 1315x of 6900xt at 699 12gb 7700xt 1x11x of 6900xt at 480 10gb 7600xt 08x09x of 6900xt at 349 and fsr 3 working on rdna2,0.0,1.0,0.0,0.0
i would rather have more raster power than rt in rdna3,0.0,1.0,0.0,0.0
"when amds david wang discussed the companys rdna 3 graphics architecture at their 2022 financial analysts day wang stated that rdna 3 would feature rearchitected compute units that would enhance ray tracing capabilities

looks to be more information was verbally given besides the slides at the amd financial analyst day 2022",0.0,1.0,0.0,0.0
"op said amd withheld their claims

for rdna 3 can you quote me saying that i said for rdna12 and specifically the flagships",0.0,1.0,0.0,0.0
"right now a lot of the high resolution benchmarks are showing to be gpu bounded

this means cpu upgrades are near pointless lets wait to see the 40xxrdna3 benchmarks which will be less gpu bound",0.0,1.0,0.0,0.0
"and guess what i will now randomly compare the fpsw of the 3070 to the 480w sku of the 6950xt sapphire

the 3070 is 46 more efficient than rdna 2

end of discussion

see how stupid that sounds pure marketing",0.08,0.847,0.073,-0.079
fsr3 is not exclusive to rdna3 it is coming to rdna2,0.12,0.88,0.0,-0.0951
"on rdna3 only the gcds are made on tsmcs n5 and those are rather small 300mm2 on the top end n31 200mm2 on n32 the mcd chiplets are made on the much cheaper n6 and theyre tiny less than 40mm2 small chips more chips per wafer and higher yields
 amds chiplet approach allows them to make more graphics cards with a lower amount of wafers",0.033,0.939,0.027,-0.1027
people found some matrix instructions in the linux drivers for rdna 3 so i would not be surprised either,0.094,0.906,0.0,-0.1695
since amd presented the numbers for rdna 3 as a whole if there are both monolithic and mlm gpus its probably the monolithic thats around 50 im assuming mlm designs will be meaningfully more efficient than that,0.12,0.802,0.078,-0.1796
rdna 3 should be adequate for the job not the best but frankly the costtoperf should be reasonable,0.117,0.805,0.078,-0.1862
you cant compare shaders like that across archs or atleast i tried before with rdna2 and didnt real work as well too many unknown variables ipc clocks cu count etc the n31 die supposedly has 96cus which are likely improved compared to n21n22,0.122,0.772,0.106,-0.2047
hey lisa im rdna3 your latest uarch i cant wait to entertain you,0.151,0.849,0.0,-0.2411
" rdna 3 has more bandwidth and less cache than lovelace

not really true it has 96 mb of llc just like lovelace and memory speeds havent been confirmed if it ends up being gddr6 20gbps its still lower bandwidth than lovelace",0.107,0.836,0.056,-0.3069
rdna2 loses a lot of performance at 4k so the 3090 ti leaves it behind ,0.15,0.85,0.0,-0.3182
"only rarely they go through a transistor upgrade without an architectural upgrade and when they do it is usually only for 1 generation

because of how similar rdna 2 is to rdna 1 the probability of continuing with the same architeture in rdna 3 is very low",0.055,0.945,0.0,-0.3384
i meant which credible leak said rdna3 is 3 times rdna2 performance,0.211,0.789,0.0,-0.34
that rdna3 adidas shirt is fire,0.324,0.676,0.0,-0.34
"comparing to the worst card in the rdna 1 lineup 5700xt

thats the only way you get those numbers compare to the 5600xt and you get anywhere from 2535 but never 50 higher perfw",0.074,0.926,0.0,-0.3716
"and when it was comparable to 3090 it was front and center in their benchmarks when rdna2 released with exact percentages

this go round only compared to 6950xt with vague comparisons and no exact settings",0.098,0.902,0.0,-0.3818
"this is 7900 nonxt the lowest sku of the navi 31 chip which is the biggest chip in the rdna3 lineup and is launching first

this is a guess from whycry i dont think we actually know what this card is who even said there is a 7900 nonxt",0.055,0.945,0.0,-0.3818
the phrasing is really bad but there is no chance they are launching november 3rd if the partners were already working on the rdna 3 aibs something would have leaked by now curious to see what we can expect,0.175,0.708,0.117,-0.4012
the fact that raytracing in general is mentioned very little with rdna3 should tell everyone it will not be impressive in that aspect,0.109,0.891,0.0,-0.4023
ive digested a lot of tech info over the last year and i dont think the rumors are wild at all i have little doubt rdna 3 is going to be a major pita for rtx 40 especially when amd has bigger profit margins to work with,0.118,0.821,0.061,-0.4033
"this post gets basically all the model numbers and chip names wrong lol

this is 7900 nonxt the lowest sku of the navi 31 chip which is the biggest chip in the rdna3 lineup and is launching first",0.131,0.805,0.064,-0.4404
"so many rumours of 3035ghz clock speeds didnt hold any water i guess

yup had to eat crow there not sure why amd got stuck at rdna2 speeds with the new node while nvidia have again taken the lead",0.099,0.901,0.0,-0.4519
6950xt launched at 1000 and traded blows with the 1500 3090 i have no doubt amd will do it all over again with rdna 3,0.179,0.763,0.057,-0.4939
in many cases rdna2s performance might drop off at higher resolutions because with larger data sets you run the risk of lower l3 cache hit rates when that happens it means more accesses to the comparatively slow vram and overall slower performance can mean somewhat higher power draw as well,0.117,0.844,0.039,-0.5106
amd hasnt lied lately and they did claim gpu leadership with rdna 3 some time ago they have the mcm ace up their sleeves to really murder the high end time will tell soon enough not long to wait ,0.116,0.834,0.051,-0.5871
"your mind is in the right place rdna 3 has potential to be extremely disruptive if they can 2x performance of each previous sku and price aggressively even a 7800 xt might match the 4090 in raster

edit should clarify the 7800 xt could match 4090 in raster in some cases",0.094,0.906,0.0,-0.5984
 my understanding is that rdna 2 is classified as level 2 and ampere as level 3 im not sure why other than several things i have read in the past that indicate some sort of bvh processing deficiency those sources could have been wrong i dont recall what articles i read that mentioned that,0.099,0.901,0.0,-0.6202
"are we looking at different cards right now rdna3 pricing is completely murdering the 4080 and to a big extent the 4090 too

it wont match or beat it but its mostly there for 600 lower msrp",0.141,0.859,0.0,-0.6805
today ill decide whether or not ill get a 68006900xt or wait for rdna 3,0.337,0.663,0.0,-0.6808
" no no no nobody has said there will be new rt units

it would be a lie if they publicly claim there will be enhanced rt capabilities and release the same rt units with rdna3",0.176,0.824,0.0,-0.6808
rdna 2 wasnt that secret there were lots of information available on makes models it was a tad late but rdna 3 has been closely guarded it has driven nvidia to unseen levels of paranoia of losing the crown not seen in a decade,0.134,0.866,0.0,-0.7096
