,neg,neu,pos
"my hyper evo 212 wasnt good enough for this processor it runs hot with turbo mode on so ive disabled it for its rated 38ghz clockspeed go with a higher range cpu cooler for this one if you want to use 100 of the cpu

still fast tho best cpu ive bought to date will absolutely get a new cpu cooler to get the max usage of it",0.7210000157356262,0.24199999868869781,0.03700000047683716
didnt even work,0.734000027179718,0.24300000071525574,0.024000000208616257
burns at over 100 degrees celsius if used with a bad cooling solution i bought the zoomflow aio i thought the processor was bad turned out the aio was a dusld which almost fried my motherboard i uninstall aio and put in my 17 quid aircooler from 100 degrees idle to 33 thank goodness it was aio and not chip i am now windows 11 ready i recommend,0.8190000057220459,0.1589999943971634,0.023000000044703484
broken on arrival,0.8410000205039978,0.13600000739097595,0.023000000044703484
"this is a replacement for a faulty one i got from amazon if this one doesnt work i will never buy components from amazon again
products that have been tampered with should not be sold as new i have to use this now as i have my pc in a shop and there waiting for this
i will keep you posted on outcome",0.8600000143051147,0.1289999932050705,0.012000000104308128
i tried to put it in a intel motherboard and the pins where the same so i customised it and bent all the pins so it would fit still doesnt work though very disappointed,0.7860000133514404,0.20200000703334808,0.010999999940395355
for me ryzen products seem very fussy with which components they do and dont want to work with i spent about 7 years with amd and these new ryzen have made me switch to intel,0.8339999914169312,0.15600000321865082,0.009999999776482582
both times i ordered from the seller the item was faulty,0.8220000267028809,0.16899999976158142,0.008999999612569809
dont buy from techdealz my chip arrived damaged with several pins bent and when installing the cpu before checking pins the motherboard will not postboot with a solid orange cpu fault light,0.8859999775886536,0.10599999874830246,0.00800000037997961
product arrived dead tried to return first with courier pickup hermes had to wait from 23121301 no pick up cancelled this return and tried again via locker drop of still waiting for refund experience has not been ideal,0.9259999990463257,0.0689999982714653,0.006000000052154064
arrived damaged in a damaged box and when i returned it the next day the price had risen £1000 or so and therefore i had to pay for it again while i waited for my refund instead of being offered a replacement very very very frustrating,0.9150000214576721,0.07999999821186066,0.004999999888241291
